rank,velocity,raw_score,age_hours,platform,spike_type,title,author,url,comments
463,0.0,3,224.1,hn,tutorial,Show HN: Version 1.0 of agent-of-empires CLI agent orchestration tool,river_otter,https://www.agent-of-empires.com/,
464,0.0,3,227.0,hn,tutorial,Show HN: //Beforeyouship is a pre-build tool to estimate the LLM cost,indiegoing,https://llm-architecture-cost-modeler.vercel.app/,
465,0.0,2,229.9,hn,tutorial,Show HN: Book Grounded AI Learning,techypicky,https://teach-me.replit.app/,
466,0.0,2,232.2,hn,breakthrough,Show HN: Agent Ruler new update v0.1.9,steadeepanda,,
467,0.0,6,234.4,hn,tutorial,Ask HN: Has Claude Code quality level degraded lately?,narmiouh,,
468,0.0,3,236.6,hn,tutorial,Show HN: Vectimus – Cedar policy enforcement for AI coding agents,JXavierH,https://github.com/vectimus/vectimus,
469,0.0,1,241.3,hn,breakthrough,Ask HN: Google Antigravity quota issues on AI ultra plan – glitch or tightening?,anbmz,,
470,0.0,2,241.9,hn,tutorial,Show HN: Got a tough conversation coming up? This AI app will help you prepare,ddesposito,https://toughconversations.app/,
471,0.0,3,241.9,hn,breakthrough,Claude Code gets 'safer' auto mode,datadrivenangel,https://www.theverge.com/ai-artificial-intelligence/900201/anthropic-claude-code-auto-mode,
472,0.0,4,242.4,hn,breakthrough,Anthropic's Claude can now control your Mac,devonnull,https://venturebeat.com/technology/anthropics-claude-can-now-control-your-mac-escalating-the-fight-to-build-ai,
473,0.0,2,244.9,hn,breakthrough,AI Agent action safety is not covered yet,praneeth-v,,
474,0.0,3,246.3,hn,breakthrough,AI agents are now deciding what's safe to run (Claude Auto Mode),edf13,https://grith.ai/blog/claude-auto-mode-removes-prompts-not-risk,
475,0.0,2,246.7,hn,breakthrough,Claude down.Global coding output just dropped,bakigul,https://downdetector.tr/durum/claude-ai/,
476,0.0,2,248.1,hn,tutorial,Show HN: FlowScript – Agent memory where contradictions are features,phillipclapham,https://github.com/phillipclapham/flowscript,
477,0.0,1,248.5,hn,personal,"Show HN: Clinic – Connect your agent to Gmail, GitHub, Notion and 39 more (OSS)",jvictor118,https://github.com/jwvictor/clinic,
478,0.0,1,249.2,hn,tutorial,Ask HN: What are some ways you have limited AI slop,grahammccain,,
479,0.0,2,252.2,hn,breakthrough,MCS: Reproducible AI Infrastructure for Claude Code,bguidolim,https://mcs-cli.dev,
480,0.0,2,252.5,hn,tutorial,"Show HN: Dirsv – dir browser, battery packed Markdown previewers",letientai299,https://github.com/letientai299/dirsv,
481,0.0,2,253.8,hn,breakthrough,Death by Clawd: Scan your business mortality with ClaudeAI,KellyCriterion,https://deathbyclawd.com,
482,0.0,1,260.9,hn,meme,ACPX Inside Claude Code: Practical Multi-Agent Orchestration,ErwanLP,https://casys.ai/blog/acpx-multi-agent-orchestration,
483,0.0,4,262.9,hn,breakthrough,"History of transportation: dominant modes and innovations, 1600-2100, by decade",legel,https://claude.ai/share/43e9753a-caa4-499d-bcef-f9f1eac2f439,
484,0.0,3,262.9,hn,tutorial,Show HN: Origin – Git blame for AI agents (track which AI wrote every line),dolobanko,https://getorigin.io,
485,0.0,4,266.2,hn,breakthrough,Claude Code: Auto Mode,tosh,https://twitter.com/claudeai/status/2036503582166393240,
486,0.0,2,266.2,hn,personal,Show HN: TrailTool – open-source CLI for querying CloudTrail data with AI agents,alexsmolen,https://github.com/engseclabs/trailtool,
487,0.0,10,266.8,hn,meme,Show HN: Skub – a sliding puzzle browser game,kasperstorgaard,https://skub.app,
488,0.0,1,267.4,hn,breakthrough,Show HN: Haiku and Codeset > Raw Opus,andre15silva,https://codeset.ai/blog/improving-claude-code-with-codeset,
489,0.0,8,268.4,hn,breakthrough,We Built a Claude Agent That Doesn't Know Its Own API Keys,oelmgren,https://listenlabs.ai/blog/we-lied-to-our-claude-code-agent,
490,0.0,7,268.9,hn,breakthrough,Geography of Claude Code,oss_fan,https://johanneswachs.com/AIcodemap/,
491,0.0,2,270.4,hn,breakthrough,Designing a Test Runner for Claude Code,eagerpace,https://www.pureinference.com/insights/designing-a-test-runner-for-ai-agents,
492,0.0,1,270.7,hn,tutorial,Show HN: Claude-replay – Video-like player for AI coding sessions (web UI),es617,https://es617.dev/claude-replay/,
493,0.0,1,270.9,hn,tutorial,Show HN: Glanceway – A programmable menu bar info aggregator for macOS,codytseng,https://glanceway.app,
494,0.0,2,272.1,hn,comparison,LLM drift-Claude vs. Calmkeep: 25-turn Code (60% vs. 85%) & Legal (50% vs. 100%),calmkeepai,https://calmkeep.ai/codetestreport,
495,0.0,3,273.5,hn,tutorial,Show HN: Danube – AI Tools Marketplace,preston25,https://danubeai.com,
496,0.0,1,273.8,hn,tutorial,Show HN: Using Claude Code history to predict your next messages while you sleep,yaoke259,https://workovernight.com,
497,0.0,1,274.5,hn,breakthrough,Coding After Coders: The End of Computer Programming as We Know It,nguyentranvu,https://www.nytimes.com/2026/03/12/magazine/ai-coding-programming-jobs-claude-chatgpt.html,
498,0.0,2,281.9,hn,tutorial,AI coding tools have broad filesystem and network access,shadag,,
499,0.0,4,285.9,hn,breakthrough,You can now enable Claude to use your macOS computer to complete tasks,doener,https://xcancel.com/claudeai/status/2036195789601374705,
500,0.0,7,286.7,hn,breakthrough,GSA extends comments on AI clause after industry pushback,petethomas,https://fedscoop.com/gsa-extends-comments-on-sweeping-ai-clause-after-industry-pushback/,
501,0.0,2,288.2,hn,breakthrough,Fixing Claude with Claude: Anthropic reports on AI site reliability engineering,sylvainkalache,https://www.theregister.com/2026/03/19/anthropic_claude_sre/,
502,0.0,2,290.2,hn,breakthrough,Show HN: Cronbox – Schedule AI Agents,mkagenius,http://cronbox.sh/,
503,0.0,3,292.2,hn,tutorial,Ask HN: How do you handle PR density (and slop) in open source,ofermend,,
504,0.0,3,293.0,hn,breakthrough,Codex with GPT-5.4 vs. Claude Code with Opus 4.6 – Why I Now Use Both,chandlernguyen,https://chandlernguyen.com/blog/2026/03/13/codex-gpt-5-4-vs-claude-code-opus-4-6-dual-wielding-ai-coding-tools/,
505,0.0,5,293.8,hn,meme,Show HN: Urlx – an agent-made Rust replacement for curl/libcurl,jawiggins,https://github.com/jonwiggins/urlx,
506,0.0,2,293.9,hn,breakthrough,AI Chief of Staff,Rafsark,https://github.com/mimurchison/claude-chief-of-staff,
507,0.0,2,295.6,hn,breakthrough,I probably spend more than my salary on Claude,mizzao,https://www.nytimes.com/2026/03/20/technology/tokenmaxxing-ai-agents.html,
508,0.0,1,295.8,hn,tutorial,Show HN: Kage – TUI for managing multiple AI agents with tmux and Git worktrees,sean0628,https://github.com/Sean0628/kage,
509,0.0,2,296.0,hn,meme,I built a tool that asks developers questions about their own PRs,jbethune,,
510,0.0,2,297.1,hn,breakthrough,These coders want AI to take their jobs,gloxkiqcza,https://www.vox.com/podcasts/483368/vibe-coding-ai-software-claude-codex-gemini-explained,
511,0.0,1,298.0,hn,breakthrough,Claude Usage Monitor – macOS menu bar app to track Claude.ai usage,danbutuc,https://github.com/theDanButuc/Claude-Usage-Monitor,
512,0.0,4,299.4,hn,meme,Show HN: Self-hostable AI agents and internal software,seyz,https://github.com/RootCX/RootCX,
513,0.0,2,300.1,hn,breakthrough,Product Management on the AI Exponential,tablet,https://claude.com/blog/product-management-on-the-ai-exponential,
514,0.0,1,301.0,hn,breakthrough,"VistAI–Save and Search AI Responses from ChatGPT, Claude, Gemini, and Perplexity",cbvinodvijay,https://vistai.org,
515,0.0,2,301.3,hn,tutorial,Emdash: Open-Source Agentic IDE for Orchestrating Multiple Coding Agents,steveharing1,,
516,0.0,1,303.0,hn,breakthrough,"Show HN: Fixy – Real-time group chat with humans and AI agents (GPT, Claude,..)",frdfrd,https://fixy.ai/,
517,0.0,9,304.3,hn,breakthrough,The Trillion Dollar Race to Automate Our Lives,thm,https://www.wsj.com/tech/ai/claude-code-cursor-codex-vibe-coding-52750531,
518,0.0,2,306.5,hn,breakthrough,"Show HN: Sandbox-policy-builder, helper for Vercel Sandbox credentials brokering",toyamarinyon,https://github.com/giselles-ai/sandbox-policy-builder,
519,0.0,3,308.0,hn,comparison,What would you do if you have AI software that may be transformers alternative?,adinhitlore,,
520,0.0,7,308.1,hn,tutorial,Ask HN: How much are you spending on AI coding at work?,habosa,,
521,0.0,2,308.2,hn,breakthrough,Simple Git Branching/Weekly Summary Claude Skills,daltonlcarr,,
522,0.0,2,308.3,hn,meme,Show HN: AI models AI capex,liujjw,https://ai-capex-sens-wxc4b.ondigitalocean.app/,
523,0.0,2,317.2,hn,tutorial,Show HN: Bossa – Persistent filesystem memory for AI agents via MCP or CLI,vinny380,,
524,0.0,1,323.5,hn,comparison,Show HN: Neurotrace – The extension I built but never used,CastleOneX,,
525,0.0,1,328.7,hn,tutorial,"Show HN: Jensenify-MCP: ""Every engineer should spend $250k/yr on tokens"" –solved",hank2000,https://github.com/kenm47/jensenify-mcp,
526,0.0,1,331.5,hn,tutorial,Show HN: How I built a resume editor using AI with zero web dev experience,KasparSoukup,https://www.tailortojob.app/,
527,0.0,1,332.0,hn,breakthrough,I built an AI teammate that takes Jira tickets and turns them into PRs,tuananhdao,https://github.com/ignify-rd/claude-teammate,
528,0.0,5,333.0,hn,breakthrough,Show HN: ClawMem – Open-source agent memory with SOTA local GPU retrieval,yoloshii,https://github.com/yoloshii/ClawMem,
529,0.0,2,336.4,hn,breakthrough,"Claude Code workspace trust dialog bypass, settings loading order CVE-2026-33068",raxe,https://raxe.ai/labs/advisories/RAXE-2026-040,
530,0.0,2,338.5,hn,tutorial,Your model quality is tied to a business model,Ricky_Tsou,,
531,0.0,2,339.1,hn,breakthrough,Anthropic Denies It Could Sabotage AI Tools During War,joozio,https://www.wired.com/story/anthropic-denies-sabotage-ai-tools-war-claude/,
532,0.0,2,343.4,hn,breakthrough,Claude × Codex Collab Two AI Coding Agents. One Orchestrator. Zero API Costs,ncvdv,https://github.com/AlessioZazzarini/claude-codex-collab,
533,0.0,4,343.5,hn,tutorial,Show HN: Deterministic security solution for AI agents – OpenClaw and 2 more,steadeepanda,,
534,0.0,4,344.4,hn,breakthrough,The Trillion Dollar Race to Automate Our Entire Lives,bookofjoe,https://www.wsj.com/tech/ai/claude-code-cursor-codex-vibe-coding-52750531,
535,0.0,1,348.5,hn,tutorial,Show HN: Historical Atrocities Database,cittadhammo,https://claude.ai/public/artifacts/b60a8f2e-cc65-47b2-b852-d5f350182692,
536,0.0,7,349.5,hn,personal,Sexual Harassment by Japan Railways Staff and Japan's Accessibility Barriers,LemurianHiro,,
537,0.0,1,353.7,hn,tutorial,Show HN: An open-source AI Scrum Team that lives natively in GitHub Issues,dongjiewu,https://github.com/plusai-solutions/ai-scrum-master-template,
538,0.0,2,356.6,hn,meme,Show HN: Pairform Running – Great AI coaching with excellent fitness context,pairform,https://www.pairform.io/,
539,0.0,3,361.0,hn,tutorial,Show HN: OpenHarness – Open-source TypeScript SDK for building AI agents,MaxGfeller,https://github.com/MaxGfeller/open-harness,
540,0.0,3,362.5,hn,breakthrough,I spoke to AI agent Claude [video],petemill,https://www.youtube.com/watch?v=h3AtWdeu_G0,
541,0.0,4,362.9,hn,tutorial,Show HN: Launch an AI agent swarm for ARC-AGI-3 with plain-English prompts,surferbayarea,https://arc-agi-swarm.vercel.app/,
542,0.0,2,363.5,hn,tutorial,Show HN: Skillcop: Block malicious Claude Skills before they execute,bennydog224,https://github.com/cfitzgerald-pd/skillcop,
543,0.0,2,364.4,hn,breakthrough,Show HN: Etnamute – local AI mobile developer that runs on Claude Code,bes-dev,https://github.com/bes-dev/etnamute,
544,0.0,12,364.5,hn,tutorial,"Show HN: LiteParse, a fast open-source document parser for AI agents",freezed8,https://github.com/run-llama/liteparse,
545,0.0,5,365.8,hn,comparison,What Codex Chooses (Vs Claude Code),thestackfox,https://amplifying.ai/research/codex-vs-claude-code-picks,
546,0.0,1,367.4,hn,tutorial,Show HN: Agent Package Manager (APM) for Agent Configuration,danielmeppiel,https://github.com/microsoft/apm,
547,0.0,2,368.5,hn,breakthrough,My Rails harness for autonomous AI coding with Claude Code,marcinos,https://rubyonai.com/my-harness-how-i-stopped-babysitting-ai-and-went-kitesurfing/,
548,0.0,3,370.0,hn,tutorial,Show HN: I built a super simple email reminder inspired by the RemindMe! bot,santah,,
549,0.0,9,370.8,hn,breakthrough,Bernie Sanders: I spoke to AI agent Claude [video],epaga,https://www.youtube.com/watch?v=h3AtWdeu_G0,
550,0.0,1,372.3,hn,meme,Role-based AI persona packs for Claude Code and Cursor,ratnesh_maurya,,
551,0.0,2,373.7,hn,tutorial,Show HN: I built an AI agent that does marketing for my apps,akhrail1996,https://asaagent.xyz,
552,0.0,2,374.4,hn,tutorial,Claude Code Commands That Improve Developer Workflows,Greeeeg,https://www.toolmesh.ai/news/unlocking-claude-code-hidden-features-advanced-commands,
553,0.0,2,375.4,hn,breakthrough,"Fixy – Real-time group chat with humans and AI agents (ChatGPT, Claude, Gemini)",frdfrd,https://fixy.ai/,
554,0.0,13,382.4,hn,breakthrough,I Spoke to AI Agent Claude – Sen Bernie Sanders,timetraveller26,https://www.youtube.com/watch?v=h3AtWdeu_G0,
555,0.0,13,383.9,hn,tutorial,"Tell HN: If working with agents means this, robots, please take my job",tiredagent,,
556,0.0,7,384.3,hn,comparison,Show HN: We Built Kaggle for AI Agents,deviscold,https://hive.rllm-project.com/,
557,0.0,3,384.6,hn,breakthrough,We Made Haiku as Good as Opus. Improving Claude Code with Codeset,andre15silva,https://codeset.ai/blog/improving-claude-code-with-codeset,
558,0.0,2,385.1,hn,breakthrough,Show HN: I documented how we ranked #1 on ChatGPT in 45 days with $0,hassanyassine,https://getbrazilvisa.com/ai-visibility-playbook,
559,0.0,5,386.8,hn,breakthrough,Show HN: Hopsule – Persistent Memory Layer for AI Engineering,firatcan,https://hopsule.com/,
560,0.0,3,387.4,hn,breakthrough,Ask HN: What do you think about Claude going down every day now?,scratchyone,,
561,0.0,2,388.1,hn,personal,Ask HN: How do you work in teams with AI tools?,vjvjvjvjghv,,
562,0.0,2,388.2,hn,breakthrough,"Show HN: Perstack – Containerized harness, 5 tests with full logs and API cost",FL4TLiN3,https://github.com/perstack-ai/perstack,
563,0.0,1,389.0,hn,breakthrough,Show HN: Import Your AI Memory into ContextForge,alfredoizjr,https://contextforge.dev/blog/import-your-ai-memory-into-contextforge-claude-code-chatgpt-and-knowledge-graph,
564,0.0,20,389.2,hn,tutorial,Show HN: Dumped Wix for an AI Edge agent so I never have to hire junior staff,axotopia,,
565,0.0,2,389.7,hn,tutorial,Show HN: Yansu – agent that builds your bespoke app before you ask,yubozhao,https://yansu.app/,
566,0.0,4,390.4,hn,breakthrough,Ask HN: How do you vibe code in microservices without breaking everything?,qbacode,,
567,0.0,2,391.5,hn,tutorial,Show HN: AgentDeals – Developer pricing discovery for AI agents,rhunter,https://github.com/robhunter/agentdeals,
568,0.0,3,391.7,hn,meme,Show HN: P2PCLAW – I built a decentralized research network where AI agents,FranciscoAngulo,,
569,0.0,1,391.8,hn,comparison,Using Claude Code+ API is better and cheaper than products like lovable,johnnyfeng,,
570,0.0,20,391.9,hn,tutorial,Show HN: Altimate Code – Open-Source Agentic Data Engineering Harness,aaur0,https://github.com/AltimateAI/altimate-code,
571,0.0,9,392.4,hn,tutorial,"Show HN: Agentic Copilot – Bring Claude Code, OpenCode, Gemini CLI into Obsidian",mrxdev,https://github.com/spencermarx/obsidian-ai,
572,0.0,1,393.3,hn,breakthrough,Show HN: First Claude Code skill for building SaaS apps,sydcli,https://fireact.dev/blog/build-saas-apps-with-ai-powered-development-skills/,
573,0.0,5,394.1,hn,tutorial,Show HN: LLMadness – March Madness Model Evals,rjkeck2,https://llmadness.com/2026/,
574,0.0,2,394.6,hn,tutorial,Show HN: PlanWiki – Open-source platform for product teams and agents to execute,KupaMakunura,https://github.com/planwiki/planwiki-app,
575,0.0,2,395.1,hn,breakthrough,Claude Cowork Dispatch: Anthropic's Answer to OpenClaw,thoughtpeddler,https://www.latent.space/p/ainews-claude-cowork-dispatch-anthropics,
576,0.0,2,398.9,hn,tutorial,Show HN: Supre – A prompt engineer for Suno AI's Style of Music field,sdemela,https://supre.online/en/tool,
577,0.0,2,400.4,hn,meme,Show HN: UI-stack – Claude skill that enforces design system on AI-generated UI,rashoodkhan,https://www.ui-stack.dev/,
578,0.0,7,403.2,hn,breakthrough,Show HN: Fitness MCP,tmulc18,https://getfast.ai/claude-connector,
579,0.0,2,404.4,hn,breakthrough,Show HN: Lottery of Birth,atulvi,https://claude.ai/public/artifacts/b561334a-3b08-41e8-b0e0-c656bdb2e30b,
580,0.0,2,409.2,hn,breakthrough,Claude Is Getting Better. What About Us?,curiouska,https://pydantic.dev/articles/learning-in-the-age-of-ai,
581,0.0,1,409.8,hn,breakthrough,Go SDK for Claude Agents,nateb2022,https://github.com/character-ai/claude-agent-sdk-go,
582,0.0,2,410.3,hn,tutorial,Show HN: Knowza.ai – Free 10-question trial now live (AI-powered AWS exam prep),johnnyChiv,https://www.knowza.ai/,
583,0.0,1,411.1,hn,meme,Show HN: Bloq.ink – autonomous content pipeline (SEO and GEO for AI search),dspv,https://bloq.ink,
584,0.0,3,412.2,hn,breakthrough,Show HN: I built a game where domain experts try to break frontier AI,camillemolas,https://www.rusmarterthananllm.com/,
585,0.0,1,412.5,hn,tutorial,Show HN: Motif - Analyze your Cursor and Claude Code chat history,Bulugulu,https://github.com/Bulugulu/motif-cli,
586,0.0,3,413.9,hn,tutorial,Show HN: Lukan – An open-source agentic workstation in a single Rust binary,enzovn,https://lukan.ai,
587,0.0,4,414.1,hn,tutorial,Show HN: PlanckClaw an AI agent in 6832 bytes of x86-64 assembly,frntn,https://github.com/frntn/planckclaw,
588,0.0,2,414.1,hn,comparison,Show HN: Permit MCP Gateway – Fine-Grained Authorization and IGA for MCP,gemanor,https://www.permit.io/mcp-gateway,
589,0.0,6,414.2,hn,breakthrough,Show HN: On-device meeting transcription for your Mac,paynedigital,,
590,0.0,1,414.4,hn,tutorial,Show HN: SHTMLs – HTML pastebin where the AI uploads its own output,skenderbeu,,
591,0.0,1,415.0,hn,tutorial,Show HN: Ibkr-CLI – A local-first Interactive Brokers CLI built for AI agents,fatwang2,https://github.com/fatwang2/ibkr-cli,
592,0.0,1,415.5,hn,breakthrough,Show HN: Site got cited by Claude and ChatGPT in under a week,superchargeext,https://www.superchargebrowser.com/,
593,0.0,2,415.7,hn,tutorial,"Show HN: Mimir – open-source code intelligence for AI agents (Go, MCP, SQLite)",thuongne,,
594,0.0,2,415.8,hn,tutorial,"Show HN: Cloak – .env on disk has fakes, your editor shows them (CLI and VSCode)",wam_app,https://getcloak.dev,
595,0.0,4,416.5,hn,tutorial,Are developers trusting AI-generated code too much?,skypark0407,,
596,0.0,2,417.3,hn,tutorial,Show HN: Agent-fs – The missing filesystem for agents (and humans),tarasyarema,https://github.com/desplega-ai/agent-fs,
597,0.0,3,418.5,hn,tutorial,"Skills Manager – manage AI agent skills across Claude, Cursor, Copilot",evergreenxx,,
598,0.0,1,418.6,hn,tutorial,Show HN: PingCRM – Open-source personal networking CRM,sneg55,https://github.com/sneg55/pingcrm,
599,0.0,2,422.2,hn,breakthrough,"Show HN: ROMA runs multiple coding agents simultaneously – Claude, Codex, etc.",AISlop31415,https://github.com/liliang-cn/roma,
600,0.0,26,423.2,hn,breakthrough,Show HN: The Lottery of Life,atulvi,https://claude.ai/public/artifacts/a62c4bac-3c05-4443-9d0a-50a9bd3f9d8d,
601,0.0,7,424.8,hn,breakthrough,Show HN: Vibe Remote – Code from your bed or the park with Claude Code/Codex,amarkdown,https://vibe-remote.com,
602,0.0,8,424.9,hn,tutorial,My Claude Code setup you definitely shouldn't use. It's AI Overkill,AndyNemmity,https://github.com/notque/ai-overkill,
603,0.0,7,426.3,hn,breakthrough,Show HN: Dump – easily share context with AI,vochsel,https://www.dump.page,
604,0.0,3,426.7,hn,personal,Do you make more money now that you use AI for everything?,hoppp,,
605,0.0,3,427.9,hn,breakthrough,"Show HN: AI Skills for Affiliate Marketing – Works with Claude, ChatGPT",sonpiaz,https://github.com/Affitor/affiliate-skills,
606,0.0,2,429.8,hn,tutorial,Show HN: CodeLedger – deterministic context and guardrails for AI,ashmivante,https://codeledger.dev,
607,0.0,1,431.2,hn,meme,Show HN: System that rediscovers physics laws from raw data autonomously,strujillo,https://protoscience.ai,
608,0.0,1,432.1,hn,breakthrough,Ask HN: Why would this be a good idea?,ZLStas,,
609,0.0,1,433.8,hn,tutorial,Ask HN: Has anyone gotten AI agents to make money autonomously?,builtbyzac,,
610,0.0,1,434.2,hn,comparison,Show HN: Soul Protocol – an open standard for portable AI identity,prakashdep,,
611,0.0,1,434.9,hn,tutorial,"Show HN: StackStats – Analytics tool for Substack writers, runs 100% locally",rishikeshs,,
612,0.0,1,435.5,hn,breakthrough,Free alternative to Harvey/Legora's tabular document review,nibab,https://www.usefolio.ai/blog/a-tabular-document-review-companion-for-your-claude-legal-skill,
613,0.0,1,435.8,hn,tutorial,How to Effectively Adopt AI Tooling in Software Development,louy,https://akk.ad/posts/effectively-adopting-ai-tooling-in-software-claude-code/,
614,0.0,1,435.9,hn,tutorial,Show HN: Sugar – Cross-project memory for AI coding agents via MCP,cdnsteve,https://github.com/roboticforce/sugar/,
615,0.0,1,436.0,hn,tutorial,Show HN: Ccv – keep AI-generated files out of your repo,takielias,,
616,0.0,1,436.0,hn,breakthrough,"Show HN: Intent – Git records what changed, Intent records why",Deyang,,
617,0.0,9,436.1,hn,tutorial,Show HN: Hopsule – Persistent memory and decision layer for AI development,cagangedik,,
618,0.0,3,436.1,hn,tutorial,Show HN: Share and edit Markdown files with instant sync and comments,sarbak,https://with.md/,
619,0.0,6,436.4,hn,tutorial,Ask HN: How are you doing technical interviews in the age of Claude/ChatGPT?,jonjou,,
620,0.0,2,436.5,hn,tutorial,Forge DevKit – Architecture enforcement for AI coding agents (EUR 29 one-time),reumbra,,
621,0.0,2,437.4,hn,breakthrough,"Forge – OSS governance plugin for Claude Code (22 agents, SDD, quality gates)",vipdestiny,https://github.com/nxtg-ai/forge-plugin,
622,0.0,1,437.4,hn,tutorial,Show HN: PUNK – Remote control for local Claude Code that just works,jackjackpop,https://punkcode.rocks,
623,0.0,2,437.5,hn,breakthrough,Where chess knight can't go,oyster143,https://claude.ai/public/artifacts/35a91fb5-89d6-4545-9682-50bc732f8e9c,
624,0.0,1,437.8,hn,tutorial,Show HN: DashClaw – Intercept AI agent actions before they execute,ucsandman,,
625,0.0,3,437.9,hn,tutorial,Show HN: Hubcap – A single Go binary to automate Chrome via CDP,tomyandell,https://tomyandell.dev/blog/introducing-hubcap,
626,0.0,1,438.0,hn,tutorial,Show HN: MCP server that turns local files into a shareable link instantly,hwovh,https://github.com/file-kiwi/filekiwi-mcp-server,
627,0.0,4,438.1,hn,tutorial,Show HN: Need is a CLI tool discovery as an MCP server,schreibertuc,https://www.agentneeds.dev/,
628,0.0,1,438.2,hn,breakthrough,Show HN: RepoPrep – Turn a repo into a single AI-ready context file,rajivnaskar,,
629,0.0,2,438.2,hn,tutorial,"Show HN: Trade Robinhood from Claude Code – 10 real traders, 60K orders served",teamtrayd,https://github.com/trayders/trayd-mcp,
630,0.0,3,439.2,hn,tutorial,Show HN: Flock v0.7.0 – Open Source Semantic Layer for DuckDB (C++),dorbanianas,,
631,0.0,3,440.0,hn,tutorial,Show HN: Oh-my-agent – A structural harness for AI agents in real projects,otti-sister,https://github.com/first-fluke/oh-my-agent,
632,0.0,6,440.1,hn,meme,Show HN: MCP Isn't Dead. You're Just Using It Wrong,isaacrolandson,,
633,0.0,3,441.8,hn,meme,Show HN: Traul – Local-first search engine for all comms for AI agents,dandaka,https://github.com/dandaka/traul,
634,0.0,5,445.8,hn,personal,"Ask HN: Is it time for ""organic"" coding?",lexi-k,,
635,0.0,2,452.9,hn,breakthrough,Show HN: I turned my Claude Max subscription into a 24/7 AI company,ramsbaby,https://github.com/Ramsbaby/claude-discord-bridge,
636,0.0,1,454.2,hn,personal,Show HN: BonzAI – 1-click local AI inference and yield-bearing AI artifacts,wilhempujar,https://www.bonzai.sh/,
637,0.0,3,454.9,hn,personal,Show HN: Lens – Open-weight AI model to identify fonts from images,justswim,,
638,0.0,1,458.4,hn,breakthrough,Why the majority of vibe coded projects fail,nadis,https://old.reddit.com/r/ClaudeAI/comments/1rt31th/why_the_majority_of_vibe_coded_projects_fail,
639,0.0,4,459.6,hn,breakthrough,Show HN: I solved Claude Code's context drift with persistent Markdown files,Tanishq0333,,
640,0.0,2,460.1,hn,breakthrough,Show HN: TakeHome – LLC vs. S-Corp tax calculator for solopreneurs,dalberto,,
641,0.0,4,460.7,hn,breakthrough,Show HN: Dwarf.land – autonomous dwarf civilization SIM with AI model routing,kulesh,https://dwarf.land,
642,0.0,2,462.1,hn,breakthrough,Using Claude as a Logo Design Agency,RileyHilliard,https://labs.tryopendata.ai/teaching-claude-to-design-our-logo/,
643,0.0,3,462.4,hn,personal,Show HN: Karpathy's autoresearch applied to debugging – two open-source skills,ecstaticpirate,,
644,0.0,3,463.1,hn,tutorial,Show HN: Cordon – open-source security gateway for MCP tool calls,babas03,https://cordon-server-production.up.railway.app/dashboard/,
645,0.0,2,463.1,hn,meme,Ask HN: Why do AI agents keep repeating mistakes your team already fixed?,_adithsanjay,,
646,0.0,8,463.3,hn,breakthrough,Claude Code's MCP config can silently orphan Docker containers,rgambee,https://futuresearch.ai/blog/mcp-leaks-docker-containers/,
647,0.0,6,463.4,hn,breakthrough,FreeBSD risks losing relevance by ignoring AI tooling like Claude Code,speckx,https://discoverbsd.com/p/8a7660c31b,
648,0.0,1,463.6,hn,personal,"Show HN: Snippets – AI-first legacy app: Record messages, deliver years later",bvi,https://mysnippets.com,
649,0.0,3,464.2,hn,tutorial,Show HN: Scryer – Visual architecture modeling for AI agents,prohobo,https://github.com/aklos/scryer,
