rank,velocity,raw_score,age_hours,platform,spike_type,title,author,url,comments
1,0.2897,901,22.3,hn,breakthrough,Tell HN: Anthropic no longer allowing Claude Code subscriptions to use OpenClaw,firloop,,
2,0.1641,6974,26.9,reddit,personal,Taught Claude to talk like a caveman to use 75% less tokens.,ffatty,https://www.reddit.com/r/ClaudeAI/comments/1sble09/taught_claude_to_talk_like_a_caveman_to_use_75/,
3,0.1385,131467,28.7,youtube,meme,Claude Leaks its Source Code… then Files Copyright Claim,SAMTIME,https://www.youtube.com/watch?v=o1i4FgtXhLA,
4,0.1029,89249,27.2,youtube,breakthrough,Em 48h recriaram o Claude Code de graça,mano deyvin,https://www.youtube.com/watch?v=82IOSYpY6Qo,
5,0.0726,36961,19.7,youtube,tutorial,Ollama + Claude Code = 99% CHEAPER,Nate Herk | AI Automation,https://www.youtube.com/watch?v=O2k_qwZA8HU,
6,0.0723,196616,53.1,youtube,tutorial,When AIs act emotional,Anthropic,https://www.youtube.com/watch?v=D4XTefP3Lsc,
7,0.0568,170513,56.2,youtube,tutorial,Why I Switched From ChatGPT to Claude (without losing anything),Dan Martell,https://www.youtube.com/watch?v=XRU-CjzYt_o,
8,0.0538,55639,30.2,youtube,meme,AI News: Anthropic Leak is Bigger Than You Think,Matt Wolfe,https://www.youtube.com/watch?v=BZ1hs2ZcnJc,
9,0.0527,85756,39.4,youtube,tutorial,the end of  Claude Code,Wes Roth,https://www.youtube.com/watch?v=eR167BCL-4g,
10,0.0448,71,14.7,hn,breakthrough,Emotion concepts and their function in a large language model,dnw,https://www.anthropic.com/research/emotion-concepts-function,
11,0.0411,3382,39.6,reddit,personal,things that claude say (part 2),Neither_Finance4755,https://www.reddit.com/r/ClaudeAI/comments/1sb4w67/things_that_claude_say_part_2/,
12,0.0395,2592415,75.7,youtube,tutorial,Tragic mistake... Anthropic leaks Claude’s source code,Fireship,https://www.youtube.com/watch?v=mBHRPeg8zPU,
13,0.0376,31606,26.7,youtube,comparison,ChatGPT vs Claude Make Minecraft Client From Scratch,Wxter,https://www.youtube.com/watch?v=QQKbk1gD2mk,
14,0.0341,80,18.7,hn,tutorial,Show HN: Travel Hacking Toolkit – Points search and trip planning with AI,borski,https://github.com/borski/travel-hacking-toolkit,
15,0.0272,182642,88.9,youtube,tutorial,BREAKING: Claude Code source leaked,Theo - t3․gg,https://www.youtube.com/watch?v=Wvj1mTqyzsQ,
16,0.0261,59462,47.9,youtube,breakthrough,Anthropic's New Claude CONWAY Is Unlike Any AI Before,AI Revolution,https://www.youtube.com/watch?v=x2l7W9aTc5k,
17,0.0235,151715,86.9,youtube,tutorial,Claude Code's entire source code was leaked,NeetCode,https://www.youtube.com/watch?v=LCjkmbHOtys,
18,0.0229,162576,91.8,youtube,tutorial,Claude Code was just leaked... (WOAH),Matthew Berman,https://www.youtube.com/watch?v=dYG8JxtSgmM,
19,0.0194,49993,51.5,youtube,tutorial,Stop Using Claude Code in Terminal (It’s Holding You Back),Simon Scrapes,https://www.youtube.com/watch?v=uhMCy25NBfw,
20,0.0192,10496,20.6,youtube,tutorial,Claude Code Was Leaked… So I Had to Test it,Riley Brown,https://www.youtube.com/watch?v=67Cbb3DyIxA,
21,0.0187,2433,8.2,youtube,meme,"AI News: Claude Leaks, Free Google AI Updates, + ChatGPT CarPlay",Paul J Lipsky,https://www.youtube.com/watch?v=Y9BOY4k_zb8,
22,0.0176,94172,78.1,youtube,comparison,Claude is the best AI in 2026,Dan Martell,https://www.youtube.com/watch?v=JvcCMTTr2N8,
23,0.0166,4702,80.8,reddit,personal,Brother,Technical-Relation-9,https://www.reddit.com/r/ClaudeAI/comments/1s9iyp3/brother/,
24,0.0159,111462,91.2,youtube,tutorial,Claude Code Source Code Just Leaked… 8 Things You Must Do,Nate Herk | AI Automation,https://www.youtube.com/watch?v=tXtCK66fPj8,
25,0.0128,12334,29.0,youtube,tutorial,5 INSANE Claude Cowork Use Cases... steal them,Jack Roberts,https://www.youtube.com/watch?v=isjOj4QSaO8,
26,0.0125,32685,51.9,youtube,comparison,Chat GPT-5 vs Claude vs Grok vs Gemini: ¿Cuál es la MEJOR IA en 2026? (Test BRUTAL),Dothaking115,https://www.youtube.com/watch?v=3rPp4SF1Nws,
27,0.0119,34066,54.7,youtube,tutorial,Stop Paying for Claude — This FREE Setup Gives You Claude Code Forever (2026 METHOD),Nick Ponte,https://www.youtube.com/watch?v=yDVwptu-Iz4,
28,0.0117,5258,105.1,reddit,meme,i dug through claude code's leaked source and anthropic's codebase is absolutely unhinged,Clear_Reserve_8089,https://www.reddit.com/r/ClaudeAI/comments/1s8lkkm/i_dug_through_claude_codes_leaked_source_and/,
29,0.0116,27666,49.2,youtube,breakthrough,تسريب Claude كشف أسرار أخطر من الكود,Ali Shahin,https://www.youtube.com/watch?v=L-qgqSGIBsg,
30,0.0114,96770,101.7,youtube,tutorial,Claude + Nano Banana. Insane Social Media Content in Minutes.,Grow with Alex,https://www.youtube.com/watch?v=CLLyO7f6zKU,
31,0.011,4,5.4,hn,breakthrough,Anthropic buys biotech startup Coefficient Bio in $400M deal,htrp,https://techcrunch.com/2026/04/03/anthropic-buys-biotech-startup-coefficient-bio-in-400m-deal-reports/,
32,0.0101,55276,79.2,youtube,tutorial,Claude Code + NoteBookLM = Infinite Memory,Jack Roberts,https://www.youtube.com/watch?v=6t32nPxeJb8,
33,0.0091,7166,25.6,youtube,tutorial,Claude: From Beginner To Pro In 21 Minutes,AI Edge,https://www.youtube.com/watch?v=IYF4NtECX3s,
34,0.0089,153034,151.8,youtube,tutorial,Claude Code Just Changed YouTube Videos Forever (Tutorial),Danny Why,https://www.youtube.com/watch?v=idVMGLzrrnU,
35,0.0087,47291,78.7,youtube,tutorial,Anthropic Accidentally Exposed Claude's Code — Here's What We Found,Harkirat Singh,https://www.youtube.com/watch?v=zzh66Uc3Ztc,
36,0.0086,148891,152.2,youtube,tutorial,FULL Claude Code Tutorial for Beginners in 2026! (Step-By-Step),Tech With Tim,https://www.youtube.com/watch?v=qYqIhX9hTQk,
37,0.0085,30833,62.5,youtube,tutorial,Don't be 10x Engineer: Lessons from Claude Code Leak by Anthropic..,Singh in USA,https://www.youtube.com/watch?v=Z5tgXcn3eWw,
38,0.0084,3149,16.4,youtube,tutorial,Anthropic Just Killed OpenClaw - Here's Why,Build In Public,https://www.youtube.com/watch?v=_4Dz-sfpa7E,
39,0.0083,19886,49.4,youtube,comparison,Is Claude the best AI right now? #tech #ai #techtok #yaptech,yaptech,https://www.youtube.com/watch?v=JbAgDzKdD_A,
40,0.0082,3853,107.8,reddit,personal,Claude code source code has been leaked via a map file in their npm registry,Nunki08,https://www.reddit.com/r/LocalLLaMA/comments/1s8ijfb/claude_code_source_code_has_been_leaked_via_a_map/,
41,0.0082,64025,97.2,youtube,comparison,ChatGPT vs Gemini vs Claude Hacen Hill Climb Racing Desde Cero,Pishmaan,https://www.youtube.com/watch?v=JOAskNe_qGc,
42,0.0079,26603,60.2,youtube,tutorial,Evin Anahtarını KAPININ Üstünde Unuttular: Claude Nasıl Hacklendi?,Can Deger,https://www.youtube.com/watch?v=iQD2aGaJ8V4,
43,0.0073,50894,91.2,youtube,meme,Claude Code source code LEAKED,Wes Roth,https://www.youtube.com/watch?v=PNjIXYAFgCI,
44,0.0072,325,105.0,hn,breakthrough,Claude Code users hitting usage limits 'way faster than expected',samizdis,https://www.theregister.com/2026/03/31/anthropic_claude_code_limits/,
45,0.0072,89886,126.4,youtube,tutorial,Claude AI wird dein Leben verändern 🤯 besser als ChatGPT?,Felicia Simon,https://www.youtube.com/watch?v=dsLxBQiUKiI,
46,0.0069,16655,49.4,youtube,tutorial,تسريب كود Claude Code!!,Bits & Pixels,https://www.youtube.com/watch?v=ZWI7EF1vTJ0,
47,0.0067,17661,52.2,youtube,comparison,ChatGPT vs Claude vs Gemini hacen My Talking Tom desde CERO,Aldeano_,https://www.youtube.com/watch?v=YWM_xMgGR14,
48,0.0062,26819,69.2,youtube,tutorial,Full Guide - Build Your Own AI Second Brain with Claude Code,Cole Medin,https://www.youtube.com/watch?v=1FiER-40zng,
49,0.0062,108359,152.2,youtube,tutorial,5 Mind Blowing Claude Cowork Uses Cases,Paul J Lipsky,https://www.youtube.com/watch?v=hW4FHg4-Ss0,
50,0.0061,4528,24.7,youtube,comparison,ChatGPT vs Claude? #chatgpt #claude,Maverick | AI & ChatGPT,https://www.youtube.com/watch?v=JcpN2ota7Ks,
51,0.0057,3,7.0,hn,tutorial,Show HN: Tokencap – Token budget enforcement across your AI agents,pykul,https://github.com/pykul/tokencap,
52,0.0056,17,21.9,hn,breakthrough,Anthropic to limit Using third-party harnesses with Claude subscriptions,guiyuwei,,
53,0.0056,25047,70.9,youtube,tutorial,بناء موقع احترافي بالـ AI ف 2026 — Claude Code شرح كامل للمبتدئين 🚀,Aouragh Anas,https://www.youtube.com/watch?v=fIlzsa4Srwg,
54,0.0054,12754,48.7,youtube,breakthrough,Claude's leaked source code is absolutely UNHINGED!,Sabrina Ramonov 🍄,https://www.youtube.com/watch?v=IxDvlrhfpHo,
55,0.0052,33423,86.7,youtube,tutorial,Claude Opus 4.7 + Sonnet 4.8 + Mythos 5 ALL Leaked & New Claude Code Features!,WorldofAI,https://www.youtube.com/watch?v=OIfRt1oyAss,
56,0.0051,139,78.7,hn,breakthrough,OpenAI demand sinks on secondary market as Anthropic runs hot,helsinkiandrew,https://www.bloomberg.com/news/articles/2026-04-01/openai-demand-sinks-on-secondary-market-as-anthropic-runs-hot,
57,0.0051,12928,51.0,youtube,tutorial,Every Claude Code User Should Watch This,Builders Central,https://www.youtube.com/watch?v=dfdYnYJm4FA,
58,0.005,3027,21.8,youtube,breakthrough,"Maximize Claude Code credits with one hidden command. Opus handles strategy, Sonnet does the rest.",Nick Sadler,https://www.youtube.com/watch?v=NmiKo_KBq38,
59,0.0048,2,5.9,hn,breakthrough,Human Proof System with EDNA,sebklaey,https://claude.ai/public/artifacts/74af0308-e2b3-4bd7-af54-3f5fb106c687,
60,0.0048,201,100.7,hn,breakthrough,Show HN: Postgres extension for BM25 relevance-ranked full-text search,tjgreen,https://github.com/timescale/pg_textsearch,
61,0.0048,81337,150.2,youtube,tutorial,Anthropic's Biggest Mistake Just Leaked Their Most Powerful AI (+ 9 AI Updates),Vaibhav Sisinty,https://www.youtube.com/watch?v=c4Mgp3FWvt0,
62,0.0047,20372,69.1,youtube,tutorial,5 SECRET Claude Codes That Make it 10x More Powerful #claude #claudeprompts,Zack the AI Guy,https://www.youtube.com/watch?v=VkVNjcy2VUc,
63,0.0046,13342,54.9,youtube,tutorial,The AI System Most People Aren’t Building (Claude Code + Obsidian),Rick Mulready,https://www.youtube.com/watch?v=2COkMJPHINY,
64,0.0045,6194,35.7,youtube,tutorial,How to USE Claude Code for FREE with Ollama ( Local AI FULL Tutorial),Ksk Royal,https://www.youtube.com/watch?v=-V8fWL3oXTQ,
65,0.0044,4663,30.8,youtube,tutorial,Claude Code + Nano Banana 2 + FireCrawl = БЕЗУМНЫЕ Сайты за $12К,ИИ МАСТОДОНТ,https://www.youtube.com/watch?v=-PwQl_NCh48,
66,0.004,1888,107.2,reddit,tutorial,Someone just leaked claude code's Source code on X,abhi9889420,https://www.reddit.com/r/ChatGPT/comments/1s8j27e/someone_just_leaked_claude_codes_source_code_on_x/,
67,0.004,8,16.9,hn,breakthrough,"Anthropic struggling with Chinese competition, its own safety obsession",davikr,https://www.theregister.com/2026/03/28/miss_anthropic_not_those_who/,
68,0.0038,5773,38.0,youtube,tutorial,"I Built a Tool That Runs Claude Code with ANY AI Model — GPT, Codex, Gemini, DeepSeek, Free Models",Anton Abyzov: AI Power,https://www.youtube.com/watch?v=k0RI_M6lIsg,
69,0.0037,3,9.4,hn,breakthrough,"Delx: AI therapist for AI agents, informed by Anthropic's emotion research",davidmosiah,https://delx.ai,
70,0.0036,4498,186.5,reddit,personal,Claude watching me write code manually after I hit the daily limit,Technical-Relation-9,https://www.reddit.com/r/ClaudeAI/comments/1s5ok5r/claude_watching_me_write_code_manually_after_i/,
71,0.0036,656,10.2,youtube,tutorial,Anthropic's Claude Code Leak: Competitors Will Copy Fast! #shorts,Authority Hacker Podcast,https://www.youtube.com/watch?v=OcTy2cXm3Ik,
72,0.0036,66260,158.1,youtube,tutorial,"""CHAT GPT""  vs  ""CLAUDE  SONNET"" #coding #programming #python #javascript #html #css #cssanimation",𝗔𝘇𝗶𝘇 𝗖𝗼𝗱𝗲𝘅,https://www.youtube.com/watch?v=RBqVGR6RtvA,
73,0.0035,1478,101.3,reddit,personal,Just a helpful open-source contributor,MagicZhang,https://www.reddit.com/r/LocalLLaMA/comments/1s8rb48/just_a_helpful_opensource_contributor/,
74,0.0034,51856,141.2,youtube,breakthrough,Anthropic’s New Claude MYTHOS Is The Most Powerful AI Ever!,AI Revolution,https://www.youtube.com/watch?v=M6yRREy_5CM,
75,0.0034,5171,37.6,youtube,tutorial,Я потратил на Claude Code 1 000 часов. Вот что нужно знать для вайб-кодинга,Нейропросвещение,https://www.youtube.com/watch?v=sx6ZSbc51gY,
76,0.0033,11,23.3,hn,breakthrough,"Claude AI finds Vim, Emacs RCE bugs that trigger on file open",akyuu,https://www.bleepingcomputer.com/news/security/claude-ai-finds-vim-emacs-rce-bugs-that-trigger-on-file-open/,
77,0.0033,51442,144.2,youtube,comparison,Why I switched from ChatGPT to Claude?,Dan Martell,https://www.youtube.com/watch?v=MMnzVfMZ-NI,
78,0.0032,251,142.9,hn,breakthrough,Claude Code runs Git reset –hard origin/main against project repo every 10 mins,mthwsjc_,https://github.com/anthropics/claude-code/issues/40710,
79,0.0031,5564,229.0,reddit,personal,25 years. Multiple specialists. Zero answers. One Claude conversation cracked it.,the_kuka,https://www.reddit.com/r/ClaudeAI/comments/1s41fny/25_years_multiple_specialists_zero_answers_one/,
80,0.0031,25475,100.2,youtube,tutorial,Claude Code’un Kaynak Kodu Ortaya Saçıldı,Oğuz Ergin,https://www.youtube.com/watch?v=-u8oq4ZafII,
81,0.0029,3326,178.8,reddit,tutorial,"I've been ""gaslighting"" my AI models and it's producing insanely better results with simple prompt i",naculalex,https://www.reddit.com/r/ClaudeAI/comments/1s5wp0g/ive_been_gaslighting_my_ai_models_and_its/,
82,0.0029,14251,74.0,youtube,tutorial,FULL Claude ai Tutorial for Beginners in 2026!,Nid Academy,https://www.youtube.com/watch?v=ECbTVzZuzzA,
83,0.0028,446,213.6,hn,breakthrough,Judge blocks Pentagon effort to 'punish' Anthropic with supply chain risk label,prawn,https://www.cnn.com/2026/03/26/business/anthropic-pentagon-injunction-supply-chain-risk,
84,0.0027,1138,101.4,reddit,comparison,How it started vs How it's going,HornyGooner4401,https://www.reddit.com/r/LocalLLaMA/comments/1s8r3w3/how_it_started_vs_how_its_going/,
85,0.0027,900,15.2,youtube,tutorial,Claude Advanced Voice Is NOT Trying to Be ChatGPT,The Human Stack,https://www.youtube.com/watch?v=7fsXjEfRR1s,
86,0.0026,7793,56.2,youtube,tutorial,These 3 Frameworks Make Claude Code Unstoppable,Eric Tech,https://www.youtube.com/watch?v=bzutStZJ1Ig,
87,0.0026,53203,167.5,youtube,tutorial,Claude Code for FREE | Skip the $200/Month Subscription,Eric Tech,https://www.youtube.com/watch?v=o85Y5omRQq0,
88,0.0024,4658,236.5,reddit,personal,Giving Claude access to my MacBook / macOS,namebrained,https://www.reddit.com/r/ClaudeAI/comments/1s3ss8s/giving_claude_access_to_my_macbook_macos/,
89,0.0024,260,170.5,hn,breakthrough,"Further human + AI + proof assistant work on Knuth's ""Claude Cycles"" problem",mean_mistreater,https://twitter.com/BoWang87/status/2037648937453232504,
90,0.0022,1,6.3,hn,tutorial,I connected Claude to my AI runtime – they invented a new language,seifbenayed1992,,
91,0.0022,62,81.0,hn,breakthrough,Show HN: Baton – A desktop app for developing with AI agents,tordrt,https://getbaton.dev/,
92,0.0022,139,126.6,hn,tutorial,"Show HN: Zerobox – Sandbox any command with file, network, credential controls",afshinmeh,https://github.com/afshinm/zerobox,
93,0.0021,16423,98.2,youtube,tutorial,Claude Code LEAKS is INSANE!,Julian Goldie SEO,https://www.youtube.com/watch?v=DUP4ccA2mDM,
94,0.0021,45240,170.4,youtube,comparison,5 Open Source Repos That Make Claude Code UNSTOPPABLE (March 2026),Chase AI,https://www.youtube.com/watch?v=6SnFH43qPAw,
95,0.002,3,14.2,hn,tutorial,Show HN: Anos – a hand-written ~100KiB microkernel for x86-64 and RISC-V,noone_youknow,https://github.com/roscopeco/anos,
96,0.002,59,82.0,hn,meme,Ask HN: Client took over development by vibe coding. What to do?,piscator,,
97,0.0019,40995,172.2,youtube,comparison,ChatGPT vs Claude vs Gemini vs DeepSeek — 4-Stroke Engine Animation ( #aicoding  #chatgpt,AI Code Clash,https://www.youtube.com/watch?v=ORKZMLpyXiQ,
98,0.0019,29506,143.8,youtube,breakthrough,استخدم Claude أفضل من 90% من الناس (الدليل الكامل),مدرسة الذكاء الاصطناعي,https://www.youtube.com/watch?v=jdnXYcZmCCE,
99,0.0018,3771,249.8,reddit,personal,This new Claude update is crazy,MetaKnowing,https://www.reddit.com/r/ClaudeAI/comments/1s37yiy/this_new_claude_update_is_crazy/,
100,0.0017,2,12.1,hn,breakthrough,Using AI to track the cost of Guinness,pieterr,https://fortune.com/2026/03/30/guinness-beer-prices-ireland-anthropic-claude-ai/,
101,0.0017,29786,151.2,youtube,comparison,Is Claude Pro Worth $20? Free vs Pro vs Max (2026),The AI Productivity Coach,https://www.youtube.com/watch?v=Sdewx3GpJ1Q,
102,0.0017,9744,80.2,youtube,tutorial,Claude Code Works Better When You Do This,Eric Tech,https://www.youtube.com/watch?v=D5bRTv6GhXk,
103,0.0016,36,69.8,hn,breakthrough,Obfuscation is not security – AI can deobfuscate any minified JavaScript code,rvz,https://www.afterpack.dev/blog/claude-code-source-leak,
104,0.0015,1,8.1,hn,tutorial,Show HN: Batty – Run a team of AI coding agents in tmux with test gating,Zedmor,https://github.com/battysh/batty,
105,0.0015,273,231.0,hn,breakthrough,Government agencies buy commercial data about Americans in bulk,nuke-web3,https://www.npr.org/2026/03/25/nx-s1-5752369/ice-surveillance-data-brokers-congress-anthropic,
106,0.0014,3,17.8,hn,breakthrough,"A broken auto-live poller, and what perceived urgency does to Claude Code",cmeiklejohn,https://christophermeiklejohn.com/ai/zabriskie/reliability/2026/04/03/the-feature-that-has-never-worked.html,
107,0.0013,49,93.5,hn,breakthrough,GitHub has DMCA'd nearly all forks of the official Claude-code repo,cg505,https://github.com/anthropics/claude-code/forks,
108,0.0013,6950,79.2,youtube,tutorial,اتقن 90 بالمية من claude code في 23 دقيقة,Abdallahkh,https://www.youtube.com/watch?v=CE60fFNZ0Go,
109,0.0012,337,80.3,reddit,meme,The Claude Code leak accidentally published the first complete blueprint for production AI agents. H,Joozio,https://www.reddit.com/r/artificial/comments/1s9jprb/the_claude_code_leak_accidentally_published_the/,
110,0.0012,9836,101.1,youtube,tutorial,Qwen 3.6 Plus is 100% FREE AI Model BEATS Claude Sonnet 4.6 Builds INSANE Apps in 1 Prompt 🤯,The Metaverse Guy,https://www.youtube.com/watch?v=K5FOXqwXnDo,
111,0.0011,5030,388.5,reddit,personal,Just in case,JerryH_,https://www.reddit.com/r/ClaudeAI/comments/1ry5hkp/just_in_case/,
112,0.0011,174,214.0,hn,comparison,Order Granting Preliminary Injunction – Anthropic vs. U.S. Department of War [pdf],theindieman,https://storage.courtlistener.com/recap/gov.uscourts.cand.465515/gov.uscourts.cand.465515.134.0.pdf,
113,0.0011,483,385.6,hn,breakthrough,Anthropic takes legal action against OpenCode,_squared_,https://github.com/anomalyco/opencode/pull/18186,
114,0.0011,5898,78.0,youtube,meme,"I Read 512,000 Lines of Leaked Claude Code So You Don't Have To",Nick Puru | AI Automation,https://www.youtube.com/watch?v=y2cr1bRTcgc,
115,0.001,8143,525.9,reddit,personal,Why the majority of vibe coded projects fail,harrysofgaming,https://www.reddit.com/r/ClaudeAI/comments/1rt31th/why_the_majority_of_vibe_coded_projects_fail/,
116,0.001,5,29.1,hn,breakthrough,Anthropic's next model could be a 'watershed moment' for cybersecurity,agiacalone,https://www.cnn.com/2026/04/03/tech/anthropic-mythos-ai-cybersecurity,
117,0.001,13,52.2,hn,breakthrough,Anthropic's AutoDream Is Flawed,k1musab1,https://substack.com/home/post/p-192893121,
118,0.001,8312,102.7,youtube,comparison,ChatGPT vs Claude vs Cursor Making 3D Spider-Man Game,WeeklyHow,https://www.youtube.com/watch?v=Tpx3fLV6LaE,
119,0.001,6085,85.6,youtube,breakthrough,"Claude Epitaxy, Mythos FAST Mode, Opus 4.7, Sonnet 4.8, Leaks: This is CRAZY!!!",AICodeKing,https://www.youtube.com/watch?v=Cw2vh9ioydM,
120,0.0009,2300,273.2,reddit,personal,There are levels to this game...,Complete-Sea6655,https://www.reddit.com/r/ChatGPT/comments/1s2bny3/there_are_levels_to_this_game/,
121,0.0008,2,19.5,hn,breakthrough,Scaling tool orchestration data will emerge different intelligence and LLMs,arkariarn,,
122,0.0008,12,56.7,hn,tutorial,Show HN: Skales – I built a desktop AI agent a 6-year-old can use,marioskales,https://github.com/skalesapp/skales,
123,0.0008,225,293.0,hn,tutorial,Show HN: Cq – Stack Overflow for AI coding agents,peteski22,https://blog.mozilla.ai/cq-stack-overflow-for-agents/,
124,0.0007,2,20.3,hn,personal,"Show HN: Meetrics – Track anything, correlate anything, ask your data questions",sergeybok,https://github.com/sergeybok/meetrics-support/blob/main/BLOG/CANCER.md,
125,0.0007,8,48.8,hn,breakthrough,Ask HN: How relevant is low code according to you in today’s world with Claude?,kinj28,,
126,0.0007,8,49.6,hn,breakthrough,The MVC Mistake,ibobev,https://entropicthoughts.com/mvc-mistake,
127,0.0007,114,215.6,hn,breakthrough,Anthropic Subprocessor Changes,tencentshill,https://trust.anthropic.com,
128,0.0006,4056,497.7,reddit,personal,I used Claude Code to reverse engineer a 13-year-old game binary and crack a restriction nobody had ,CelebrationFew1755,https://www.reddit.com/r/ClaudeAI/comments/1ru3irp/i_used_claude_code_to_reverse_engineer_a/,
129,0.0006,70,48.2,reddit,comparison,[R] Is autoresearch really better than classic hyperparameter tuning?,Educational_Strain_3,https://www.reddit.com/r/MachineLearning/comments/1satj6r/r_is_autoresearch_really_better_than_classic/,
130,0.0006,6,43.8,hn,breakthrough,Show HN: Composer – AI architect / MCP for software architecture diagrams,olivergrabner,https://www.usecomposer.com/,
131,0.0006,7,48.2,hn,breakthrough,"Anthropic says: nothing wrong with our usage limits, you're hallucinating",aeneas_ory,https://www.reddit.com/r/ClaudeAI/s/u7aJKSDmfy,
132,0.0006,161,277.4,hn,breakthrough,Show HN: ProofShot – Give AI coding agents eyes to verify the UI they build,jberthom,https://github.com/AmElmo/proofshot,
133,0.0006,6,43.8,hn,breakthrough,The Catholic Priest Who Helped Write Anthropic's A.I. Ethics Code,Geekette,https://observer.com/2026/03/the-catholic-priest-who-helped-write-anthropics-ai-ethics-code/,
134,0.0006,7007,118.0,youtube,comparison,ChatGPT vs Claude: esto ya no tiene competencia (2026),Pocho Costa,https://www.youtube.com/watch?v=vGknCE_c7U8,
135,0.0005,3361,457.0,reddit,meme,Whenever I pour my heart out to Claude a little…,porcupine-pete,https://www.reddit.com/r/ClaudeAI/comments/1rvkpd5/whenever_i_pour_my_heart_out_to_claude_a_little/,
136,0.0005,29926,845.3,reddit,meme,"Cancel your ChatGPT Plus, burn their compute on the way out, and switch to Claude",boomroom11,https://www.reddit.com/r/ChatGPT/comments/1rh60py/cancel_your_chatgpt_plus_burn_their_compute_on/,
137,0.0005,9057,818.6,reddit,personal,Grok has become self-aware?,TailungFu,https://www.reddit.com/r/ChatGPT/comments/1ri505i/grok_has_become_selfaware/,
138,0.0005,629,705.3,hn,breakthrough,Hardening Firefox with Anthropic's Red Team,todsacerdoti,https://www.anthropic.com/news/mozilla-firefox-security,
139,0.0005,2,26.1,hn,personal,XC Scribe – AI product description generator with direct e-commerce sync,ikkans,,
140,0.0005,630,716.5,hn,breakthrough,Where things stand with the Department of War,surprisetalk,https://www.anthropic.com/news/where-stand-department-war,
141,0.0005,805,741.3,hn,breakthrough,Dario Amodei calls OpenAI’s messaging around military deal ‘straight up lies’,SilverElfin,https://techcrunch.com/2026/03/04/anthropic-ceo-dario-amodei-calls-openais-messaging-around-military-deal-straight-up-lies-report-says/,
142,0.0005,832,839.8,hn,breakthrough,We do not think Anthropic should be designated as a supply chain risk,golfer,https://twitter.com/OpenAI/status/2027846016423321831,
143,0.0005,1170,859.8,hn,breakthrough,Statement on the comments from Secretary of War Pete Hegseth,surprisetalk,https://www.anthropic.com/news/statement-comments-secretary-war,
144,0.0005,1362,862.7,hn,personal,I am directing the Department of War to designate Anthropic a supply-chain risk,jacobedawson,https://twitter.com/secwar/status/2027507717469049070,
145,0.0005,2920,886.5,hn,breakthrough,Statement from Dario Amodei on our discussions with the Department of War,qwertox,https://www.anthropic.com/news/statement-department-of-war,
146,0.0004,7086,814.4,reddit,meme,Claude’s extended thinking found out about Iran in real time,schuttdev,https://www.reddit.com/r/ClaudeAI/comments/1ribnke/claudes_extended_thinking_found_out_about_iran_in/,
147,0.0004,6436,838.2,reddit,personal,Claude has overtaken ChatGPT in the Apple App Store,Pure_Perception7328,https://www.reddit.com/r/ClaudeAI/comments/1rhgsjz/claude_has_overtaken_chatgpt_in_the_apple_app/,
148,0.0004,3983,586.0,reddit,tutorial,"""Claude, make a video about what it's like to be an LLM""",MetaKnowing,https://www.reddit.com/r/ClaudeAI/comments/1rqqtes/claude_make_a_video_about_what_its_like_to_be_an/,
149,0.0004,1642,376.5,reddit,personal,Bernie Sanders has a conversation with Claude,DinoZambie,https://www.reddit.com/r/ChatGPT/comments/1rymwb5/bernie_sanders_has_a_conversation_with_claude/,
150,0.0004,988,269.0,reddit,comparison,Best model that can beat Claude opus that runs on 32MB of vram?,PrestigiousEmu4485,https://www.reddit.com/r/LocalLLaMA/comments/1s2i7pw/best_model_that_can_beat_claude_opus_that_runs_on/,
151,0.0004,2,28.2,hn,tutorial,"Show HN: Matrix OS, like Lovable, but for personal apps",hamedmp,https://matrix-os.com/,
152,0.0004,6,59.2,hn,breakthrough,Most Claude Code advice is measurably wrong,DeathArrow,https://old.reddit.com/r/ClaudeAI/comments/1s8mbqm/i_read_17_papers_on_agentic_ai_workflows_most/,
153,0.0004,36,147.2,hn,meme,Stripe withheld $85k from our EU platform,MelkerWendelbo,,
