rank,velocity,raw_score,age_hours,platform,spike_type,title,author,url,comments
1499,0.0,3,702.3,hn,breakthrough,Pentagon designates Anthropic a supply chain risk,simonebrunozzi,https://www.semafor.com/article/03/06/2026/pentagon-designates-anthropic-a-supply-chain-risk,
1500,0.0,2,702.6,hn,tutorial,Show HN: Writers Studio – macOS writing app with AI entity extraction,xclusive36,https://litestep.com/writers-studio/,
1501,0.0,3,703.9,hn,breakthrough,Hacker Used Anthropic's Claude to Steal Mexican Data Trove,cdrnsf,https://www.bloomberg.com/news/articles/2026-02-25/hacker-used-anthropic-s-claude-to-steal-sensitive-mexican-data,
1502,0.0,1,706.1,hn,breakthrough,Econonomist interviews Anthropic's boss post Pentagon SCR,bazzmt,https://www.economist.com/insider/the-insider/zanny-minton-beddoes-interviews-anthropics-boss,
1503,0.0,1,706.3,hn,tutorial,"Show HN: Evalcraft – cassette-based testing for AI agents (pytest, $0/run)",beyhang,https://github.com/beyhangl/evalcraft,
1504,0.0,21,706.4,hn,breakthrough,Partnering with Mozilla to improve Firefox's security,meetpateltech,https://www.anthropic.com/news/mozilla-firefox-security,
1505,0.0,2,707.4,hn,breakthrough,Black-box AI and cheap drones are outpacing global rules of war,Brajeshwar,https://restofworld.org/2026/anthropic-ai-and-iran-drone-warfare/,
1506,0.0,4,709.8,hn,breakthrough,Anthropic vows to sue Pentagon over risk designation,iamflimflam1,https://www.bbc.co.uk/news/articles/cn5g3z3xe65o,
1507,0.0,5,711.3,hn,breakthrough,Ask HN: How are LLMs supposed to be used for warfare?,sirnicolaz,,
1508,0.0,7,713.8,hn,breakthrough,A Dire Warning from the Tech World,SilverElfin,https://www.theatlantic.com/technology/2026/03/dean-ball-anthropic-interview/686226/,
1509,0.0,15,715.7,hn,breakthrough,'Anthropic CEO says US govt hostility linked to Trump donations [Leaked memo],hedora,https://www.wionews.com/world/-no-dictator-style-praise-anthropic-ceo-says-us-govt-hostility-linked-to-trump-donations-slams-openai-s-altman-in-internal-memo-report-1772698855018,
1510,0.0,2,716.4,hn,breakthrough,Anthropic: Labor market impacts of AI – A new measure and early evidence [pdf],jbredeche,https://cdn.sanity.io/files/4zrzovbb/website/dc7bcd0224644fce97cecb7f9e68dcd8434b35f1.pdf,
1511,0.0,16,717.4,hn,breakthrough,The Pentagon Officially Notifies Anthropic That It Is a 'Supply Chain Risk',intunderflow,https://www.nytimes.com/2026/03/05/technology/anthropic-supply-chain-risk-defense-department.html,
1512,0.0,1,720.9,hn,breakthrough,Show HN: OmniMon v4 – A cross-platform system monitor in Rust/Tauri (35MB RAM),chochy2001,https://github.com/chochy2001/macmon,
1513,0.0,2,721.8,hn,tutorial,"Show HN: DocMCP – Index any docs site locally, search it from Claude via MCP",pieeee,,
1514,0.0,1,722.1,hn,breakthrough,"Show HN: KarnEvil9, a deterministic AI agent runtime",oldeucryptoboi,https://github.com/oldeucryptoboi/KarnEvil9,
1515,0.0,2,722.6,hn,tutorial,Show HN: Nexus Gateway – Reduce LLM API Costs Using Semantic Caching,Sunnyanand_dev,https://www.nexus-gateway.org/,
1516,0.0,2,722.6,hn,tutorial,"Show HN: GovernsAI – unified auth, memory, and PII guard across AI providers",shaivpidadi,https://www.governsai.com/,
1517,0.0,11,723.0,hn,breakthrough,Pentagon Says It's Told Anthropic the Firm Is Supply-Chain Risk,nickysielicki,https://www.bloomberg.com/news/articles/2026-03-05/pentagon-says-it-s-told-anthropic-the-firm-is-supply-chain-risk,
1518,0.0,3,723.9,hn,breakthrough,Anthropic and The Pentagon are back at the negotiating table,deanmoriarty,https://www.cnbc.com/2026/03/05/anthropic-pentagon-ai-deal-department-of-defense-openai-.html,
1519,0.0,5,724.0,hn,breakthrough,"Altman takes jab at Anthropic, says gov't should be more powerful than companies",spenvo,,
1520,0.0,2,724.5,hn,breakthrough,"Altman takes jabs at Anthropic, says govt should be more powerful than companies",nickthegreek,https://www.cnbc.com/2026/03/05/open-ai-altman-anthropic-pentagon-war.html,
1521,0.0,2,725.0,hn,meme,"Show HN: LiberClaw, deploy AI agents that run 24/7 on their own VMs",moshemalawach,,
1522,0.0,2,725.1,hn,tutorial,Show HN: A Linter for Skill.md Files,theahura,https://github.com/tilework-tech/nori-lint,
1523,0.0,3,725.2,hn,breakthrough,The Pentagon-Anthropic feud is quietly obscuring the real fight over military AI,johnshades,https://www.fastcompany.com/91502340/the-pentagon-anthropic-feud-is-quietly-obscuring-the-real-fight-over-military-ai,
1524,0.0,2,725.9,hn,tutorial,"Show HN: Nemilia – multi-agent AI workspace in a single HTML file, no back end",Nemilia,https://github.com/luislopez1212/nemilia,
1525,0.0,1,727.7,hn,personal,Show HN: Costrace – Open-source LLM cost and latency tracking across providers,Ikotun,https://www.costrace.dev/,
1526,0.0,6,730.2,hn,breakthrough,US Military reportedly used Claude in Iran strikes despite Trump's ban,_____k,https://www.theguardian.com/technology/2026/mar/01/claude-anthropic-iran-strikes-us-military,
1527,0.0,2,730.8,hn,tutorial,Are companies preventing sensitive data from being sent to external LLM APIs,jayakrishna96,,
1528,0.0,7,732.1,hn,tutorial,We don't need continual learning for AGI. What top labs are currently doing,kok14,,
1529,0.0,1,735.5,hn,breakthrough,Show HN: We built governed multi-agent teams months before Anthropic announced,erashu212,https://github.com/rigovo/rigovo-virtual-team,
1530,0.0,7,737.1,hn,breakthrough,Anthropic Reopens Talks with Pentagon,cmrdporcupine,https://www.bloomberg.com/news/articles/2026-03-05/anthropic-s-amodei-reopens-ai-discussions-with-pentagon-ft-says,
1531,0.0,5,737.9,hn,comparison,Max Schwarzer is leaving OpenAI for Anthropic,tiahura,https://twitter.com/max_a_schwarzer/status/2028939154944585989,
1532,0.0,55,739.4,hn,breakthrough,Anthropic chief back in talks with Pentagon about AI deal,ajam1507,https://www.ft.com/content/97bda2ef-fc06-40b3-a867-f61a711b148b,
1533,0.0,1,740.1,hn,breakthrough,Show HN: Stackspend – Spend management for AI startups,andrewrday,https://www.stackspend.app,
1534,0.0,2,741.7,hn,breakthrough,"OpenAI, Anthropic turn to consultants to fight over the enterprise market",wavelander,https://www.businessinsider.com/openai-and-anthropic-using-consultants-to-fight-enterprise-battles-2026-3,
1535,0.0,3,742.9,hn,breakthrough,"Show HN: I built a browser game where you compete against OpenAI, Anthropic, etc",adityapatni,https://thefrontier.pages.dev,
1536,0.0,2,744.2,hn,breakthrough,At Arms over Anthropic,trbutler,https://reviews.ofb.biz/safari/article/1399.html,
1537,0.0,7,744.7,hn,breakthrough,Show HN: Composable middleware for LLM inference Optimization Passes,human_hack3r,https://github.com/liquidos-ai/AutoAgents,
1538,0.0,3,744.7,hn,breakthrough,Anthropic's investors don't have its back in its fight with The Pentagon,speckx,https://www.semafor.com/article/03/03/2026/anthropics-investors-dont-have-its-back-in-its-fight-with-the-pentagon,
1539,0.0,2,746.6,hn,personal,Show HN: TerminalNexus – Turn CLI commands into reusable buttons (Windows),danhof_sss,,
1540,0.0,2,748.1,hn,breakthrough,Anthropic investors push to de-escalate Pentagon clash over AI safeguards,giuliomagnifico,https://www.reuters.com/business/retail-consumer/anthropic-investors-push-de-escalate-pentagon-clash-over-ai-safeguards-sources-2026-03-04/,
1541,0.0,2,751.2,hn,tutorial,"Show HN: Spendtrace, Feature-level AWS cost attribution (found a 17× gap))",joshyi_ba,https://github.com/Joshyi-Abini/Spendtrace,
1542,0.0,2,751.4,hn,breakthrough,AAP – An open standard for verifiable AI agent actions (RFC draft),thinklanceai,,
1543,0.0,1,756.2,hn,breakthrough,Ask HN: What do you think of Anthropic adding $10B of revenue in last 2 months?,aurareturn,,
1544,0.0,2,757.8,hn,breakthrough,"Altman's ""sloppy"" mistake works in Anthropic's favor [video]",mdp2021,https://www.youtube.com/shorts/ZklG_j10-IA,
1545,0.0,2,758.4,hn,meme,Tell HN: I exported my data from ChatGPT,luxpir,,
1546,0.0,14,763.1,hn,meme,Anthropic Nears $20B Revenue Run Rate Amid Pentagon Feud,Analemma_,https://www.bloomberg.com/news/articles/2026-03-03/anthropic-nears-20-billion-revenue-run-rate-amid-pentagon-feud,
1547,0.0,6,763.4,hn,breakthrough,Defense contractors removing Anthropic's AI after Trump ban,alephnerd,https://www.reuters.com/sustainability/society-equity/defense-contractors-like-lockheed-seen-removing-anthropics-ai-after-trump-ban-2026-03-04/,
1548,0.0,8,764.1,hn,personal,Google employees call for military limits on AI amid Iran strikes,MilnerRoute,https://www.cnbc.com/2026/03/03/anthropic-fallout-iran-war-tech-military-ai.html,
1549,0.0,7,764.7,hn,breakthrough,Sam Altman says OpenAI is renegotiating Pentagon 'opportunistic and sloppy' deal,jacquesm,https://fortune.com/2026/03/03/sam-altman-openai-pentagon-renegotiating-deal-anthropic/,
1550,0.0,2,765.5,hn,breakthrough,Anthropic Made Pitch in Drone Swarm Contest During Pentagon Feud,cdrnsf,https://www.bloomberg.com/news/articles/2026-03-02/anthropic-made-pitch-in-drone-swarm-contest-during-pentagon-feud,
1551,0.0,4,765.8,hn,breakthrough,Privacy Protections Shouldn't Depend on the Decisions of a Few Powerful People,hn_acker,https://www.eff.org/deeplinks/2026/03/anthropic-dod-conflict-privacy-protections-shouldnt-depend-decisions-few-powerful,
1552,0.0,6,766.3,hn,breakthrough,Anthropic-backed super PAC spends $1.6M in primary race divided over datacenters,colinhb,https://www.theguardian.com/us-news/2026/mar/03/datacenter-politics-north-carolina-primary,
1553,0.0,2,766.7,hn,personal,"OnWatch – Track 6 AI API quotas from your terminal (<50MB RAM, zero telemetry)",prakersh,,
1554,0.0,15,767.2,hn,meme,Sen. Wyden Warns of Mass Surveillance Amid Pentagon's Fight with Anthropic,WarOnPrivacy,https://gizmodo.com/sen-wyden-warns-of-mass-surveillance-amid-pentagons-fight-with-anthropic-2000728971,
1555,0.0,2,768.3,hn,breakthrough,Show HN: TrAIn of Thought – AI chat as I want it to be,two-sandwich,https://bix.computer/graphMode,
1556,0.0,11,768.6,hn,breakthrough,Anthropic is untrustworthy,lr0,https://anthropic.ml,
1557,0.0,3,771.7,hn,tutorial,"Show HN: AgentCost – Track, control, and optimize your AI spending (MIT)",agentcostin,https://github.com/agentcostin/agentcost,
1558,0.0,1,773.6,hn,comparison,Show HN: Exodus – we tracked 240 moves across companies to map the AI talent war,fabioperez,https://7min.ai/exodus/,
1559,0.0,3,774.2,hn,breakthrough,Anthropic AI used in Khamenei elimination,ur-whale,https://www.engadget.com/ai/the-us-reportedly-used-anthropics-ai-for-its-attack-on-iran-just-after-banning-it-172908929.html,
1560,0.0,1,775.6,hn,personal,OpenAI amending contract with pentagon amid backlash,discoinverno,https://www.businessinsider.com/openai-amending-contract-with-pentagon-amid-backlash-mass-surveillance-anthropic-2026-3,
1561,0.0,1,776.1,hn,tutorial,Show HN: Core Rth. A governed AI kernel for engineers who don't trust their LLMs,christianrth,https://github.com/rthgit/CORE-RTH,
1562,0.0,11,776.2,hn,breakthrough,Pentagon's Anthropic Designation Won't Survive First Contact with Legal System,elsewhen,https://www.lawfaremedia.org/article/pentagon%27s-anthropic-designation-won%27t-survive-first-contact-with-legal-system,
1563,0.0,6,776.9,hn,breakthrough,Anthropic's Killer-Robot Dispute with The Pentagon,helloplanets,https://www.theatlantic.com/technology/2026/03/inside-anthropics-killer-robot-dispute-with-the-pentagon/686200/,
1564,0.0,2,777.1,hn,tutorial,Show HN: Only firewall for AI prompts with a security grade on every PR,acebot712,https://promptguard.co/,
1565,0.0,3,781.3,hn,meme,Anthropic's Feud with Pentagon Earns It Fans Amid the Blowback,JumpCrisscross,https://www.wsj.com/tech/ai/anthropics-feud-with-pentagon-earns-it-fans-amid-the-blowback-f7e2bb83,
1566,0.0,11,783.0,hn,breakthrough,The Pointless War Between The Pentagon and Anthropic,jrosenblatt,https://www.wsj.com/opinion/the-pointless-war-between-the-pentagon-and-anthropic-9284fd37,
1567,0.0,2,786.0,hn,breakthrough,Show HN: CSV Analyzer – drag-and-drop data analysis with AI insights,atdl,https://csv-analyzer-green.vercel.app,
1568,0.0,12,787.0,hn,breakthrough,Ask HN: What Online LLM / Chat do you use?,ddxv,,
1569,0.0,14,788.0,hn,breakthrough,Anthropic Adds Free Memory Feature and Import Tool to Lure ChatGPT Users,mgh2,https://www.macrumors.com/2026/03/02/anthropic-memory-import-tool/,
1570,0.0,3,788.8,hn,breakthrough,Clawed – On Anthropic and the Department of War,huey77,https://www.hyperdimensional.co/p/clawed,
1571,0.0,17,790.5,hn,breakthrough,"Trump Admin. Still Used Anthropic's Claude in Iran Strikes, Hours After It",cdrnsf,https://sfist.com/2026/03/02/trump-administration-still-used-sfs-anthropic-in-iran-strikes-mere-hours-after-trump-banned-anthropic/,
1572,0.0,3,790.7,hn,breakthrough,Anthropic and Alignment,stochastician,https://stratechery.com/2026/anthropic-and-alignment/,
1573,0.0,3,791.5,hn,breakthrough,Anthropic to Department of Defense: Drop Dead,CrankyBear,https://www.computerworld.com/article/4138860/anthropic-to-department-of-defense-drop-dead.html,
1574,0.0,1,792.4,hn,meme,Show HN: Llmdoc – annotate codebase with LLM summaries only re-scan what changed,tristanMatthias,https://github.com/tristanMatthias/llmdoc,
1575,0.0,5,793.6,hn,breakthrough,Secretary of War Tweets That Anthropic Is Now a Supply Chain Risk,paulpauper,https://thezvi.substack.com/p/secretary-of-war-tweets-that-anthropic,
1576,0.0,5,794.4,hn,breakthrough,Treasury terminates Anthropic AI use after Trump's order,biffles,https://www.axios.com/2026/03/02/treasury-trump-ai-anthropic-pentagon,
1577,0.0,12,794.4,hn,breakthrough,"In The Pentagon Battle with Anthropic, We All Lose",speckx,https://www.thefp.com/p/in-the-pentagon-battle-with-anthropic,
1578,0.0,2,794.4,hn,tutorial,Show HN: Smart-commit-rs – A zero-dependency Git commit tool in Rust,gtkacz,https://github.com/gtkacz/smart-commit-rs,
1579,0.0,7,794.5,hn,breakthrough,OpenAI Just Got Anthropic's Pentagon Deal,sonalidee,https://tapestry.news/tech/openai-pentagon/,
1580,0.0,3,795.0,hn,breakthrough,"OpenAI's ""compromise"" with The Pentagon is what Anthropic feared",joozio,https://www.technologyreview.com/2026/03/02/1133850/openais-compromise-with-the-pentagon-is-what-anthropic-feared/,
1581,0.0,5,795.6,hn,breakthrough,"U.S. Federal Housing, Fannie Mae, Freddie Mac Terminate All Use of Anthropic",nickysielicki,https://twitter.com/pulte/status/2028503809299779866,
1582,0.0,2,795.7,hn,breakthrough,OpenAnt: OSS Vulnerability Discovery (no one wants to compete with Anthropic),ddiinn,https://www.knostic.ai/openant,
1583,0.0,7,796.6,hn,breakthrough,The US Treasury is terminating all use of Anthropic products,nickysielicki,https://twitter.com/secscottbessent/status/2028499953283117283,
1584,0.0,2,796.7,hn,breakthrough,Show HN: Turn – A compiled systems language for agentic computation,askmuyukani,,
1585,0.0,5,796.9,hn,breakthrough,Trump directs all federal agencies to cease use of Anthropic products,nthypes,https://twitter.com/i/status/2028499953283117283,
1586,0.0,2,797.2,hn,breakthrough,"Anthropic/Claude status, signs of what to come of stability?",erksa,https://status.claude.com/uptime,
1587,0.0,39,797.6,hn,breakthrough,How OpenAI caved to The Pentagon on AI surveillance,zachb211,https://www.theverge.com/ai-artificial-intelligence/887309/openai-anthropic-dod-military-pentagon-contract-sam-altman-hegseth,
1588,0.0,4,799.3,hn,tutorial,Show HN: IDAssist – AI augmented reverse engineering for IDA Pro,jtang613,https://github.com/jtang613/IDAssist,
1589,0.0,3,799.9,hn,meme,Show HN: Photon – Rust pipeline that embeds/tags/hashes images locally w SigLIP,pgbouncer,https://github.com/hejijunhao/photon,
1590,0.0,22,800.5,hn,breakthrough,Anthropic and Alignment (Ben Thompson),toomanybits,https://stratechery.com/2026/anthropic-and-alignment/,
1591,0.0,3,800.6,hn,breakthrough,Show HN: AgentKeeper – cognitive persistence layer for AI agents,thinklanceai,,
1592,0.0,40,801.2,hn,breakthrough,How Talks Between Anthropic and the Defense Dept. Fell Apart,m-hodges,https://www.nytimes.com/2026/03/01/technology/anthropic-defense-dept-openai-talks.html,
1593,0.0,6,813.5,hn,tutorial,Ask HN: How will most Anthropic customers respond to the threats by the govt?,Poomba,,
1594,0.0,1,814.6,hn,breakthrough,Dario Amodei on Anthropic's Pentagon Spat,doener,https://www.businessinsider.com/dario-amodei-pentagon-free-speech-patriots-american-values-2026-2,
1595,0.0,3,815.5,hn,breakthrough,Anthropic and the Dow: Anthropic Responds,paulpauper,https://thezvi.substack.com/p/anthropic-and-the-dow-anthropic-responds,
1596,0.0,4,815.9,hn,breakthrough,Proposal: Built-in secret management for Claude Code,bicx,https://github.com/anthropics/claude-code/issues/29910,
1597,0.0,2,817.3,hn,breakthrough,The trap Anthropic built for itself,iancmceachern,https://techcrunch.com/2026/02/28/the-trap-anthropic-built-for-itself/,
1598,0.0,15,818.9,hn,breakthrough,Inside Anthropic's Killer-Robot Dispute with The Pentagon,eoskx,https://www.theatlantic.com/technology/2026/03/inside-anthropics-killer-robot-dispute-with-the-pentagon/,
1599,0.0,1,820.2,hn,tutorial,"Show HN: Epstein-Search – Local, AI-Powered Search Engine for the Epstein Files",simulationship,https://github.com/simulationship/epstein-search,
1600,0.0,25,825.4,hn,breakthrough,"U.S. Strikes in Middle East Use Anthropic, Hours After Trump Ban",slinky3671,https://www.wsj.com/livecoverage/iran-strikes-2026/card/u-s-strikes-in-middle-east-use-anthropic-hours-after-trump-ban-ozNO0iClZpfpL7K7ElJ2,
1601,0.0,4,825.8,hn,comparison,China Wins The Pentagon-Anthropic Brawl,doener,https://www.wsj.com/opinion/anthropic-donald-trump-pentagon-ai-china-u-s-military-467dd6de,
1602,0.0,1,834.5,hn,breakthrough,"Sam Altman Answers Questions on X.com About Pentagon Deal, Threats to Anthropic",MilnerRoute,https://news.slashdot.org/story/26/03/01/0233230/sam-altman-answers-questions-on-xcom-about-pentagon-deal-threats-to-anthropic,
1603,0.0,13,835.2,hn,breakthrough,Strike in the Middle East use Anthropic even after the Trump ban,johncole,https://www.wsj.com/livecoverage/iran-strikes-2026/card/u-s-strikes-in-middle-east-use-anthropic-hours-after-trump-ban-ozNO0iClZpfpL7K7ElJ2,
1604,0.0,2,835.2,hn,meme,Ask HN: How would you know if an AI model has been nerfed?,gitgud,,
1605,0.0,3,836.1,hn,breakthrough,"OpenAI has released Dow contract language, and it's as Anthropic claimed",erwald,https://twitter.com/justanotherlaw/status/2027855993921802484,
1606,0.0,3,836.6,hn,tutorial,Show HN: GitPop – open-source AI Git context menu for Windows (OS X coming soon),vinzify,https://github.com/vinzify/gitpop,
1607,0.0,3,837.0,hn,tutorial,Ask HN: How comfortable are we with agents everywhere?,teekert,,
1608,0.0,4,838.3,hn,breakthrough,Claude hits No 2 on Apple's top free apps list after Pentagon rejection,pseudolus,https://www.cnbc.com/2026/02/28/anthropics-claude-apple-apps.html,
1609,0.0,42,838.6,hn,breakthrough,Anthropic's Claude rises to No. 2 in the App Store following Pentagon dispute,Philpax,https://techcrunch.com/2026/02/28/anthropics-claude-rises-to-no-2-in-the-app-store-following-pentagon-dispute/,
1610,0.0,6,840.6,hn,breakthrough,Trump orders government to stop using Anthropic in battle over AI use,devonnull,https://www.bbc.com/news/articles/cn48jj3y8ezo,
1611,0.0,3,840.8,hn,breakthrough,A Cookie for Dario? – Anthropic and selling death,only_in_america,https://www.anildash.com/2026/02/27/a-cookie-for-dario/,
1612,0.0,1,841.6,hn,breakthrough,The Making of Anthropic CEO Dario Amodei (2025),Kye,https://kantrowitz.medium.com/the-making-of-anthropic-ceo-dario-amodei-449777529dd6,
1613,0.0,3,843.0,hn,breakthrough,"If A.I. Is a Weapon, Who Should Control It?",paulpauper,https://www.nytimes.com/2026/02/28/opinion/artificial-intelligence-trump-hegseth-anthropic.html,
1614,0.0,2,843.1,hn,breakthrough,Should AI chatbots have ads? Anthropic says no,joozio,https://arstechnica.com/ai/2026/02/should-ai-chatbots-have-ads-anthropic-says-no/,
1615,0.0,1,843.8,hn,breakthrough,The Pentagon Wanted a Master Key. Anthropic Said No. That Is Not the Story,sheldonksalmon,https://github.com/AionSystem/AION-BRAIN/blob/main/articles%2FMEDIUM%2FSALMON%27S-FRIDAY-REPORTS%2FPentagon-Vs-Anthropic.md,
1616,0.0,9,844.2,hn,breakthrough,Ask HN: Why People Support Anthropic?,piratesAndSons,,
1617,0.0,2,844.7,hn,comparison,"Anthropic vs. DoD: ""Any lawful use"" is a fight about control",colek42,,
1618,0.0,1,845.1,hn,breakthrough,OpenAI Reaches A.I. Agreement with Defense Dept. After Anthropic Clash,brandonb,https://www.nytimes.com/2026/02/27/technology/openai-agreement-pentagon-ai.html,
1619,0.0,4,846.0,hn,breakthrough,Outside Anthropic's Office in SF,layer8,https://twitter.com/roybahat/status/2027455052655534440,
1620,0.0,8,846.3,hn,breakthrough,Anthropic: Stay Strong,kerim-ca,https://scottaaronson.blog/?p=9591,
1621,0.0,13,847.3,hn,breakthrough,Full transcript of our interview with Anthropic CEO Dario Amodei,layer8,https://www.cbsnews.com/news/anthropic-ceo-dario-amodei-full-transcript/,
1622,0.0,27,847.9,hn,breakthrough,Full Interview: Anthropic CEO Dario Amodei on Pentagon Feud [video],Topfi,https://www.youtube.com/watch?v=MPTNHrq_4LU,
1623,0.0,1,849.1,hn,tutorial,Show HN: Prompt-run – run .prompt files against any LLM from the terminal,maneeshthakur,https://github.com/Maneesh-Relanto/Prompt-Run,
1624,0.0,1,849.5,hn,breakthrough,The week when AI changed everything,edward,https://www.cnn.com/2026/02/28/business/ai-week-anthropic-nvidia-block,
1625,0.0,2,849.6,hn,breakthrough,Hypothetical nuclear attack that escalated Pentagon's showdown with Anthropic,pseudolus,https://www.washingtonpost.com/technology/2026/02/27/anthropic-pentagon-lethal-military-ai/,
1626,0.0,39,851.9,hn,personal,Israel Is Attacking Iran,alsufinow,,
1627,0.0,6,854.5,hn,breakthrough,Trump directs US agencies to toss Anthropic's AI,frb,https://www.reuters.com/world/us/trump-says-he-is-directing-federal-agencies-cease-use-anthropic-technology-2026-02-27/,
1628,0.0,2,856.2,hn,comparison,Who is/was the Anthropic in Amazons rise? What about in Facebook’s?,AbstractH24,,
1629,0.0,7,856.5,hn,breakthrough,OpenAI strikes deal with Pentagon hours after Trump admin bans Anthropic,Bender,https://www.cnn.com/2026/02/27/tech/openai-pentagon-deal-ai-systems,
1630,0.0,4,857.1,hn,breakthrough,OpenAI Reaches A.I. Agreement With Defense Dept. After Anthropic Clash,jbegley,https://www.nytimes.com/2026/02/27/technology/openai-reaches-ai-agreement-with-defense-dept-after-anthropic-clash.html,
1631,0.0,3,857.7,hn,breakthrough,The Reason Anthropic Wants Guardrails,Stratoscope,https://www.theatlantic.com/ideas/2026/02/anthropic-pentagon-ai/686172/,
1632,0.0,6,858.5,hn,breakthrough,We don't have to have unsupervised killer robots,layer8,https://www.theverge.com/ai-artificial-intelligence/885963/anthropic-dod-pentagon-tech-workers-ai-labs-react,
1633,0.0,19,859.8,hn,breakthrough,OpenAI is negotiating a deal with The Pentagon,doener,https://fortune.com/2026/02/27/openai-in-talks-with-pentagon-after-anthropic-blowup/,
1634,0.0,5,859.9,hn,breakthrough,USA Designates Anthropic a Supply Chain Risk,ssutch3,https://www.pbs.org/newshour/politics/trump-orders-federal-agencies-to-stop-using-anthropic-tech-over-ai-safety-dispute,
1635,0.0,2,859.9,hn,breakthrough,"Show HN: I built a 0-CPU desktop app to track LLM limits,Python/DjangoPyWebView",Viper117,https://github.com/PeterJFrancoIII/Antigravity-Model-Reset-Timer,
1636,0.0,6,860.2,hn,breakthrough,Ask HN: Anthropic has stood its ground. What excuse is left for other companies?,chirau,,
1637,0.0,3,860.8,hn,breakthrough,Sam Altman Says OpenAI Is Working on Pentagon Deal,DGAP,https://www.wsj.com/tech/ai/openais-sam-altman-calls-for-de-escalation-in-anthropic-showdown-with-hegseth-03ecbac8,
1638,0.0,8,860.9,hn,breakthrough,Pentagon approves OpenAI safety red lines after dumping Anthropic,galleywest200,https://www.axios.com/2026/02/27/pentagon-openai-safety-red-lines-anthropic,
1639,0.0,3,861.3,hn,breakthrough,Claude's Constitution (2023),ponkylives,https://www.anthropic.com/news/claudes-constitution,
1640,0.0,62,861.7,hn,breakthrough,Altman says OpenAI agrees with Anthropic's red lines in Pentagon dispute,rectang,https://thehill.com/policy/technology/5758898-altman-backs-anthropic-pentagon-stand/,
1641,0.0,3,861.7,hn,breakthrough,Federal agencies may have a Claude problem now,toomuchtodo,https://www.axios.com/2026/02/27/claude-anthropic-trump-government-agencies,
1642,0.0,1,862.2,hn,breakthrough,Trump instructs federal agencies to stop work with Anthropic,empressplay,https://www.cnn.com/2026/02/27/tech/anthropic-pentagon-deadline,
1643,0.0,34,862.7,hn,breakthrough,President Trump orders federal agencies to stop using Anthropic,xfax,https://techcrunch.com/2026/02/27/president-trump-orders-federal-agencies-to-stop-using-anthropic-after-pentagon-dispute/,
1644,0.0,63,863.1,hn,breakthrough,Trump Bans Anthropic from All US Federal Agencies,surprisetalk,https://twitter.com/WhiteHouse/status/2027497719678255148,
1645,0.0,13,863.2,hn,breakthrough,Trump tells government to stop using Anthropic's AI systems,kseniamorph,https://www.nbcnews.com/tech/tech-news/trump-bans-anthropic-government-use-rcna261055,
1646,0.0,11,863.4,hn,breakthrough,Trump orders federal agencies to stop using Anthropic's AI technology,TrackerFF,https://www.cbsnews.com/news/trump-anthropic-ai-order-federal-agencies/,
1647,0.0,38,863.7,hn,breakthrough,Trump Orders Government to Stop Using Anthropic After Pentagon Standoff,jbegley,https://www.nytimes.com/2026/02/27/us/politics/anthropic-military-ai.html,
1648,0.0,6,863.7,hn,breakthrough,Federal Government to restrict use of Anthropic,twism,https://www.cnn.com/2026/02/27/tech/anthropic-pentagon-deadline,
1649,0.0,11,863.7,hn,breakthrough,Trump directs federal agencies to cease use of Anthropic,patrickmay,https://www.reuters.com/world/us/trump-says-he-is-directing-federal-agencies-cease-use-anthropic-technology-2026-02-27/,
