rank,velocity,raw_score,age_hours,platform,spike_type,title,author,url,comments
1,0.3146,766,19.2,hn,breakthrough,Tell HN: Anthropic no longer allowing Claude Code subscriptions to use OpenClaw,firloop,,
2,0.2011,6974,23.8,reddit,personal,Taught Claude to talk like a caveman to use 75% less tokens.,ffatty,https://www.reddit.com/r/ClaudeAI/comments/1sble09/taught_claude_to_talk_like_a_caveman_to_use_75/,
3,0.1677,131467,25.6,youtube,meme,Claude Leaks its Source Code… then Files Copyright Claim,SAMTIME,https://www.youtube.com/watch?v=o1i4FgtXhLA,
4,0.1258,89249,24.1,youtube,breakthrough,Em 48h recriaram o Claude Code de graça,mano deyvin,https://www.youtube.com/watch?v=82IOSYpY6Qo,
5,0.0957,36961,16.6,youtube,tutorial,Ollama + Claude Code = 99% CHEAPER,Nate Herk | AI Automation,https://www.youtube.com/watch?v=O2k_qwZA8HU,
6,0.0802,196616,50.0,youtube,tutorial,When AIs act emotional,Anthropic,https://www.youtube.com/watch?v=D4XTefP3Lsc,
7,0.0645,55639,27.1,youtube,meme,AI News: Anthropic Leak is Bigger Than You Think,Matt Wolfe,https://www.youtube.com/watch?v=BZ1hs2ZcnJc,
8,0.0627,170513,53.1,youtube,tutorial,Why I Switched From ChatGPT to Claude (without losing anything),Dan Martell,https://www.youtube.com/watch?v=XRU-CjzYt_o,
9,0.0606,85756,36.3,youtube,tutorial,the end of  Claude Code,Wes Roth,https://www.youtube.com/watch?v=eR167BCL-4g,
10,0.0593,65,11.6,hn,breakthrough,Emotion concepts and their function in a large language model,dnw,https://www.anthropic.com/research/emotion-concepts-function,
11,0.0472,3382,36.6,reddit,personal,things that claude say (part 2),Neither_Finance4755,https://www.reddit.com/r/ClaudeAI/comments/1sb4w67/things_that_claude_say_part_2/,
12,0.0462,31606,23.6,youtube,comparison,ChatGPT vs Claude Make Minecraft Client From Scratch,Wxter,https://www.youtube.com/watch?v=QQKbk1gD2mk,
13,0.0425,2592415,72.6,youtube,tutorial,Tragic mistake... Anthropic leaks Claude’s source code,Fireship,https://www.youtube.com/watch?v=mBHRPeg8zPU,
14,0.0416,73,15.7,hn,tutorial,Show HN: Travel Hacking Toolkit – Points search and trip planning with AI,borski,https://github.com/borski/travel-hacking-toolkit,
15,0.0359,2433,5.1,youtube,meme,"AI News: Claude Leaks, Free Google AI Updates, + ChatGPT CarPlay",Paul J Lipsky,https://www.youtube.com/watch?v=Y9BOY4k_zb8,
16,0.0293,59462,44.8,youtube,breakthrough,Anthropic's New Claude CONWAY Is Unlike Any AI Before,AI Revolution,https://www.youtube.com/watch?v=x2l7W9aTc5k,
17,0.029,182642,85.8,youtube,tutorial,BREAKING: Claude Code source leaked,Theo - t3․gg,https://www.youtube.com/watch?v=Wvj1mTqyzsQ,
18,0.0251,151715,83.8,youtube,tutorial,Claude Code's entire source code was leaked,NeetCode,https://www.youtube.com/watch?v=LCjkmbHOtys,
19,0.025,10496,17.5,youtube,tutorial,Claude Code Was Leaked… So I Had to Test it,Riley Brown,https://www.youtube.com/watch?v=67Cbb3DyIxA,
20,0.0243,162576,88.8,youtube,tutorial,Claude Code was just leaked... (WOAH),Matthew Berman,https://www.youtube.com/watch?v=dYG8JxtSgmM,
21,0.0215,49993,48.4,youtube,tutorial,Stop Using Claude Code in Terminal (It’s Holding You Back),Simon Scrapes,https://www.youtube.com/watch?v=uhMCy25NBfw,
22,0.0189,94172,75.1,youtube,comparison,Claude is the best AI in 2026,Dan Martell,https://www.youtube.com/watch?v=JvcCMTTr2N8,
23,0.0178,4702,77.7,reddit,personal,Brother,Technical-Relation-9,https://www.reddit.com/r/ClaudeAI/comments/1s9iyp3/brother/,
24,0.0169,111462,88.1,youtube,tutorial,Claude Code Source Code Just Leaked… 8 Things You Must Do,Nate Herk | AI Automation,https://www.youtube.com/watch?v=tXtCK66fPj8,
25,0.0154,12334,25.9,youtube,tutorial,5 INSANE Claude Cowork Use Cases... steal them,Jack Roberts,https://www.youtube.com/watch?v=isjOj4QSaO8,
26,0.0139,32685,48.8,youtube,comparison,Chat GPT-5 vs Claude vs Grok vs Gemini: ¿Cuál es la MEJOR IA en 2026? (Test BRUTAL),Dothaking115,https://www.youtube.com/watch?v=3rPp4SF1Nws,
27,0.0132,34066,51.6,youtube,tutorial,Stop Paying for Claude — This FREE Setup Gives You Claude Code Forever (2026 METHOD),Nick Ponte,https://www.youtube.com/watch?v=yDVwptu-Iz4,
28,0.013,27666,46.1,youtube,breakthrough,تسريب Claude كشف أسرار أخطر من الكود,Ali Shahin,https://www.youtube.com/watch?v=L-qgqSGIBsg,
29,0.0123,5258,102.0,reddit,meme,i dug through claude code's leaked source and anthropic's codebase is absolutely unhinged,Clear_Reserve_8089,https://www.reddit.com/r/ClaudeAI/comments/1s8lkkm/i_dug_through_claude_codes_leaked_source_and/,
30,0.012,96770,98.6,youtube,tutorial,Claude + Nano Banana. Insane Social Media Content in Minutes.,Grow with Alex,https://www.youtube.com/watch?v=CLLyO7f6zKU,
31,0.0116,3149,13.3,youtube,tutorial,Anthropic Just Killed OpenClaw - Here's Why,Build In Public,https://www.youtube.com/watch?v=_4Dz-sfpa7E,
32,0.0113,7166,22.5,youtube,tutorial,Claude: From Beginner To Pro In 21 Minutes,AI Edge,https://www.youtube.com/watch?v=IYF4NtECX3s,
33,0.0108,55276,76.1,youtube,tutorial,Claude Code + NoteBookLM = Infinite Memory,Jack Roberts,https://www.youtube.com/watch?v=6t32nPxeJb8,
34,0.0094,47291,75.6,youtube,tutorial,Anthropic Accidentally Exposed Claude's Code — Here's What We Found,Harkirat Singh,https://www.youtube.com/watch?v=zzh66Uc3Ztc,
35,0.0093,30833,59.5,youtube,tutorial,Don't be 10x Engineer: Lessons from Claude Code Leak by Anthropic..,Singh in USA,https://www.youtube.com/watch?v=Z5tgXcn3eWw,
36,0.0093,19886,46.3,youtube,comparison,Is Claude the best AI right now? #tech #ai #techtok #yaptech,yaptech,https://www.youtube.com/watch?v=JbAgDzKdD_A,
37,0.0092,153034,148.7,youtube,tutorial,Claude Code Just Changed YouTube Videos Forever (Tutorial),Danny Why,https://www.youtube.com/watch?v=idVMGLzrrnU,
38,0.0089,148891,149.1,youtube,tutorial,FULL Claude Code Tutorial for Beginners in 2026! (Step-By-Step),Tech With Tim,https://www.youtube.com/watch?v=qYqIhX9hTQk,
39,0.0086,3853,104.7,reddit,personal,Claude code source code has been leaked via a map file in their npm registry,Nunki08,https://www.reddit.com/r/LocalLLaMA/comments/1s8ijfb/claude_code_source_code_has_been_leaked_via_a_map/,
40,0.0086,26603,57.1,youtube,tutorial,Evin Anahtarını KAPININ Üstünde Unuttular: Claude Nasıl Hacklendi?,Can Deger,https://www.youtube.com/watch?v=iQD2aGaJ8V4,
41,0.0086,64025,94.1,youtube,comparison,ChatGPT vs Gemini vs Claude Hacen Hill Climb Racing Desde Cero,Pishmaan,https://www.youtube.com/watch?v=JOAskNe_qGc,
42,0.0077,50894,88.2,youtube,meme,Claude Code source code LEAKED,Wes Roth,https://www.youtube.com/watch?v=PNjIXYAFgCI,
43,0.0077,16655,46.4,youtube,tutorial,تسريب كود Claude Code!!,Bits & Pixels,https://www.youtube.com/watch?v=ZWI7EF1vTJ0,
44,0.0076,324,101.9,hn,breakthrough,Claude Code users hitting usage limits 'way faster than expected',samizdis,https://www.theregister.com/2026/03/31/anthropic_claude_code_limits/,
45,0.0076,4528,21.6,youtube,comparison,ChatGPT vs Claude? #chatgpt #claude,Maverick | AI & ChatGPT,https://www.youtube.com/watch?v=JcpN2ota7Ks,
46,0.0075,89886,123.3,youtube,tutorial,Claude AI wird dein Leben verändern 🤯 besser als ChatGPT?,Felicia Simon,https://www.youtube.com/watch?v=dsLxBQiUKiI,
47,0.0074,17661,49.1,youtube,comparison,ChatGPT vs Claude vs Gemini hacen My Talking Tom desde CERO,Aldeano_,https://www.youtube.com/watch?v=YWM_xMgGR14,
48,0.0067,16,18.9,hn,breakthrough,Anthropic to limit Using third-party harnesses with Claude subscriptions,guiyuwei,,
49,0.0067,26819,66.1,youtube,tutorial,Full Guide - Build Your Own AI Second Brain with Claude Code,Cole Medin,https://www.youtube.com/watch?v=1FiER-40zng,
50,0.0065,108359,149.1,youtube,tutorial,5 Mind Blowing Claude Cowork Uses Cases,Paul J Lipsky,https://www.youtube.com/watch?v=hW4FHg4-Ss0,
51,0.0065,3027,18.7,youtube,breakthrough,"Maximize Claude Code credits with one hidden command. Opus handles strategy, Sonnet does the rest.",Nick Sadler,https://www.youtube.com/watch?v=NmiKo_KBq38,
52,0.0062,656,7.1,youtube,tutorial,Anthropic's Claude Code Leak: Competitors Will Copy Fast! #shorts,Authority Hacker Podcast,https://www.youtube.com/watch?v=OcTy2cXm3Ik,
53,0.0061,12754,45.6,youtube,breakthrough,Claude's leaked source code is absolutely UNHINGED!,Sabrina Ramonov 🍄,https://www.youtube.com/watch?v=IxDvlrhfpHo,
54,0.006,25047,67.8,youtube,tutorial,بناء موقع احترافي بالـ AI ف 2026 — Claude Code شرح كامل للمبتدئين 🚀,Aouragh Anas,https://www.youtube.com/watch?v=fIlzsa4Srwg,
55,0.0057,12928,47.9,youtube,tutorial,Every Claude Code User Should Watch This,Builders Central,https://www.youtube.com/watch?v=dfdYnYJm4FA,
56,0.0055,8,13.8,hn,breakthrough,"Anthropic struggling with Chinese competition, its own safety obsession",davikr,https://www.theregister.com/2026/03/28/miss_anthropic_not_those_who/,
57,0.0055,139,75.7,hn,breakthrough,OpenAI demand sinks on secondary market as Anthropic runs hot,helsinkiandrew,https://www.bloomberg.com/news/articles/2026-04-01/openai-demand-sinks-on-secondary-market-as-anthropic-runs-hot,
58,0.0055,33423,83.6,youtube,tutorial,Claude Opus 4.7 + Sonnet 4.8 + Mythos 5 ALL Leaked & New Claude Code Features!,WorldofAI,https://www.youtube.com/watch?v=OIfRt1oyAss,
59,0.0053,6194,32.6,youtube,tutorial,How to USE Claude Code for FREE with Ollama ( Local AI FULL Tutorial),Ksk Royal,https://www.youtube.com/watch?v=-V8fWL3oXTQ,
60,0.0052,4663,27.7,youtube,tutorial,Claude Code + Nano Banana 2 + FireCrawl = БЕЗУМНЫЕ Сайты за $12К,ИИ МАСТОДОНТ,https://www.youtube.com/watch?v=-PwQl_NCh48,
61,0.0051,201,97.6,hn,breakthrough,Show HN: Postgres extension for BM25 relevance-ranked full-text search,tjgreen,https://github.com/timescale/pg_textsearch,
62,0.0051,20372,66.0,youtube,tutorial,5 SECRET Claude Codes That Make it 10x More Powerful #claude #claudeprompts,Zack the AI Guy,https://www.youtube.com/watch?v=VkVNjcy2VUc,
63,0.0051,13342,51.8,youtube,tutorial,The AI System Most People Aren’t Building (Claude Code + Obsidian),Rick Mulready,https://www.youtube.com/watch?v=2COkMJPHINY,
64,0.005,81337,147.2,youtube,tutorial,Anthropic's Biggest Mistake Just Leaked Their Most Powerful AI (+ 9 AI Updates),Vaibhav Sisinty,https://www.youtube.com/watch?v=c4Mgp3FWvt0,
65,0.0044,5773,34.9,youtube,tutorial,"I Built a Tool That Runs Claude Code with ANY AI Model — GPT, Codex, Gemini, DeepSeek, Free Models",Anton Abyzov: AI Power,https://www.youtube.com/watch?v=k0RI_M6lIsg,
66,0.0043,1888,104.2,reddit,tutorial,Someone just leaked claude code's Source code on X,abhi9889420,https://www.reddit.com/r/ChatGPT/comments/1s8j27e/someone_just_leaked_claude_codes_source_code_on_x/,
67,0.0041,11,20.2,hn,breakthrough,"Claude AI finds Vim, Emacs RCE bugs that trigger on file open",akyuu,https://www.bleepingcomputer.com/news/security/claude-ai-finds-vim-emacs-rce-bugs-that-trigger-on-file-open/,
68,0.004,5171,34.5,youtube,tutorial,Я потратил на Claude Code 1 000 часов. Вот что нужно знать для вайб-кодинга,Нейропросвещение,https://www.youtube.com/watch?v=sx6ZSbc51gY,
69,0.0038,900,12.1,youtube,tutorial,Claude Advanced Voice Is NOT Trying to Be ChatGPT,The Human Stack,https://www.youtube.com/watch?v=7fsXjEfRR1s,
70,0.0037,4498,183.4,reddit,personal,Claude watching me write code manually after I hit the daily limit,Technical-Relation-9,https://www.reddit.com/r/ClaudeAI/comments/1s5ok5r/claude_watching_me_write_code_manually_after_i/,
71,0.0037,1478,98.2,reddit,personal,Just a helpful open-source contributor,MagicZhang,https://www.reddit.com/r/LocalLLaMA/comments/1s8rb48/just_a_helpful_opensource_contributor/,
72,0.0037,66260,155.0,youtube,tutorial,"""CHAT GPT""  vs  ""CLAUDE  SONNET"" #coding #programming #python #javascript #html #css #cssanimation",𝗔𝘇𝗶𝘇 𝗖𝗼𝗱𝗲𝘅,https://www.youtube.com/watch?v=RBqVGR6RtvA,
73,0.0035,51856,138.1,youtube,breakthrough,Anthropic’s New Claude MYTHOS Is The Most Powerful AI Ever!,AI Revolution,https://www.youtube.com/watch?v=M6yRREy_5CM,
74,0.0034,251,139.8,hn,breakthrough,Claude Code runs Git reset –hard origin/main against project repo every 10 mins,mthwsjc_,https://github.com/anthropics/claude-code/issues/40710,
75,0.0034,51442,141.1,youtube,comparison,Why I switched from ChatGPT to Claude?,Dan Martell,https://www.youtube.com/watch?v=MMnzVfMZ-NI,
76,0.0033,25475,97.1,youtube,tutorial,Claude Code’un Kaynak Kodu Ortaya Saçıldı,Oğuz Ergin,https://www.youtube.com/watch?v=-u8oq4ZafII,
77,0.0032,5564,226.0,reddit,personal,25 years. Multiple specialists. Zero answers. One Claude conversation cracked it.,the_kuka,https://www.reddit.com/r/ClaudeAI/comments/1s41fny/25_years_multiple_specialists_zero_answers_one/,
78,0.0032,14251,70.9,youtube,tutorial,FULL Claude ai Tutorial for Beginners in 2026!,Nid Academy,https://www.youtube.com/watch?v=ECbTVzZuzzA,
79,0.003,3326,175.7,reddit,tutorial,"I've been ""gaslighting"" my AI models and it's producing insanely better results with simple prompt i",naculalex,https://www.reddit.com/r/ClaudeAI/comments/1s5wp0g/ive_been_gaslighting_my_ai_models_and_its/,
80,0.0029,445,210.5,hn,breakthrough,Judge blocks Pentagon effort to 'punish' Anthropic with supply chain risk label,prawn,https://www.cnn.com/2026/03/26/business/anthropic-pentagon-injunction-supply-chain-risk,
81,0.0029,7793,53.1,youtube,tutorial,These 3 Frameworks Make Claude Code Unstoppable,Eric Tech,https://www.youtube.com/watch?v=bzutStZJ1Ig,
82,0.0028,1138,98.3,reddit,comparison,How it started vs How it's going,HornyGooner4401,https://www.reddit.com/r/LocalLLaMA/comments/1s8r3w3/how_it_started_vs_how_its_going/,
83,0.0027,2,9.0,hn,breakthrough,Using AI to track the cost of Guinness,pieterr,https://fortune.com/2026/03/30/guinness-beer-prices-ireland-anthropic-claude-ai/,
84,0.0027,53203,164.4,youtube,tutorial,Claude Code for FREE | Skip the $200/Month Subscription,Eric Tech,https://www.youtube.com/watch?v=o85Y5omRQq0,
85,0.0025,4658,233.4,reddit,personal,Giving Claude access to my MacBook / macOS,namebrained,https://www.reddit.com/r/ClaudeAI/comments/1s3ss8s/giving_claude_access_to_my_macbook_macos/,
86,0.0025,260,167.4,hn,breakthrough,"Further human + AI + proof assistant work on Knuth's ""Claude Cycles"" problem",mean_mistreater,https://twitter.com/BoWang87/status/2037648937453232504,
87,0.0023,62,77.9,hn,breakthrough,Show HN: Baton – A desktop app for developing with AI agents,tordrt,https://getbaton.dev/,
88,0.0023,139,123.6,hn,tutorial,"Show HN: Zerobox – Sandbox any command with file, network, credential controls",afshinmeh,https://github.com/afshinm/zerobox,
89,0.0022,59,78.9,hn,meme,Ask HN: Client took over development by vibe coding. What to do?,piscator,,
90,0.0022,16423,95.1,youtube,tutorial,Claude Code LEAKS is INSANE!,Julian Goldie SEO,https://www.youtube.com/watch?v=DUP4ccA2mDM,
91,0.0022,45240,167.3,youtube,comparison,5 Open Source Repos That Make Claude Code UNSTOPPABLE (March 2026),Chase AI,https://www.youtube.com/watch?v=6SnFH43qPAw,
92,0.002,40995,169.1,youtube,comparison,ChatGPT vs Claude vs Gemini vs DeepSeek — 4-Stroke Engine Animation ( #aicoding  #chatgpt,AI Code Clash,https://www.youtube.com/watch?v=ORKZMLpyXiQ,
93,0.002,29506,140.7,youtube,breakthrough,استخدم Claude أفضل من 90% من الناس (الدليل الكامل),مدرسة الذكاء الاصطناعي,https://www.youtube.com/watch?v=jdnXYcZmCCE,
94,0.0019,2,11.1,hn,tutorial,Show HN: Anos – a hand-written ~100KiB microkernel for x86-64 and RISC-V,noone_youknow,https://github.com/roscopeco/anos,
95,0.0019,3,14.7,hn,breakthrough,"A broken auto-live poller, and what perceived urgency does to Claude Code",cmeiklejohn,https://christophermeiklejohn.com/ai/zabriskie/reliability/2026/04/03/the-feature-that-has-never-worked.html,
96,0.0019,9744,77.1,youtube,tutorial,Claude Code Works Better When You Do This,Eric Tech,https://www.youtube.com/watch?v=D5bRTv6GhXk,
97,0.0018,3771,246.7,reddit,personal,This new Claude update is crazy,MetaKnowing,https://www.reddit.com/r/ClaudeAI/comments/1s37yiy/this_new_claude_update_is_crazy/,
98,0.0018,36,66.7,hn,breakthrough,Obfuscation is not security – AI can deobfuscate any minified JavaScript code,rvz,https://www.afterpack.dev/blog/claude-code-source-leak,
99,0.0018,29786,148.1,youtube,comparison,Is Claude Pro Worth $20? Free vs Pro vs Max (2026),The AI Productivity Coach,https://www.youtube.com/watch?v=Sdewx3GpJ1Q,
100,0.0015,273,227.9,hn,breakthrough,Government agencies buy commercial data about Americans in bulk,nuke-web3,https://www.npr.org/2026/03/25/nx-s1-5752369/ice-surveillance-data-brokers-congress-anthropic,
101,0.0014,6950,76.1,youtube,tutorial,اتقن 90 بالمية من claude code في 23 دقيقة,Abdallahkh,https://www.youtube.com/watch?v=CE60fFNZ0Go,
102,0.0013,337,77.2,reddit,meme,The Claude Code leak accidentally published the first complete blueprint for production AI agents. H,Joozio,https://www.reddit.com/r/artificial/comments/1s9jprb/the_claude_code_leak_accidentally_published_the/,
103,0.0012,5,26.0,hn,breakthrough,Anthropic's next model could be a 'watershed moment' for cybersecurity,agiacalone,https://www.cnn.com/2026/04/03/tech/anthropic-mythos-ai-cybersecurity,
104,0.0012,43,90.4,hn,breakthrough,GitHub has DMCA'd nearly all forks of the official Claude-code repo,cg505,https://github.com/anthropics/claude-code/forks,
105,0.0012,5898,74.9,youtube,meme,"I Read 512,000 Lines of Leaked Claude Code So You Don't Have To",Nick Puru | AI Automation,https://www.youtube.com/watch?v=y2cr1bRTcgc,
106,0.0012,9836,98.0,youtube,tutorial,Qwen 3.6 Plus is 100% FREE AI Model BEATS Claude Sonnet 4.6 Builds INSANE Apps in 1 Prompt 🤯,The Metaverse Guy,https://www.youtube.com/watch?v=K5FOXqwXnDo,
107,0.0011,5030,385.4,reddit,personal,Just in case,JerryH_,https://www.reddit.com/r/ClaudeAI/comments/1ry5hkp/just_in_case/,
108,0.0011,2,16.4,hn,breakthrough,Scaling tool orchestration data will emerge different intelligence and LLMs,arkariarn,,
109,0.0011,13,49.1,hn,breakthrough,Anthropic's AutoDream Is Flawed,k1musab1,https://substack.com/home/post/p-192893121,
110,0.0011,174,210.9,hn,comparison,Order Granting Preliminary Injunction – Anthropic vs. U.S. Department of War [pdf],theindieman,https://storage.courtlistener.com/recap/gov.uscourts.cand.465515/gov.uscourts.cand.465515.134.0.pdf,
111,0.0011,483,382.5,hn,breakthrough,Anthropic takes legal action against OpenCode,_squared_,https://github.com/anomalyco/opencode/pull/18186,
112,0.001,8143,522.8,reddit,personal,Why the majority of vibe coded projects fail,harrysofgaming,https://www.reddit.com/r/ClaudeAI/comments/1rt31th/why_the_majority_of_vibe_coded_projects_fail/,
113,0.001,2300,270.2,reddit,personal,There are levels to this game...,Complete-Sea6655,https://www.reddit.com/r/ChatGPT/comments/1s2bny3/there_are_levels_to_this_game/,
114,0.001,8312,99.6,youtube,comparison,ChatGPT vs Claude vs Cursor Making 3D Spider-Man Game,WeeklyHow,https://www.youtube.com/watch?v=Tpx3fLV6LaE,
115,0.001,6085,82.5,youtube,breakthrough,"Claude Epitaxy, Mythos FAST Mode, Opus 4.7, Sonnet 4.8, Leaks: This is CRAZY!!!",AICodeKing,https://www.youtube.com/watch?v=Cw2vh9ioydM,
116,0.0009,12,53.7,hn,tutorial,Show HN: Skales – I built a desktop AI agent a 6-year-old can use,marioskales,https://github.com/skalesapp/skales,
117,0.0008,225,289.9,hn,tutorial,Show HN: Cq – Stack Overflow for AI coding agents,peteski22,https://blog.mozilla.ai/cq-stack-overflow-for-agents/,
118,0.0007,70,45.1,reddit,comparison,[R] Is autoresearch really better than classic hyperparameter tuning?,Educational_Strain_3,https://www.reddit.com/r/MachineLearning/comments/1satj6r/r_is_autoresearch_really_better_than_classic/,
119,0.0007,6,40.7,hn,breakthrough,Show HN: Composer – AI architect / MCP for software architecture diagrams,olivergrabner,https://www.usecomposer.com/,
120,0.0007,7,45.1,hn,breakthrough,"Anthropic says: nothing wrong with our usage limits, you're hallucinating",aeneas_ory,https://www.reddit.com/r/ClaudeAI/s/u7aJKSDmfy,
121,0.0007,7,45.7,hn,breakthrough,Ask HN: How relevant is low code according to you in today’s world with Claude?,kinj28,,
122,0.0007,6,40.7,hn,breakthrough,The Catholic Priest Who Helped Write Anthropic's A.I. Ethics Code,Geekette,https://observer.com/2026/03/the-catholic-priest-who-helped-write-anthropics-ai-ethics-code/,
123,0.0007,8,46.5,hn,breakthrough,The MVC Mistake,ibobev,https://entropicthoughts.com/mvc-mistake,
124,0.0007,114,212.5,hn,breakthrough,Anthropic Subprocessor Changes,tencentshill,https://trust.anthropic.com,
125,0.0007,7007,114.9,youtube,comparison,ChatGPT vs Claude: esto ya no tiene competencia (2026),Pocho Costa,https://www.youtube.com/watch?v=vGknCE_c7U8,
126,0.0006,4056,494.6,reddit,personal,I used Claude Code to reverse engineer a 13-year-old game binary and crack a restriction nobody had ,CelebrationFew1755,https://www.reddit.com/r/ClaudeAI/comments/1ru3irp/i_used_claude_code_to_reverse_engineer_a/,
127,0.0006,3361,453.9,reddit,meme,Whenever I pour my heart out to Claude a little…,porcupine-pete,https://www.reddit.com/r/ClaudeAI/comments/1rvkpd5/whenever_i_pour_my_heart_out_to_claude_a_little/,
128,0.0006,161,274.3,hn,breakthrough,Show HN: ProofShot – Give AI coding agents eyes to verify the UI they build,jberthom,https://github.com/AmElmo/proofshot,
129,0.0006,2,23.0,hn,personal,XC Scribe – AI product description generator with direct e-commerce sync,ikkans,,
130,0.0005,29926,842.2,reddit,meme,"Cancel your ChatGPT Plus, burn their compute on the way out, and switch to Claude",boomroom11,https://www.reddit.com/r/ChatGPT/comments/1rh60py/cancel_your_chatgpt_plus_burn_their_compute_on/,
131,0.0005,9057,815.5,reddit,personal,Grok has become self-aware?,TailungFu,https://www.reddit.com/r/ChatGPT/comments/1ri505i/grok_has_become_selfaware/,
132,0.0005,1,17.2,hn,personal,"Show HN: Meetrics – Track anything, correlate anything, ask your data questions",sergeybok,https://github.com/sergeybok/meetrics-support/blob/main/BLOG/CANCER.md,
133,0.0005,2,25.1,hn,tutorial,"Show HN: Matrix OS, like Lovable, but for personal apps",hamedmp,https://matrix-os.com/,
134,0.0005,36,144.1,hn,meme,Stripe withheld $85k from our EU platform,MelkerWendelbo,,
135,0.0005,2,26.5,hn,breakthrough,OpenAI's fall from grace as investors race to Anthropic,SilverElfin,https://www.latimes.com/business/story/2026-04-01/openais-shocking-fall-from-grace-as-investors-race-to-anthropic,
136,0.0004,7086,811.3,reddit,meme,Claude’s extended thinking found out about Iran in real time,schuttdev,https://www.reddit.com/r/ClaudeAI/comments/1ribnke/claudes_extended_thinking_found_out_about_iran_in/,
137,0.0004,6436,835.1,reddit,personal,Claude has overtaken ChatGPT in the Apple App Store,Pure_Perception7328,https://www.reddit.com/r/ClaudeAI/comments/1rhgsjz/claude_has_overtaken_chatgpt_in_the_apple_app/,
138,0.0004,3983,582.9,reddit,tutorial,"""Claude, make a video about what it's like to be an LLM""",MetaKnowing,https://www.reddit.com/r/ClaudeAI/comments/1rqqtes/claude_make_a_video_about_what_its_like_to_be_an/,
139,0.0004,1642,373.4,reddit,personal,Bernie Sanders has a conversation with Claude,DinoZambie,https://www.reddit.com/r/ChatGPT/comments/1rymwb5/bernie_sanders_has_a_conversation_with_claude/,
140,0.0004,988,265.9,reddit,comparison,Best model that can beat Claude opus that runs on 32MB of vram?,PrestigiousEmu4485,https://www.reddit.com/r/LocalLLaMA/comments/1s2i7pw/best_model_that_can_beat_claude_opus_that_runs_on/,
141,0.0004,2,30.2,hn,comparison,LLM Drift in Long Sessions: Claude 60% vs. 85% Integrity After 25 Turns,calmkeepai,https://calmkeep.ai/codetestreport,
142,0.0004,5,52.0,hn,tutorial,Show HN: An MCP server for Devops automation,czhu12,,
143,0.0004,5,53.7,hn,tutorial,Show HN: Fonic – turning scattered work into a shareable report,darraghmckay,https://fonic.ai,
144,0.0004,38,161.6,hn,breakthrough,"Anthropic's Mythos leak: 3k files in a public CMS, and what the docs revealed",Aedelon,https://medium.com/ai-advances/anthropic-claude-mythos-leak-analysis-b77c1b304eb8,
145,0.0004,65,206.7,hn,breakthrough,"A leak reveals that Anthropic is testing a more capable AI model ""Claude Mythos""",Tiberium,https://fortune.com/2026/03/26/anthropic-says-testing-mythos-powerful-new-ai-model-after-data-leak-reveals-its-existence-step-change-in-capabilities/,
146,0.0004,72,230.2,hn,breakthrough,Show HN: Robust LLM extractor for websites in TypeScript,andrew_zhong,https://github.com/lightfeed/extractor,
147,0.0004,87,240.9,hn,tutorial,Show HN: Optio – Orchestrate AI coding agents in K8s to go from ticket to PR,jawiggins,https://github.com/jonwiggins/optio,
148,0.0004,115,311.0,hn,breakthrough,Teaching Claude to QA a mobile app,azhenley,https://christophermeiklejohn.com/ai/zabriskie/development/android/ios/2026/03/22/teaching-claude-to-qa-a-mobile-app.html,
149,0.0004,1,18.7,hn,breakthrough,Ask HN: Anthropic changing billing for third-party harnesses for Teams Accounts?,qdot76367,,
150,0.0004,1,20.6,hn,tutorial,Show HN: Plan with Centel – ship like Anthropic,marcel-felix,https://usecentel.com/,
151,0.0004,2,30.8,hn,breakthrough,Anthropics uses new math for their new agents wrapped in a runtime,nicbogaert,https://nicholasjbogaert.substack.com/p/i-published-the-architecture-anthropic,
152,0.0004,4,42.7,hn,breakthrough,Harvard QCD Professor vibe codes quality research paper,jgamman,https://www.anthropic.com/research/vibe-physics,
153,0.0004,4,43.0,hn,comparison,"Anthropic's ""Follow-Up"" on Usage Limits: What They Said vs. What We Experienced",bustah,https://sloppish.com/rationing-followup.html,
154,0.0004,60,212.8,hn,breakthrough,Anthropic Update on Session Limits,chunkycapybara,https://old.reddit.com/r/Anthropic/comments/1s4iefu/update_on_session_limits/,
