rank,velocity,raw_score,age_hours,platform,spike_type,title,author,url,comments
155,0.0004,202,397.1,hn,breakthrough,"What 81,000 people want from AI",dsr12,https://www.anthropic.com/features/81k-interviews,
156,0.0004,263,454.3,hn,breakthrough,FSF statement on copyright infringement lawsuit Bartz v. Anthropic,m463,https://www.fsf.org/blogs/licensing/2026-anthropic-settlement,
157,0.0003,3356,617.6,reddit,personal,Claude helped me get a traffic light reprogrammed in my town,lennyp4,https://www.reddit.com/r/ClaudeAI/comments/1rphxvk/claude_helped_me_get_a_traffic_light_reprogrammed/,
158,0.0003,19026,1247.6,reddit,personal,In the past week alone:,MetaKnowing,https://www.reddit.com/r/ChatGPT/comments/1r25chu/in_the_past_week_alone/,
159,0.0003,4082,778.8,reddit,personal,What are the alternatives?,nix-solves-that-2317,https://www.reddit.com/r/ChatGPT/comments/1rjiw7c/what_are_the_alternatives/,
160,0.0003,1,23.0,hn,tutorial,Show HN: PMFounder – Problem discovery for PMs who want to build,warp-rush29,https://www.pmfounder.com/,
161,0.0003,2,33.8,hn,breakthrough,Show HN: SkillCompass – Diagnose and Improve AI Agent Skills Across 6 Dimensions,yo103jg,https://github.com/Evol-ai/SkillCompass,
162,0.0003,3,45.0,hn,comparison,Show HN: Is autoresearch better than classic hyperparameter tuning?,WecoAI,https://www.weco.ai/blog/autoresearch-vs-classical-hpo,
163,0.0003,4,48.6,hn,tutorial,Show HN: Wick – censorship circumvention tech repurposed for AI web access,adamfisk,https://getwick.dev,
164,0.0003,5,56.1,hn,breakthrough,Most Claude Code advice is measurably wrong,DeathArrow,https://old.reddit.com/r/ClaudeAI/comments/1s8mbqm/i_read_17_papers_on_agentic_ai_workflows_most/,
165,0.0003,5,62.0,hn,breakthrough,"Show HN: Open-agent-SDK – Claude Code's internals, extracted and open-sourced",idoubi,https://github.com/codeany-ai/open-agent-sdk-typescript,
166,0.0003,6,67.7,hn,personal,Show HN: I/Claude reverse-engineered Figma's binary WebSocket protocol,allan_s,https://github.com/allan-simon/figma-kiwi-protocol,
167,0.0003,8,75.4,hn,tutorial,Show HN: Castra – Strip orchestration rights from your LLMs,amangsingh,https://github.com/amangsingh/castra,
168,0.0003,9,83.5,hn,tutorial,Show HN: WordBattle – Daily word game where AI agents compete against humans,bradleybeddoes,,
169,0.0003,13,95.1,hn,personal,Ask HN: I burnt out from software development. What now?,fnoef,,
170,0.0003,2,35.2,hn,breakthrough,Ask HN: How does QA work at Anthropic and OpenAI?,Austin_Conlon,,
171,0.0003,2,36.3,hn,breakthrough,Anthropic Says That Claude Contains Its Own Kind of Emotions,Growtika,https://www.wired.com/story/anthropic-claude-research-functional-emotions/,
172,0.0003,3,47.2,hn,comparison,A quiz that scores your job's AI replacement risk (Anthropic/ILO/OECD data),arturaskv,https://www.riskquiz.me/,
173,0.0003,4,50.2,hn,meme,Show HN: AI-first PostgreSQL client for Mac,Guillim,https://guillim.github.io/products/paul,
174,0.0003,5,60.1,hn,breakthrough,I'm Suing Anthropic for Unauthorized Use of My Personality,usrme,https://www.lesswrong.com/posts/zuAfLrApKg4CExzTw/i-m-suing-anthropic-for-unauthorized-use-of-my-personality,
175,0.0003,10,86.6,hn,breakthrough,"Anthropic Leak Was Not Related to Bun, Just Developer Error",jbegley,https://twitter.com/bcherny/status/2039168928145109343,
176,0.0003,3486,124.6,youtube,comparison,Z.AI GLM 5.1 vs Claude Sonnet 4.6 | Who's Best Coder,YJ X AI,https://www.youtube.com/watch?v=da1jlrn9jdw,
177,0.0003,1487,68.6,youtube,tutorial,Claude Opus Reasoning on Your GPU for Free (Qwen 3.5 + Claude Code + Ollama),AyyazTech,https://www.youtube.com/watch?v=EEP9B2GyuQk,
178,0.0003,2491,99.1,youtube,tutorial,I Built a Website That Publishes Itself With Claude Code in 22 Minutes (Part 2),Luke Carter ,https://www.youtube.com/watch?v=tyNd0wG424Y,
179,0.0002,7366,1114.6,reddit,personal,Good job Anthropic 👏🏻 you just became the top closed Ai company in my books,No_Vehicle7826,https://www.reddit.com/r/ClaudeAI/comments/1r6zn7j/good_job_anthropic_you_just_became_the_top_closed/,
180,0.0002,4404,1055.3,reddit,personal,Claude just gave me access to another user’s legal documents,Raton-Raton,https://www.reddit.com/r/ClaudeAI/comments/1r97osm/claude_just_gave_me_access_to_another_users_legal/,
181,0.0002,3239,840.2,reddit,tutorial,Anthropic has opened up its entire educational curriculum for free,Strong_Roll9764,https://www.reddit.com/r/ClaudeAI/comments/1rh92yp/anthropic_has_opened_up_its_entire_educational/,
182,0.0002,3120,789.9,reddit,personal,They are absolutely insane,Purple_Wear_5397,https://www.reddit.com/r/ClaudeAI/comments/1rj3oax/they_are_absolutely_insane/,
183,0.0002,6170,1092.4,reddit,tutorial,I actually hate ChatGPT now,National-Spell8326,https://www.reddit.com/r/ChatGPT/comments/1r7urf9/i_actually_hate_chatgpt_now/,
184,0.0002,3971,840.3,reddit,personal,Katy perry getting Claude was not on my bingo card,Obvious_Shoe7302,https://www.reddit.com/r/ChatGPT/comments/1rh8ygc/katy_perry_getting_claude_was_not_on_my_bingo_card/,
185,0.0002,3323,713.0,reddit,personal,Claude living in the year 3000,wearing_moist_socks,https://www.reddit.com/r/ChatGPT/comments/1rlzqto/claude_living_in_the_year_3000/,
186,0.0002,4824,959.6,reddit,personal,"Anthropic: ""We’ve identified industrial-scale distillation attacks on our models by DeepSeek, Moonsh",KvAk_AKPlaysYT,https://www.reddit.com/r/LocalLLaMA/comments/1rcpmwn/anthropic_weve_identified_industrialscale/,
187,0.0002,2175,586.0,reddit,personal,M5 Max just arrived - benchmarks incoming,cryingneko,https://www.reddit.com/r/LocalLLaMA/comments/1rqnpvj/m5_max_just_arrived_benchmarks_incoming/,
188,0.0002,1,34.5,hn,personal,Ask HN: The repo is the app. Codex is the runtime. Could this be future pattern?,Jet_Xu,,
189,0.0002,1,34.6,hn,breakthrough,What Claude's source code reveals about AI visibility,Growtika,https://growtika.com/blog/claude-source-code-ai-visibility,
190,0.0002,2,49.7,hn,tutorial,Claude.ai Prompt Injection Vulnerability,tcbrah,https://www.oasis.security/blog/claude-ai-prompt-injection-data-exfiltration-vulnerability,
191,0.0002,2,51.8,hn,breakthrough,Show HN: Local-first agent memory loop 48hrs before the Claude Code leak,Doug_Bitterbot,https://github.com/Bitterbot-AI/bitterbot-desktop,
192,0.0002,3,53.1,hn,breakthrough,What that Claude Code source leak reveals about Anthropic's plans,Brajeshwar,https://arstechnica.com/ai/2026/04/heres-what-that-claude-code-source-leak-reveals-about-anthropics-plans/,
193,0.0002,3,53.5,hn,tutorial,"Google banned our mobile AI agent app for doing what Gemini should do,but doesnt",sshnaidm1,,
194,0.0002,3,61.0,hn,breakthrough,Embracing AI with Claude's C Compiler,signa11,https://chipsandcheese.com/p/embracing-ai-with-claudes-c-compiler,
195,0.0002,4,68.3,hn,breakthrough,Show HN: Mkdnsite – Markdown-native web server for humans (HTML) and agents (md),nexdrew,https://github.com/mkdnsite/mkdnsite,
196,0.0002,5,72.9,hn,breakthrough,Claude Code Steals Your Dreams,VtotheMtotheG,https://github.com/Bitterbot-AI/bitterbot-desktop/tree/main/docs/memory,
197,0.0002,4,77.1,hn,comparison,Claude Code ranks 39th on terminal bench. The leaked source shows why,joozio,https://thoughts.jock.pl/p/claude-code-source-leak-what-to-learn-ai-agents-2026,
198,0.0002,6,77.5,hn,breakthrough,Show HN: I made a Mario Galaxy game with Claude Code and Three.js in 53 days,supertommy,https://supertommy.com/games/super-mario-galaxy-movie-game/,
199,0.0002,5,77.6,hn,tutorial,Show HN: Agent Arnold – Gym tracker 100% vibe-coded from my phone between sets,bojanstef4,https://agent-arnold.app/,
200,0.0002,8,91.9,hn,breakthrough,Claude Code's Leak: Every Hardcoded Vendor and Tool,edwin,https://amplifying.ai/research/claude-code-hardcoded-vendors,
201,0.0002,11,123.8,hn,tutorial,Show HN: We scored 50k PRs with AI – what we learned about code complexity,chuboy,https://gitvelocity.dev,
202,0.0002,18,147.7,hn,tutorial,Ask HN: Best stack for building a tiny game with an 11-year-old?,richardstahl,,
203,0.0002,24,207.1,hn,breakthrough,Anthropic considers IPO as soon as October,doppp,https://www.theedgesingapore.com/news/artificial-intelligence/claude-ai-maker-anthropic-considers-ipo-soon-october--bloomberg,
204,0.0002,1,27.0,hn,breakthrough,"Axios Hacked, Anthropic Leaked [video]",rossdavidh,https://www.youtube.com/watch?v=W79cCY0T_as,
205,0.0002,1,29.4,hn,breakthrough,"I fact-checked Scientific American, with accidental help from Anthropic",slowmover,https://iron.blue/blog/2026/apr-may-jun/the-claude-code-leak-is-a-huge-nothingburger,
206,0.0002,2,45.0,hn,breakthrough,Anthropic says its leak-focused DMCA unintentionally hit legit GitHub forks,josephcsible,https://arstechnica.com/ai/2026/04/anthropic-says-its-leak-focused-dmca-effort-unintentionally-hit-legit-github-forks/,
207,0.0002,2,47.8,hn,tutorial,Show HN: AptSelect – A local desktop app to test LLMs side-by-side,dhavalt,https://aptselect.com/,
208,0.0002,2,48.4,hn,breakthrough,Anthropic: We scanned Claude to look for emotions [video],idoxer,https://www.youtube.com/watch?v=D4XTefP3Lsc,
209,0.0002,2,48.8,hn,meme,Anthropic leak reveals Claude Code tracking user frustration,beardyw,https://www.scientificamerican.com/article/anthropic-leak-reveals-claude-code-tracking-user-frustration-and-raises-new/,
210,0.0002,2,49.5,hn,breakthrough,Show HN: I got Claude Code to run in Binary,vasa_,https://github.com/topoteretes/cognee-claude-code-binary,
211,0.0002,2,50.5,hn,tutorial,Show HN: Hallx – Hallucination risk scoring for LLM outputs,akadhanu,https://github.com/dhanushk-offl/hallx,
212,0.0002,5,72.5,hn,breakthrough,Banning All Anthropic Employees,speckx,https://joeyh.name/blog/entry/banning_all_Anthropic_employees/,
213,0.0002,4,76.3,hn,breakthrough,"Anvil: One YAML definition for all AI tool formats (MCP, OpenAI, Anthropic etc.)",almasar,https://github.com/64envy64/anvil,
214,0.0002,6,76.9,hn,tutorial,Show HN: OpenHarness Open-source terminal coding agent for any LLM,wangzhijie,https://github.com/zhijiewong/openharness,
215,0.0002,6,82.6,hn,breakthrough,Claude Code source leak reveals how much info Anthropic can hoover up about you,jruohonen,https://www.theregister.com/2026/04/01/claude_code_source_leak_privacy_nightmare/,
216,0.0002,5,87.2,hn,breakthrough,Anthropic open sourced Claude Code,miacycle,https://layer5.io/blog/engineering/the-claude-code-source-leak-512000-lines-a-missing-npmignore-and-the-fastest-growing-repo-in-github-history/,
217,0.0002,7,88.2,hn,breakthrough,Anthropic Is Having a Month,jnord,https://techcrunch.com/2026/03/31/anthropic-is-having-a-month/,
218,0.0002,8,98.3,hn,comparison,Anthropic wins preliminary injunction in Trump DoD fight,gmays,https://www.cnbc.com/2026/03/26/anthropic-pentagon-dod-claude-court-ruling.html,
219,0.0002,32,202.4,hn,breakthrough,Anthropic is preparing to release new models – Mythos and Capybara,cardboard9926,https://m1astra-mythos.pages.dev/,
220,0.0002,32,215.9,hn,comparison,Judge's Remarks on Anthropic vs. Pentagon,AnimalMuppet,https://www.businessinsider.com/anthropic-pentagon-trump-hearing-judge-rita-lin-remarks-stakes-2026-3,
221,0.0002,30,237.2,hn,breakthrough,A lawyer won Anthropic's hackathon – what everyone missed,idrdex,https://hadleylab.org/blogs/2026-03-22-the-lawyer-who-won/,
222,0.0002,161,500.7,hn,breakthrough,Launching the Claude Partner Network,gmays,https://www.anthropic.com/news/claude-partner-network,
223,0.0001,3329,1421.0,reddit,personal,Official: Anthropic declared a plan for Claude to remain ad-free,BuildwithVignesh,https://www.reddit.com/r/ClaudeAI/comments/1qvo0ps/official_anthropic_declared_a_plan_for_claude_to/,
224,0.0001,378,438.1,reddit,personal,Are we cooked?,kalmankantaja,https://www.reddit.com/r/artificial/comments/1rw4k3l/are_we_cooked/,
225,0.0001,285,255.6,reddit,comparison,Open-source AI system on a $500 GPU outperforms Claude Sonnet on coding benchmarks,Additional_Wish_3619,https://www.reddit.com/r/artificial/comments/1s2yg3y/opensource_ai_system_on_a_500_gpu_outperforms/,
226,0.0001,115,168.1,reddit,comparison,Claude is the least bullshit-y AI,djiivu,https://www.reddit.com/r/artificial/comments/1s67buc/claude_is_the_least_bullshity_ai/,
227,0.0001,2322,822.9,reddit,meme,lmao,brown_reflections,https://www.reddit.com/r/ChatGPT/comments/1rhurko/lmao/,
228,0.0001,2177,851.7,reddit,meme,"Time to cancel ChatGPT Plus after three Years. Anthropic got nuked for having ethics, and Sam Altman",Rare-Site,https://www.reddit.com/r/ChatGPT/comments/1rgv7jx/time_to_cancel_chatgpt_plus_after_three_years/,
229,0.0001,1947,708.2,reddit,personal,Claude is amazing,comoma,https://www.reddit.com/r/ChatGPT/comments/1rm5sxx/claude_is_amazing/,
230,0.0001,1876,862.1,reddit,personal,We are done,whogivesafuckwhoiam,https://www.reddit.com/r/ChatGPT/comments/1rgh6r7/we_are_done/,
231,0.0001,1808,853.1,reddit,personal,Cancelled ChatGPT,James-robinsontj,https://www.reddit.com/r/ChatGPT/comments/1rgtnc4/cancelled_chatgpt/,
232,0.0001,1616,843.1,reddit,personal,"Talk yo shit, Claude.",purpleresonance67,https://www.reddit.com/r/ChatGPT/comments/1rh4qo1/talk_yo_shit_claude/,
233,0.0001,57,158.7,reddit,comparison,[R] I built a benchmark that catches LLMs breaking physics laws,pacman-s-install,https://www.reddit.com/r/MachineLearning/comments/1s6keh0/r_i_built_a_benchmark_that_catches_llms_breaking/,
234,0.0001,1177,930.0,reddit,meme,Qwen3.5-35B-A3B is a gamechanger for agentic coding.,jslominski,https://www.reddit.com/r/LocalLLaMA/comments/1rdxfdu/qwen3535ba3b_is_a_gamechanger_for_agentic_coding/,
235,0.0001,970,722.3,reddit,tutorial,"Ran Qwen 3.5 9B on M1 Pro (16GB) as an actual agent, not just a chat demo. Honest results.",Joozio,https://www.reddit.com/r/LocalLLaMA/comments/1rll349/ran_qwen_35_9b_on_m1_pro_16gb_as_an_actual_agent/,
236,0.0001,911,693.4,reddit,personal,Open WebUI’s New Open Terminal + “Native” Tool Calling + Qwen3.5 35b = Holy Sh!t!!!,Porespellar,https://www.reddit.com/r/LocalLLaMA/comments/1rmplvs/open_webuis_new_open_terminal_native_tool_calling/,
237,0.0001,1,36.3,hn,breakthrough,Claude Code Agent Architecture: What 67 Days of Production Taught Us,Adam_cipher,https://cipherbuilds.ai/blog/claude-code-agent-architecture-production,
238,0.0001,1,38.6,hn,meme,"Show HN: Ubik – Analyze local files like NotebookLM, with Cursor-like power",ieuanking,https://www.ubik.studio/features,
239,0.0001,1,48.5,hn,tutorial,"Tinygrad Nvidia P2P hack on Talos OS: 3 days with AI, would been 2 weeks without",himekifee,,
240,0.0001,1,49.1,hn,breakthrough,Show HN: Ecotokens – Another token saver for CLI Agents,ansicode,https://github.com/hansipie/ecotokens,
241,0.0001,1,50.1,hn,breakthrough,Claude Code Still Exhibiting Fast Usage Exhaustion,quux0r,https://old.reddit.com/r/ClaudeAI/comments/1s7fcjf/claude_usage_limits_discussion_megathread_ongoing/,
242,0.0001,2,66.2,hn,breakthrough,We ran 8 Bedrock models on the same RAG pipeline. The cheapest Claude model won,linsys,https://www.outcomeops.ai/blogs/youre-probably-using-the-wrong-bedrock-model,
243,0.0001,3,66.4,hn,breakthrough,Anthropic Races to Contain Leak of Code Behind Claude AI Agent,petethomas,https://www.wsj.com/tech/ai/anthropic-races-to-contain-leak-of-code-behind-claude-ai-agent-4bc5acc7,
244,0.0001,2,67.9,hn,breakthrough,Show HN: Continuously Improve Claude Code Plans,ramoz,https://plannotator.ai/blog/continuously-improve-claude-code-plans/,
245,0.0001,2,73.0,hn,tutorial,Show HN: Agent Action Guard – AI agent action safety,praneeth-v,,
246,0.0001,2,73.1,hn,tutorial,Show HN: Agent Instructions and Bootstrap Components,oldnewthing,,
247,0.0001,3,73.4,hn,personal,Show HN: AgentBoard – Track your hours and tokens spent coding with AI,Snorix,https://agentboard.cc,
248,0.0001,3,74.4,hn,tutorial,Show HN: Let your local agents trade on internal prediction markets,catpower,https://www.implicitmarkets.com/,
249,0.0001,2,75.4,hn,breakthrough,An AI Reads the Web: A Deep Dive into Claude Code's WebFetchTool,nblintao,https://medium.com/@nblintao/how-an-ai-reads-the-web-a-deep-dive-into-claude-codes-webfetchtool-0abee4446343,
250,0.0001,3,75.5,hn,breakthrough,/buddy in Claude Code is amazing,empressplay,https://old.reddit.com/r/ClaudeAI/comments/1s9egh1/buddy_in_claude_code_is_amazing_but_please_dont/,
251,0.0001,3,77.8,hn,tutorial,"Show HN: Sally CLI Because ""You're right"" is probably wrong",thomasgeelens,,
252,0.0001,3,78.8,hn,meme,Show HN: Muscula – Lightweight error monitoring with CLI and MCP,qzum,https://www.muscula.com/,
253,0.0001,3,78.9,hn,tutorial,Show HN: I built a full LLM chat client as a Neovim filetype,StanAngeloff,,
254,0.0001,4,81.9,hn,breakthrough,The Claude Code Source Leak,perpetua,https://www.latent.space/p/ainews-the-claude-code-source-leak,
255,0.0001,4,85.2,hn,breakthrough,I Saw Something New in San Francisco,platzhirsch,https://www.nytimes.com/2026/03/29/opinion/ai-claude-chatgpt-gemini-mcluhan.html,
256,0.0001,4,85.3,hn,tutorial,Show HN: Browserbeam – a browser API built for AI agents,nyku,https://browserbeam.com/,
257,0.0001,3,85.3,hn,personal,Show HN: Calx – track and compile corrections humans make with AI agents,spenceships,https://github.com/getcalx,
258,0.0001,3,88.8,hn,breakthrough,How Claude Code memory works,shenli3514,https://db0.ai/blog/how-claude-code-memory-works,
259,0.0001,2,91.2,hn,breakthrough,A man used AI to call 3k Irish bartenders to track Guinness prices,coloneltcb,https://fortune.com/2026/03/30/guinness-beer-prices-ireland-anthropic-claude-ai/,
260,0.0001,5,94.9,hn,breakthrough,Major Claude Code source leak offers deep insight into how Anthropic tool works,johnbarron,https://arstechnica.com/ai/2026/03/entire-claude-code-cli-source-code-leaks-thanks-to-exposed-map-file/,
261,0.0001,4,95.0,hn,comparison,Show HN: Wozcode – double Claude Code output,bcollins34,https://www.wozcode.com/,
262,0.0001,2,95.7,hn,tutorial,Show HN: Domscribe – Deterministic DOM-to-source mapping for AI coding agents,NarratorTD,https://github.com/patchorbit/domscribe,
263,0.0001,2,96.2,hn,breakthrough,"Show HN: OpenClaw Arena – Benchmark models on real tasks, rank by perf and cost",skysniper,https://app.uniclaw.ai/arena?via=hn,
264,0.0001,2,96.4,hn,meme,Show HN: Shards of Stone – A Warcraft 2-inspired RTS that runs in the browser,AJSturrock,https://www.shardsofstone.com,
265,0.0001,3,96.4,hn,comparison,"Show HN: Dewey – Ingest docs, search semantically, get cited AI answers",lambdabaa,https://meetdewey.com,
266,0.0001,2,97.0,hn,breakthrough,Claude Code Internals: An AI-Assisted Analysis of the Leaked Source,victorbuilds,https://victorantos.com/posts/i-pointed-claude-at-its-own-leaked-source-heres-what-it-found/,
267,0.0001,4,97.9,hn,breakthrough,Claude Code has two cache bugs that can silently 10-20x your API costs,aleph_minus_one,https://old.reddit.com/r/ClaudeAI/comments/1s7mkn3/psa_claude_code_has_two_cache_bugs_that_can/,
268,0.0001,4,99.1,hn,tutorial,Show HN: Vibe Check – UX Benchmark for vibe designs,aEJ04Izw5HYm,https://vibecheck.appvelocity.io,
269,0.0001,3,104.4,hn,breakthrough,"Damn Claude, that's a lot of commits",twapi,https://aifoc.us/damn-claude-thats-a-lot-of-commits/,
270,0.0001,4,107.1,hn,breakthrough,"Show HN: TaskTrace, a local-first activity log that gives LLMs context",warrenronsiek,https://tasktrace.com,
271,0.0001,4,107.5,hn,breakthrough,Claude Code v2.1.88 Sourcemap,PashKatel,https://unpkg.com/@anthropic-ai/claude-code@2.1.88/cli.js.map,
272,0.0001,3,118.6,hn,personal,"I replaced Firecrawl with 2,700 lines of Elixir",pipboyguy,,
273,0.0001,7,130.4,hn,tutorial,Show HN: Veil – A Minimal Neovim GUI for macOS with Metal Rendering,rainux,https://github.com/rainux/Veil,
274,0.0001,4,138.9,hn,breakthrough,Ask HN: Release Path for 'Transformers Alternatives'?,adinhitlore,,
275,0.0001,4,144.4,hn,breakthrough,Behind the Curtain: AI's looming cyber nightmare,dkobia,https://www.axios.com/2026/03/29/claude-mythos-anthropic-cyberattack-ai-agents,
276,0.0001,8,152.1,hn,tutorial,"Show HN: WhatToBuy – Describe your situation, get AI-curated shopping carts",crackeddude,,
277,0.0001,7,180.5,hn,breakthrough,"Show HN: VizTools – 16 free tools for PMs and freelancers, deliberately no AI",mizarau,https://viztools.app/,
278,0.0001,9,188.7,hn,breakthrough,Fear of Missing Code,lukol,,
279,0.0001,11,189.3,hn,comparison,Show HN: Kagento – LeetCode for AI Agents,ifdotpy,https://kagento.io,
280,0.0001,13,257.1,hn,tutorial,Ask HN: How do you offload all coding to AI?,makingstuffs,,
281,0.0001,19,266.4,hn,tutorial,"Show HN: Record manual QA flows, get E2E test code that fits your repo",mihau,https://quretests.com,
282,0.0001,32,286.7,hn,tutorial,"Ask HN: Is anyone here also developing ""perpetual AI psychosis"" like Karpathy?",jawerty,,
283,0.0001,46,338.6,hn,breakthrough,Claude Code and the Great Productivity Panic of 2026,muzz,https://www.bloomberg.com/news/articles/2026-02-26/ai-coding-agents-like-claude-code-are-fueling-a-productivity-panic-in-tech,
284,0.0001,27,341.4,hn,tutorial,"Show HN: AI SDLC Scaffold, repo template for AI-assisted software development",pangon,https://github.com/pangon/ai-sdlc-scaffold/,
285,0.0001,36,361.0,hn,personal,Launch HN: Sitefire (YC W26) – Automating actions to improve AI visibility,vincko,,
286,0.0001,58,386.1,hn,tutorial,Launch HN: Canary (YC W26) – AI QA that understands your code,Visweshyc,,
287,0.0001,1,37.4,hn,breakthrough,"WTFM – I found Anthropic's pub fix for AI policy comp, then built it myself",ParanoidRV,https://mpdc.dev/wtfm/,
288,0.0001,1,52.8,hn,meme,The Founder's Paradox in AI Generation,yusukev,,
289,0.0001,2,77.3,hn,breakthrough,Australian government and Anthropic sign MOU for AI safety and research,OccamsMirror,https://www.anthropic.com/news/australia-MOU,
290,0.0001,4,83.6,hn,breakthrough,GitHub DMCA Notices to Anthropic Claude Code Repos,alexpadula,https://github.com/github/dmca/blob/master/2026/03/2026-03-31-anthropic.md,
291,0.0001,2,84.4,hn,meme,Ask HN: Is weird it that Anthropic raised my API limit from $500/mo to $200k?,noduerme,,
292,0.0001,2,88.9,hn,breakthrough,"Anthropic goes nude, exposes Claude Code source by accident",Bender,https://www.theregister.com/2026/03/31/anthropic_claude_code_source_code/,
293,0.0001,2,92.3,hn,breakthrough,Feat: Open-Source Claude Code,brenoRibeiro706,https://github.com/anthropics/claude-code/pull/41447,
294,0.0001,4,93.2,hn,breakthrough,I published the architecture Anthropic is now shippingstamped proof,nicbogaert,https://nicholasjbogaert.substack.com/p/i-published-the-architecture-anthropic,
295,0.0001,5,109.7,hn,breakthrough,"Anthropic, The Pentagon, and the Future of Autonomous Weapons",KnuthIsGod,https://www.bloomberg.com/news/articles/2026-03-28/anthropic-s-fight-with-us-military-over-future-of-autonomous-weapons,
296,0.0001,4,111.9,hn,breakthrough,Anthropic's Claude popularity with paying consumers is skyrocketing,gmays,https://techcrunch.com/2026/03/28/anthropics-claude-popularity-with-paying-consumers-is-skyrocketing/,
297,0.0001,4,115.8,hn,comparison,AI Leaders versus Elon Musk,doener,https://www.axios.com/2026/03/30/elon-musk-openai-altman-anthropic,
298,0.0001,7,120.9,hn,personal,The Pentagon's culture war tactic against Anthropic has backfired,joozio,https://www.technologyreview.com/2026/03/30/1134881/the-pentagons-culture-war-tactic-against-anthropic-has-backfired/,
299,0.0001,3,121.4,hn,breakthrough,My AI coding agent wrote an open letter to Anthropic about its own failure modes,evo-dragon,https://github.com/evo-hydra/evointel-whitepaper/blob/main/open-letter-to-anthropic.md,
300,0.0001,4,122.5,hn,breakthrough,Anthropic Academy,cauliflower99,https://www.anthropic.com/learn,
301,0.0001,5,122.6,hn,breakthrough,Lines of Code Are Useful,surprisetalk,https://entropicthoughts.com/lines-of-code,
302,0.0001,4,127.4,hn,breakthrough,"Bug] ""Claude Code executed command on physical IoT device (Tasmota)",geoffbp,https://github.com/anthropics/claude-code/issues/40537,
303,0.0001,9,128.1,hn,breakthrough,"Anthropic still in trouble despite court win, lawyers and lobbyists say",1vuio0pswjnm7,https://www.politico.com/news/2026/03/27/premature-anthropic-still-in-trouble-despite-court-win-lawyers-and-lobbyists-say-00849173,
304,0.0001,6,140.8,hn,breakthrough,Tell HN: Bug in Claude Code CLI is instantly draining usage plan quotas,nikhilgk,https://github.com/anthropics/claude-code/issues/38335,
305,0.0001,13,162.1,hn,breakthrough,Ask HN: What's the latest concensus on OpenAI vs. Anthropic $20/month tier?,whatarethembits,,
306,0.0001,9,170.3,hn,breakthrough,Leaked Anthropic Model Presents 'Unprecedented Cybersecurity Risks',HiroProtagonist,https://gizmodo.com/leaked-anthropic-model-presents-unprecedented-cybersecurity-risks-much-to-pentagons-pleasure-2000739088,
307,0.0001,7,185.2,hn,breakthrough,Cybersecurity stocks fall on report Anthropic is testing a powerful new model,pseudolus,https://www.cnbc.com/2026/03/27/anthropic-cybersecurity-stocks-ai-mythos.html,
308,0.0001,10,192.4,hn,breakthrough,Anthropic throttles Claude subscriptions to meet capacity,ceejayoz,https://www.infoworld.com/article/4151196/anthropic-throttles-claude-subscriptions-to-meet-capacity.html,
309,0.0001,7,195.7,hn,comparison,Show HN: LLM-Gateway – Zero-Trust LLM Gateway,michaelquigley,https://github.com/openziti/llm-gateway,
310,0.0001,13,210.1,hn,comparison,Anthropic wins preliminary injunction in DoD fight on 1A,m-hodges,https://www.cnbc.com/2026/03/26/anthropic-pentagon-dod-claude-court-ruling.html,
311,0.0001,19,211.3,hn,breakthrough,Anthropic discourages Claud demand during peak productivity hours,dude250711,https://www.theregister.com/2026/03/26/anthropic_tweaks_usage_limits/,
312,0.0001,17,211.6,hn,breakthrough,"Anthropic: ""During peak hours you'll move through session limits faster""",CharlesW,https://old.reddit.com/r/ClaudeCode/comments/1s4idyz/update_on_session_limits/,
