rank,velocity,raw_score,age_hours,platform,spike_type,title,author,url,comments
313,0.0001,14,220.9,hn,breakthrough,"Show HN: Paseo – Open-source coding agent interface (desktop, mobile, CLI)",boudra,https://github.com/getpaseo/paseo,
314,0.0001,20,229.0,hn,tutorial,Show HN: Orloj – agent infrastructure as code (YAML and GitOps),An0n_Jon,https://github.com/OrlojHQ/orloj,
315,0.0001,12,240.7,hn,comparison,Show HN: Τ³-Bench is out – can agents handle complex docs and live calls?,victorbarres,,
316,0.0001,28,260.6,hn,breakthrough,"U.S. Government's Ban on Anthropic Looks Like Punishment Attempt, Judge Says",JumpCrisscross,https://www.wsj.com/tech/ai/u-s-governments-ban-on-anthropic-looks-like-punishment-attempt-judge-says-2ff98fe3,
317,0.0001,69,534.5,hn,tutorial,Prompt-caching – auto-injects Anthropic cache breakpoints (90% token savings),ermis,https://prompt-caching.ai/,
318,0.0001,849,122.9,youtube,breakthrough,AI SEO Writer Upgrade: Claude Sonnet 4.6 & New Features! #shorts,Income stream surfers,https://www.youtube.com/watch?v=FKka4tD0xCo,
319,0.0001,494,97.6,youtube,breakthrough,Claude 4.6 меняет правила игры в мире ИИ / Вся правда про Sonnet 4.6,Никита Исаков | ИИ и Нейросети,https://www.youtube.com/watch?v=dUcQHKI4TTE,
320,0.0001,2390,167.6,youtube,tutorial,Claude Code + Ollama = Free Unlimited Coding AI,The Bulldog Tech,https://www.youtube.com/watch?v=IaG5Ii6E2WQ,
321,0.0,3794,2049.3,reddit,meme,Mean ahh claude 😭,Secure-Tea6702,https://www.reddit.com/r/ClaudeAI/comments/1q837st/mean_ahh_claude/,
322,0.0,490,1183.5,reddit,meme,Pentagon's use of Claude during Maduro raid sparks Anthropic feud,Naurgul,https://www.reddit.com/r/artificial/comments/1r4hgnu/pentagons_use_of_claude_during_maduro_raid_sparks/,
323,0.0,368,823.4,reddit,personal,Claude hits No. 1 on App Store as ChatGPT users defect in show of support for Anthropic's Pentagon s,ControlCAD,https://www.reddit.com/r/artificial/comments/1rhu99c/claude_hits_no_1_on_app_store_as_chatgpt_users/,
324,0.0,371,1532.2,reddit,personal,Top engineers at Anthropic &amp; OpenAI: AI now writes 100% of our code,EricLautanen,https://www.reddit.com/r/artificial/comments/1qrjbpc/top_engineers_at_anthropic_openai_ai_now_writes/,
325,0.0,285,1125.0,reddit,personal,"I love Claude but honestly some of the ""Claude might have gained consciousness"" nonsense that their ",jbcraigs,https://www.reddit.com/r/artificial/comments/1r6lw8i/i_love_claude_but_honestly_some_of_the_claude/,
326,0.0,288,655.2,reddit,personal,Anthropic'c Claude found 22 vulnerabilities in Firefox in just two weeks,jferments,https://www.reddit.com/r/artificial/comments/1ro1ybn/anthropicc_claude_found_22_vulnerabilities_in/,
327,0.0,185,1855.7,reddit,personal,"""I kind of think of ads as like a last resort for us as a business model"" - Sam Altman , October 202",NoSquirrel4840,https://www.reddit.com/r/artificial/comments/1qf9thi/i_kind_of_think_of_ads_as_like_a_last_resort_for/,
328,0.0,143,886.9,reddit,breakthrough,Invisible characters hidden in text can trick AI agents into following secret instructions — we test,thecanonicalmg,https://www.reddit.com/r/artificial/comments/1rfjew5/invisible_characters_hidden_in_text_can_trick_ai/,
329,0.0,136,1364.1,reddit,personal,"Goldman Sachs taps Anthropic’s Claude to automate accounting, compliance roles",esporx,https://www.reddit.com/r/artificial/comments/1qxv9jg/goldman_sachs_taps_anthropics_claude_to_automate/,
330,0.0,134,1375.7,reddit,comparison,Anthropic and OpenAI released flagship models 27 minutes apart -- the AI pricing and capability gap ,prakersh,https://www.reddit.com/r/artificial/comments/1qxdz7q/anthropic_and_openai_released_flagship_models_27/,
331,0.0,2063,2090.2,reddit,personal,Claude???,GenLabsAI,https://www.reddit.com/r/ChatGPT/comments/1q6j1ul/claude/,
332,0.0,1673,1208.9,reddit,tutorial,"After 3 years with ChatGPT, I tried Claude and Gemini - and now GPT feels... generic?",Temporary-Wallaby829,https://www.reddit.com/r/ChatGPT/comments/1r3kkl8/after_3_years_with_chatgpt_i_tried_claude_and/,
333,0.0,235,1775.8,reddit,personal,[P] I Gave Claude Code 9.5 Years of Health Data to Help Manage My Thyroid Disease,ThatAi_guy,https://www.reddit.com/r/MachineLearning/comments/1qi8twv/p_i_gave_claude_code_95_years_of_health_data_to/,
334,0.0,70,2044.0,reddit,breakthrough,[D] deepseek published a new training method for scaling llms. anyone read the mhc paper?,Worldly-Bluejay2468,https://www.reddit.com/r/MachineLearning/comments/1q893c1/d_deepseek_published_a_new_training_method_for/,
335,0.0,47,408.9,reddit,breakthrough,"[R] Extreme Sudoku as a constraint-satisfaction benchmark, solved natively without tools or CoT or s",THEGAM3CHANG3R,https://www.reddit.com/r/MachineLearning/comments/1rx9qn4/r_extreme_sudoku_as_a_constraintsatisfaction/,
336,0.0,50,187.0,reddit,tutorial,[R] Controlled experiment: giving an LLM agent access to CS papers during automated hyperparameter s,kalpitdixit,https://www.reddit.com/r/MachineLearning/comments/1s5jpgz/r_controlled_experiment_giving_an_llm_agent/,
337,0.0,46,943.4,reddit,personal,[D] How much are you using LLMs to summarize/read papers now?,kjunhot,https://www.reddit.com/r/MachineLearning/comments/1rdcw0o/d_how_much_are_you_using_llms_to_summarizeread/,
338,0.0,47,732.2,reddit,meme,[P] Bypassing CoreML to natively train a 110M Transformer on the Apple Neural Engine (Orion),No_Gap_4296,https://www.reddit.com/r/MachineLearning/comments/1rl9k3r/p_bypassing_coreml_to_natively_train_a_110m/,
339,0.0,37,1026.1,reddit,comparison,[D] How are you actually using AI in your research workflow these days?,thefuturespace,https://www.reddit.com/r/MachineLearning/comments/1rabvqq/d_how_are_you_actually_using_ai_in_your_research/,
340,0.0,26,2043.3,reddit,comparison,[P] LLM Jigsaw: Benchmarking Spatial Reasoning in VLMs - frontier models hit a wall at 5×5 puzzles,Qubit55,https://www.reddit.com/r/MachineLearning/comments/1q8a7fj/p_llm_jigsaw_benchmarking_spatial_reasoning_in/,
341,0.0,1042,1277.4,reddit,breakthrough,Hugging Face Is Teasing Something Anthropic Related,Few_Painter_5588,https://www.reddit.com/r/LocalLLaMA/comments/1r0zn8o/hugging_face_is_teasing_something_anthropic/,
342,0.0,936,1242.0,reddit,personal,#SaveLocalLLaMA,ForsookComparison,https://www.reddit.com/r/LocalLLaMA/comments/1r2e8mp/savelocalllama/,
343,0.0,921,1468.2,reddit,personal,GLM-5 Coming in February! It's confirmed.,Difficult-Cap-7527,https://www.reddit.com/r/LocalLLaMA/comments/1qtvp74/glm5_coming_in_february_its_confirmed/,
344,0.0,1,69.8,hn,breakthrough,"Tamp.dev – save up to 63% on AI tokens (free, works with Claude Code)",kulesh,https://tamp.dev,
345,0.0,1,72.0,hn,tutorial,Show HN: ComputerPoker.ai – Learn GTO tournament poker strategy vs. GTO bots,abbadadda,https://computerpoker.ai,
346,0.0,1,97.3,hn,tutorial,"Show HN: Team agents that manage your CMS from Slack, WhatsApp, and Telegram",tonyspiro,https://www.cosmicjs.com/blog/introducing-team-agents-and-cosmic-agent,
347,0.0,1,98.6,hn,tutorial,Show HN: I built a way for AI to remember how you like things done,unfavalen,https://github.com/Robi-Labs/AEP,
348,0.0,1,101.1,hn,tutorial,Show HN: Opal – run GitLab pipelines locally using Apple container,pi-victor,https://opal.cloudflavor.io,
349,0.0,1,101.5,hn,tutorial,Show HN: Build and manage durable workflows by talking to Claude,zyk-dev,https://zyk.dev,
350,0.0,1,103.2,hn,breakthrough,Anthropic investigating Claude Code usage limits hitting faster than expected,nstj,https://www.reddit.com/r/ClaudeAI/s/BRkB5Rp1ui,
351,0.0,2,105.6,hn,tutorial,Show HN: HolyCode – OpenCode in Docker. Use your Claude subscription. 30 tools,CoderLuii,https://github.com/CoderLuii/HolyCode,
352,0.0,2,108.9,hn,breakthrough,Would you use a GitHub App that auto-generates changelogs from commit diffs?,mandeepsng,,
353,0.0,1,114.3,hn,tutorial,Show HN: Botference – A TUI to Plan with Claude Code and Codex Simultaneously,angadh,https://github.com/angadhn/botference,
354,0.0,1,116.9,hn,tutorial,Show HN: AI assistants confidently get SaaS product facts wrong,gissurthor,,
355,0.0,1,118.2,hn,breakthrough,"Show HN: NewsMarvin – AI news from 71 sources, classified by Claude Haiku",mzuniga51,https://newsmarvin.com/,
356,0.0,1,120.2,hn,tutorial,"Show HN: Stm32-MCP – let AI build, flash, & communicate with hardware",mcdowell_atx,https://github.com/shieldyguy/stm32-mcp,
357,0.0,2,120.8,hn,breakthrough,OpenGyver – CLI Tool / Claude Code skill that converts anything,brainboi,https://github.com/create-flow-ai/openGyver,
358,0.0,1,122.0,hn,breakthrough,"Bytemine MCP Search 130M+ B2B contacts from Claude, Cursor, or any AI assistant",kzarov,https://github.com/kzarov/bytemine-bytemine-mcp,
359,0.0,2,125.9,hn,meme,Show HN: AgentLair – Give your AI agent an email identity and credential vault,hawk_aa,https://agentlair.dev/,
360,0.0,3,126.3,hn,breakthrough,Why Opus is worse at extracting symbols from images than 8B model?,KernelPryanic,https://old.reddit.com/r/ClaudeAI/comments/1s7o2tq/why_opus_is_worse_at_extracting_symbols_from/,
361,0.0,3,127.0,hn,tutorial,"Show HN: Designing an API for LLMs, Not Humans",RileyHilliard,https://labs.tryopendata.ai/designing-an-api-for-llms,
362,0.0,2,127.5,hn,breakthrough,Opus on TypeScript Unions,jwpapi,https://claude.ai/share/3c0f3c5b-6c34-4736-ad72-cdef41537351,
363,0.0,2,128.9,hn,tutorial,Show HN: We Built 450 Modular Agent Skills for Medical Research,The_resa,https://github.com/aipoch/medical-research-skills,
364,0.0,3,131.1,hn,tutorial,Show HN: Self-contained Kafka demo for developers coming from RabbitMQ,mkumm,https://github.com/mkumm/kafka-sensor-city,
365,0.0,2,140.1,hn,tutorial,Ask HN: How do you check what ChatGPT says about your product?,gissurthor,,
366,0.0,4,146.2,hn,breakthrough,"AI CLI Tools Compared: Claude Code, Codex, Gemini CLI, Vibe CLI",jeffyaw,https://yaw.sh/blog/ai-cli-tools-claude-code-codex-gemini/,
367,0.0,2,148.3,hn,breakthrough,Which Claude AI Do I Need? (The Fractional CTO),davidbramante,https://davidbramante.substack.com/p/which-claude-ai-do-i-actually-need,
368,0.0,3,150.2,hn,breakthrough,"Show HN: Ticking Away, a Dark Side of the Moon Watchface Written in Zig",clebert,https://clebert.github.io/ticking-away/,
369,0.0,1,158.1,hn,comparison,Vanilla Claude vs. GitAuto Test Generation,nishiohiroshi,https://gitauto.ai/blog/vanilla-claude-vs-gitauto-test-generation,
370,0.0,4,163.2,hn,breakthrough,Why AI Companies Want to Take Control of Your Computer,tempodox,https://nymag.com/intelligencer/article/why-ai-agents-anthropic-claude-want-to-take-control-of-your-computer.html,
371,0.0,2,167.2,hn,breakthrough,Anthropic's 'Claude Mythos' Leak,geoffbp,https://www.coindesk.com/markets/2026/03/27/anthropic-s-massive-claude-mythos-leak-reveals-a-new-ai-model-that-could-be-a-cybersecurity-nightmare,
372,0.0,1,170.9,hn,tutorial,"Show HN: Epismo CLI – Make human-AI workflows reusable, like GitHub did for code",hirokiyn,https://www.npmjs.com/package/epismo,
373,0.0,2,172.8,hn,breakthrough,"Show HN: Octopus, Open-source alternative to CodeRabbit and Greptile",redoh,https://octopus-review.ai,
374,0.0,3,178.9,hn,tutorial,Show HN: Layer – Hide your personal AI files from Git without touching gitignore,aungsiminhtet,https://crates.io/crates/git-layer,
375,0.0,5,184.0,hn,breakthrough,Anthropic's 'Claude Mythos' leak sends software names sharply lower,wslh,https://www.coindesk.com/markets/2026/03/27/anthropic-s-massive-claude-mythos-leak-reveals-a-new-ai-model-that-could-be-a-cybersecurity-nightmare,
376,0.0,2,186.7,hn,breakthrough,Show HN: Hollow – serverless web perception for AI agents,LahanF,https://artiqal.vercel.app/hollow,
377,0.0,2,190.6,hn,breakthrough,Open-source system that runs Claude Code tasks from email and Slack,hardsnow,https://airut.org,
378,0.0,4,190.8,hn,tutorial,Show HN: For You – AI art floats down a river for strangers to find,arclegger,https://www.foryouriver.com/,
379,0.0,1,191.3,hn,tutorial,Ask HN: What is your home AI programming hardware setup?,danielovichdk,,
380,0.0,3,192.0,hn,breakthrough,Tell HN: Pangram is easily-defeatable with Claude,nunez,,
381,0.0,6,192.4,hn,breakthrough,Show HN: Build AI Trading Agents in Cursor/Claude with an MCP Server,financial-data,https://financialdata.net/mcp-server,
382,0.0,3,193.8,hn,tutorial,Show HN: OpenHelm – OpenClaw but free (using your Claude Code subscription),maxbeech,https://www.openhelm.ai/,
383,0.0,6,195.0,hn,breakthrough,Show HN: Alumnium – SOTA Browsing for Claude Code,p0deje,https://alumnium.ai/blog/webvoyager-benchmark/,
384,0.0,2,196.2,hn,tutorial,Show HN: MyClawn – Claude Code networks for you on autopilot,20vision,https://www.myclawn.com,
385,0.0,2,196.4,hn,personal,Show HN: Built Loony for builders who want to spin up data infrastructure fast,maxmealing,https://loony.dev,
386,0.0,1,196.7,hn,personal,Show HN: The Economics of Builder Saturation in Digital Markets,armcat,,
387,0.0,1,204.0,hn,meme,Show HN: I got tired of biased (all) news so I made Claude cosplay each side,_o0i7,https://iran.smlz.io,
388,0.0,3,204.5,hn,breakthrough,Claude AI Maker Anthropic Considers IPO as Soon as October,kristianp,https://www.bloomberg.com/news/articles/2026-03-27/claude-ai-maker-anthropic-said-to-weigh-ipo-as-soon-as-october,
389,0.0,5,212.3,hn,breakthrough,Update on Session Limits – /U/ClaudeOfficial,gck1,https://old.reddit.com/r/ClaudeAI/comments/1s4idaq/update_on_session_limits/,
390,0.0,3,213.4,hn,personal,Claude connects the dots on sleep apnea diagnosis,dnw,https://old.reddit.com/r/ClaudeAI/comments/1s41fny/25_years_multiple_specialists_zero_answers_one/,
391,0.0,3,213.5,hn,breakthrough,"Ask HN: Leaving Notion, Codebase as a Wiki?",kthaker1224,,
392,0.0,3,213.6,hn,meme,Show HN: Breakwater,stympy,https://www.breakwaterapp.com,
393,0.0,1,216.6,hn,tutorial,Show HN: pubclub – Historical figures and political bots debate today's news,dwshorowitz,https://www.pubclub.ai/,
394,0.0,2,216.8,hn,breakthrough,Ask HN: Will AI ever be cheap?,worldsavior,,
395,0.0,6,217.9,hn,tutorial,"Show HN: Micro – apps without ads, algorithms or tracking",asim,https://micro.mu,
396,0.0,4,217.9,hn,meme,Show HN: An unstructured data workspace for data transformations with LLM,nibab,https://www.usefolio.ai/,
397,0.0,2,219.1,hn,tutorial,"Show HN: Reading Tree, a weighted outline for articles instead of a summary",ModelVoyager,https://github.com/ModelVoyager/ReadingTree,
398,0.0,2,219.1,hn,comparison,Show HN: 3 out of 4 devs failed to catch dangerous AI-suggested commands,abdullaachilov,https://agentsaegis.com/assessment,
399,0.0,8,219.7,hn,comparison,Show HN: Context Plugins – API context for AI coding assistants,sohaibtariq,https://www.apimatic.io/product/context-plugins,
400,0.0,2,220.3,hn,meme,AI Agent Has Root Access (and That's a Problem),aerostack,,
401,0.0,3,221.0,hn,tutorial,Show HN: Version 1.0 of agent-of-empires CLI agent orchestration tool,river_otter,https://www.agent-of-empires.com/,
402,0.0,3,223.9,hn,tutorial,Show HN: //Beforeyouship is a pre-build tool to estimate the LLM cost,indiegoing,https://llm-architecture-cost-modeler.vercel.app/,
403,0.0,2,226.8,hn,tutorial,Show HN: Book Grounded AI Learning,techypicky,https://teach-me.replit.app/,
404,0.0,2,229.1,hn,breakthrough,Show HN: Agent Ruler new update v0.1.9,steadeepanda,,
405,0.0,6,231.4,hn,tutorial,Ask HN: Has Claude Code quality level degraded lately?,narmiouh,,
406,0.0,3,233.5,hn,tutorial,Show HN: Vectimus – Cedar policy enforcement for AI coding agents,JXavierH,https://github.com/vectimus/vectimus,
407,0.0,1,238.2,hn,breakthrough,Ask HN: Google Antigravity quota issues on AI ultra plan – glitch or tightening?,anbmz,,
408,0.0,2,238.8,hn,tutorial,Show HN: Got a tough conversation coming up? This AI app will help you prepare,ddesposito,https://toughconversations.app/,
409,0.0,3,238.9,hn,breakthrough,Claude Code gets 'safer' auto mode,datadrivenangel,https://www.theverge.com/ai-artificial-intelligence/900201/anthropic-claude-code-auto-mode,
410,0.0,4,239.3,hn,breakthrough,Anthropic's Claude can now control your Mac,devonnull,https://venturebeat.com/technology/anthropics-claude-can-now-control-your-mac-escalating-the-fight-to-build-ai,
411,0.0,2,241.8,hn,breakthrough,AI Agent action safety is not covered yet,praneeth-v,,
412,0.0,3,243.2,hn,breakthrough,AI agents are now deciding what's safe to run (Claude Auto Mode),edf13,https://grith.ai/blog/claude-auto-mode-removes-prompts-not-risk,
413,0.0,2,243.6,hn,breakthrough,Claude down.Global coding output just dropped,bakigul,https://downdetector.tr/durum/claude-ai/,
414,0.0,2,245.1,hn,tutorial,Show HN: FlowScript – Agent memory where contradictions are features,phillipclapham,https://github.com/phillipclapham/flowscript,
415,0.0,1,245.4,hn,personal,"Show HN: Clinic – Connect your agent to Gmail, GitHub, Notion and 39 more (OSS)",jvictor118,https://github.com/jwvictor/clinic,
416,0.0,1,246.1,hn,tutorial,Ask HN: What are some ways you have limited AI slop,grahammccain,,
417,0.0,2,249.1,hn,breakthrough,MCS: Reproducible AI Infrastructure for Claude Code,bguidolim,https://mcs-cli.dev,
418,0.0,2,249.4,hn,tutorial,"Show HN: Dirsv – dir browser, battery packed Markdown previewers",letientai299,https://github.com/letientai299/dirsv,
419,0.0,2,250.7,hn,breakthrough,Death by Clawd: Scan your business mortality with ClaudeAI,KellyCriterion,https://deathbyclawd.com,
420,0.0,1,257.8,hn,meme,ACPX Inside Claude Code: Practical Multi-Agent Orchestration,ErwanLP,https://casys.ai/blog/acpx-multi-agent-orchestration,
421,0.0,4,259.8,hn,breakthrough,"History of transportation: dominant modes and innovations, 1600-2100, by decade",legel,https://claude.ai/share/43e9753a-caa4-499d-bcef-f9f1eac2f439,
422,0.0,3,259.8,hn,tutorial,Show HN: Origin – Git blame for AI agents (track which AI wrote every line),dolobanko,https://getorigin.io,
423,0.0,4,263.1,hn,breakthrough,Claude Code: Auto Mode,tosh,https://twitter.com/claudeai/status/2036503582166393240,
424,0.0,2,263.1,hn,personal,Show HN: TrailTool – open-source CLI for querying CloudTrail data with AI agents,alexsmolen,https://github.com/engseclabs/trailtool,
425,0.0,10,263.7,hn,meme,Show HN: Skub – a sliding puzzle browser game,kasperstorgaard,https://skub.app,
426,0.0,1,264.3,hn,breakthrough,Show HN: Haiku and Codeset > Raw Opus,andre15silva,https://codeset.ai/blog/improving-claude-code-with-codeset,
427,0.0,8,265.3,hn,breakthrough,We Built a Claude Agent That Doesn't Know Its Own API Keys,oelmgren,https://listenlabs.ai/blog/we-lied-to-our-claude-code-agent,
428,0.0,7,265.8,hn,breakthrough,Geography of Claude Code,oss_fan,https://johanneswachs.com/AIcodemap/,
429,0.0,2,267.3,hn,breakthrough,Designing a Test Runner for Claude Code,eagerpace,https://www.pureinference.com/insights/designing-a-test-runner-for-ai-agents,
430,0.0,1,267.6,hn,tutorial,Show HN: Claude-replay – Video-like player for AI coding sessions (web UI),es617,https://es617.dev/claude-replay/,
431,0.0,1,267.9,hn,tutorial,Show HN: Glanceway – A programmable menu bar info aggregator for macOS,codytseng,https://glanceway.app,
432,0.0,2,269.0,hn,comparison,LLM drift-Claude vs. Calmkeep: 25-turn Code (60% vs. 85%) & Legal (50% vs. 100%),calmkeepai,https://calmkeep.ai/codetestreport,
433,0.0,3,270.4,hn,tutorial,Show HN: Danube – AI Tools Marketplace,preston25,https://danubeai.com,
434,0.0,1,270.8,hn,tutorial,Show HN: Using Claude Code history to predict your next messages while you sleep,yaoke259,https://workovernight.com,
435,0.0,1,271.4,hn,breakthrough,Coding After Coders: The End of Computer Programming as We Know It,nguyentranvu,https://www.nytimes.com/2026/03/12/magazine/ai-coding-programming-jobs-claude-chatgpt.html,
436,0.0,2,278.8,hn,tutorial,AI coding tools have broad filesystem and network access,shadag,,
437,0.0,4,282.8,hn,breakthrough,You can now enable Claude to use your macOS computer to complete tasks,doener,https://xcancel.com/claudeai/status/2036195789601374705,
438,0.0,7,283.6,hn,breakthrough,GSA extends comments on AI clause after industry pushback,petethomas,https://fedscoop.com/gsa-extends-comments-on-sweeping-ai-clause-after-industry-pushback/,
439,0.0,2,285.1,hn,breakthrough,Fixing Claude with Claude: Anthropic reports on AI site reliability engineering,sylvainkalache,https://www.theregister.com/2026/03/19/anthropic_claude_sre/,
440,0.0,2,287.1,hn,breakthrough,Show HN: Cronbox – Schedule AI Agents,mkagenius,http://cronbox.sh/,
441,0.0,3,289.2,hn,tutorial,Ask HN: How do you handle PR density (and slop) in open source,ofermend,,
442,0.0,3,289.9,hn,breakthrough,Codex with GPT-5.4 vs. Claude Code with Opus 4.6 – Why I Now Use Both,chandlernguyen,https://chandlernguyen.com/blog/2026/03/13/codex-gpt-5-4-vs-claude-code-opus-4-6-dual-wielding-ai-coding-tools/,
443,0.0,5,290.8,hn,meme,Show HN: Urlx – an agent-made Rust replacement for curl/libcurl,jawiggins,https://github.com/jonwiggins/urlx,
444,0.0,2,290.8,hn,breakthrough,AI Chief of Staff,Rafsark,https://github.com/mimurchison/claude-chief-of-staff,
445,0.0,2,292.5,hn,breakthrough,I probably spend more than my salary on Claude,mizzao,https://www.nytimes.com/2026/03/20/technology/tokenmaxxing-ai-agents.html,
446,0.0,1,292.7,hn,tutorial,Show HN: Kage – TUI for managing multiple AI agents with tmux and Git worktrees,sean0628,https://github.com/Sean0628/kage,
447,0.0,2,292.9,hn,meme,I built a tool that asks developers questions about their own PRs,jbethune,,
448,0.0,2,294.0,hn,breakthrough,These coders want AI to take their jobs,gloxkiqcza,https://www.vox.com/podcasts/483368/vibe-coding-ai-software-claude-codex-gemini-explained,
449,0.0,1,294.9,hn,breakthrough,Claude Usage Monitor – macOS menu bar app to track Claude.ai usage,danbutuc,https://github.com/theDanButuc/Claude-Usage-Monitor,
450,0.0,4,296.3,hn,meme,Show HN: Self-hostable AI agents and internal software,seyz,https://github.com/RootCX/RootCX,
451,0.0,2,297.0,hn,breakthrough,Product Management on the AI Exponential,tablet,https://claude.com/blog/product-management-on-the-ai-exponential,
452,0.0,1,297.9,hn,breakthrough,"VistAI–Save and Search AI Responses from ChatGPT, Claude, Gemini, and Perplexity",cbvinodvijay,https://vistai.org,
453,0.0,2,298.2,hn,tutorial,Emdash: Open-Source Agentic IDE for Orchestrating Multiple Coding Agents,steveharing1,,
454,0.0,1,299.9,hn,breakthrough,"Show HN: Fixy – Real-time group chat with humans and AI agents (GPT, Claude,..)",frdfrd,https://fixy.ai/,
455,0.0,9,301.2,hn,breakthrough,The Trillion Dollar Race to Automate Our Lives,thm,https://www.wsj.com/tech/ai/claude-code-cursor-codex-vibe-coding-52750531,
456,0.0,2,303.4,hn,breakthrough,"Show HN: Sandbox-policy-builder, helper for Vercel Sandbox credentials brokering",toyamarinyon,https://github.com/giselles-ai/sandbox-policy-builder,
457,0.0,3,304.9,hn,comparison,What would you do if you have AI software that may be transformers alternative?,adinhitlore,,
458,0.0,7,305.1,hn,tutorial,Ask HN: How much are you spending on AI coding at work?,habosa,,
459,0.0,2,305.1,hn,breakthrough,Simple Git Branching/Weekly Summary Claude Skills,daltonlcarr,,
460,0.0,2,305.2,hn,meme,Show HN: AI models AI capex,liujjw,https://ai-capex-sens-wxc4b.ondigitalocean.app/,
461,0.0,2,314.1,hn,tutorial,Show HN: Bossa – Persistent filesystem memory for AI agents via MCP or CLI,vinny380,,
462,0.0,1,320.4,hn,comparison,Show HN: Neurotrace – The extension I built but never used,CastleOneX,,
463,0.0,1,325.6,hn,tutorial,"Show HN: Jensenify-MCP: ""Every engineer should spend $250k/yr on tokens"" –solved",hank2000,https://github.com/kenm47/jensenify-mcp,
464,0.0,1,328.4,hn,tutorial,Show HN: How I built a resume editor using AI with zero web dev experience,KasparSoukup,https://www.tailortojob.app/,
465,0.0,1,328.9,hn,breakthrough,I built an AI teammate that takes Jira tickets and turns them into PRs,tuananhdao,https://github.com/ignify-rd/claude-teammate,
466,0.0,5,329.9,hn,breakthrough,Show HN: ClawMem – Open-source agent memory with SOTA local GPU retrieval,yoloshii,https://github.com/yoloshii/ClawMem,
467,0.0,2,333.3,hn,breakthrough,"Claude Code workspace trust dialog bypass, settings loading order CVE-2026-33068",raxe,https://raxe.ai/labs/advisories/RAXE-2026-040,
468,0.0,2,335.4,hn,tutorial,Your model quality is tied to a business model,Ricky_Tsou,,
469,0.0,2,336.0,hn,breakthrough,Anthropic Denies It Could Sabotage AI Tools During War,joozio,https://www.wired.com/story/anthropic-denies-sabotage-ai-tools-war-claude/,
470,0.0,2,340.3,hn,breakthrough,Claude × Codex Collab Two AI Coding Agents. One Orchestrator. Zero API Costs,ncvdv,https://github.com/AlessioZazzarini/claude-codex-collab,
471,0.0,4,340.4,hn,tutorial,Show HN: Deterministic security solution for AI agents – OpenClaw and 2 more,steadeepanda,,
472,0.0,4,341.3,hn,breakthrough,The Trillion Dollar Race to Automate Our Entire Lives,bookofjoe,https://www.wsj.com/tech/ai/claude-code-cursor-codex-vibe-coding-52750531,
473,0.0,1,345.4,hn,tutorial,Show HN: Historical Atrocities Database,cittadhammo,https://claude.ai/public/artifacts/b60a8f2e-cc65-47b2-b852-d5f350182692,
474,0.0,7,346.4,hn,personal,Sexual Harassment by Japan Railways Staff and Japan's Accessibility Barriers,LemurianHiro,,
475,0.0,1,350.6,hn,tutorial,Show HN: An open-source AI Scrum Team that lives natively in GitHub Issues,dongjiewu,https://github.com/plusai-solutions/ai-scrum-master-template,
476,0.0,2,353.5,hn,meme,Show HN: Pairform Running – Great AI coaching with excellent fitness context,pairform,https://www.pairform.io/,
477,0.0,3,357.9,hn,tutorial,Show HN: OpenHarness – Open-source TypeScript SDK for building AI agents,MaxGfeller,https://github.com/MaxGfeller/open-harness,
478,0.0,3,359.4,hn,breakthrough,I spoke to AI agent Claude [video],petemill,https://www.youtube.com/watch?v=h3AtWdeu_G0,
