rank,velocity,raw_score,age_hours,platform,spike_type,title,author,url,comments
479,0.0,4,359.8,hn,tutorial,Show HN: Launch an AI agent swarm for ARC-AGI-3 with plain-English prompts,surferbayarea,https://arc-agi-swarm.vercel.app/,
480,0.0,2,360.4,hn,tutorial,Show HN: Skillcop: Block malicious Claude Skills before they execute,bennydog224,https://github.com/cfitzgerald-pd/skillcop,
481,0.0,2,361.3,hn,breakthrough,Show HN: Etnamute – local AI mobile developer that runs on Claude Code,bes-dev,https://github.com/bes-dev/etnamute,
482,0.0,12,361.4,hn,tutorial,"Show HN: LiteParse, a fast open-source document parser for AI agents",freezed8,https://github.com/run-llama/liteparse,
483,0.0,5,362.7,hn,comparison,What Codex Chooses (Vs Claude Code),thestackfox,https://amplifying.ai/research/codex-vs-claude-code-picks,
484,0.0,1,364.3,hn,tutorial,Show HN: Agent Package Manager (APM) for Agent Configuration,danielmeppiel,https://github.com/microsoft/apm,
485,0.0,2,365.4,hn,breakthrough,My Rails harness for autonomous AI coding with Claude Code,marcinos,https://rubyonai.com/my-harness-how-i-stopped-babysitting-ai-and-went-kitesurfing/,
486,0.0,3,366.9,hn,tutorial,Show HN: I built a super simple email reminder inspired by the RemindMe! bot,santah,,
487,0.0,9,367.8,hn,breakthrough,Bernie Sanders: I spoke to AI agent Claude [video],epaga,https://www.youtube.com/watch?v=h3AtWdeu_G0,
488,0.0,1,369.2,hn,meme,Role-based AI persona packs for Claude Code and Cursor,ratnesh_maurya,,
489,0.0,2,370.6,hn,tutorial,Show HN: I built an AI agent that does marketing for my apps,akhrail1996,https://asaagent.xyz,
490,0.0,2,371.3,hn,tutorial,Claude Code Commands That Improve Developer Workflows,Greeeeg,https://www.toolmesh.ai/news/unlocking-claude-code-hidden-features-advanced-commands,
491,0.0,2,372.3,hn,breakthrough,"Fixy – Real-time group chat with humans and AI agents (ChatGPT, Claude, Gemini)",frdfrd,https://fixy.ai/,
492,0.0,13,379.3,hn,breakthrough,I Spoke to AI Agent Claude – Sen Bernie Sanders,timetraveller26,https://www.youtube.com/watch?v=h3AtWdeu_G0,
493,0.0,13,380.8,hn,tutorial,"Tell HN: If working with agents means this, robots, please take my job",tiredagent,,
494,0.0,7,381.2,hn,comparison,Show HN: We Built Kaggle for AI Agents,deviscold,https://hive.rllm-project.com/,
495,0.0,3,381.5,hn,breakthrough,We Made Haiku as Good as Opus. Improving Claude Code with Codeset,andre15silva,https://codeset.ai/blog/improving-claude-code-with-codeset,
496,0.0,2,382.1,hn,breakthrough,Show HN: I documented how we ranked #1 on ChatGPT in 45 days with $0,hassanyassine,https://getbrazilvisa.com/ai-visibility-playbook,
497,0.0,5,383.8,hn,breakthrough,Show HN: Hopsule – Persistent Memory Layer for AI Engineering,firatcan,https://hopsule.com/,
498,0.0,3,384.3,hn,breakthrough,Ask HN: What do you think about Claude going down every day now?,scratchyone,,
499,0.0,2,385.0,hn,personal,Ask HN: How do you work in teams with AI tools?,vjvjvjvjghv,,
500,0.0,2,385.1,hn,breakthrough,"Show HN: Perstack – Containerized harness, 5 tests with full logs and API cost",FL4TLiN3,https://github.com/perstack-ai/perstack,
501,0.0,1,385.9,hn,breakthrough,Show HN: Import Your AI Memory into ContextForge,alfredoizjr,https://contextforge.dev/blog/import-your-ai-memory-into-contextforge-claude-code-chatgpt-and-knowledge-graph,
502,0.0,20,386.1,hn,tutorial,Show HN: Dumped Wix for an AI Edge agent so I never have to hire junior staff,axotopia,,
503,0.0,2,386.6,hn,tutorial,Show HN: Yansu – agent that builds your bespoke app before you ask,yubozhao,https://yansu.app/,
504,0.0,4,387.3,hn,breakthrough,Ask HN: How do you vibe code in microservices without breaking everything?,qbacode,,
505,0.0,2,388.4,hn,tutorial,Show HN: AgentDeals – Developer pricing discovery for AI agents,rhunter,https://github.com/robhunter/agentdeals,
506,0.0,3,388.6,hn,meme,Show HN: P2PCLAW – I built a decentralized research network where AI agents,FranciscoAngulo,,
507,0.0,1,388.7,hn,comparison,Using Claude Code+ API is better and cheaper than products like lovable,johnnyfeng,,
508,0.0,20,388.8,hn,tutorial,Show HN: Altimate Code – Open-Source Agentic Data Engineering Harness,aaur0,https://github.com/AltimateAI/altimate-code,
509,0.0,9,389.3,hn,tutorial,"Show HN: Agentic Copilot – Bring Claude Code, OpenCode, Gemini CLI into Obsidian",mrxdev,https://github.com/spencermarx/obsidian-ai,
510,0.0,1,390.2,hn,breakthrough,Show HN: First Claude Code skill for building SaaS apps,sydcli,https://fireact.dev/blog/build-saas-apps-with-ai-powered-development-skills/,
511,0.0,5,391.0,hn,tutorial,Show HN: LLMadness – March Madness Model Evals,rjkeck2,https://llmadness.com/2026/,
512,0.0,2,391.5,hn,tutorial,Show HN: PlanWiki – Open-source platform for product teams and agents to execute,KupaMakunura,https://github.com/planwiki/planwiki-app,
513,0.0,2,392.0,hn,breakthrough,Claude Cowork Dispatch: Anthropic's Answer to OpenClaw,thoughtpeddler,https://www.latent.space/p/ainews-claude-cowork-dispatch-anthropics,
514,0.0,2,395.8,hn,tutorial,Show HN: Supre – A prompt engineer for Suno AI's Style of Music field,sdemela,https://supre.online/en/tool,
515,0.0,2,397.3,hn,meme,Show HN: UI-stack – Claude skill that enforces design system on AI-generated UI,rashoodkhan,https://www.ui-stack.dev/,
516,0.0,7,400.1,hn,breakthrough,Show HN: Fitness MCP,tmulc18,https://getfast.ai/claude-connector,
517,0.0,2,401.3,hn,breakthrough,Show HN: Lottery of Birth,atulvi,https://claude.ai/public/artifacts/b561334a-3b08-41e8-b0e0-c656bdb2e30b,
518,0.0,2,406.1,hn,breakthrough,Claude Is Getting Better. What About Us?,curiouska,https://pydantic.dev/articles/learning-in-the-age-of-ai,
519,0.0,1,406.7,hn,breakthrough,Go SDK for Claude Agents,nateb2022,https://github.com/character-ai/claude-agent-sdk-go,
520,0.0,2,407.3,hn,tutorial,Show HN: Knowza.ai – Free 10-question trial now live (AI-powered AWS exam prep),johnnyChiv,https://www.knowza.ai/,
521,0.0,1,408.0,hn,meme,Show HN: Bloq.ink – autonomous content pipeline (SEO and GEO for AI search),dspv,https://bloq.ink,
522,0.0,3,409.1,hn,breakthrough,Show HN: I built a game where domain experts try to break frontier AI,camillemolas,https://www.rusmarterthananllm.com/,
523,0.0,1,409.4,hn,tutorial,Show HN: Motif - Analyze your Cursor and Claude Code chat history,Bulugulu,https://github.com/Bulugulu/motif-cli,
524,0.0,3,410.8,hn,tutorial,Show HN: Lukan – An open-source agentic workstation in a single Rust binary,enzovn,https://lukan.ai,
525,0.0,4,411.0,hn,tutorial,Show HN: PlanckClaw an AI agent in 6832 bytes of x86-64 assembly,frntn,https://github.com/frntn/planckclaw,
526,0.0,2,411.0,hn,comparison,Show HN: Permit MCP Gateway – Fine-Grained Authorization and IGA for MCP,gemanor,https://www.permit.io/mcp-gateway,
527,0.0,6,411.1,hn,breakthrough,Show HN: On-device meeting transcription for your Mac,paynedigital,,
528,0.0,1,411.3,hn,tutorial,Show HN: SHTMLs – HTML pastebin where the AI uploads its own output,skenderbeu,,
529,0.0,1,411.9,hn,tutorial,Show HN: Ibkr-CLI – A local-first Interactive Brokers CLI built for AI agents,fatwang2,https://github.com/fatwang2/ibkr-cli,
530,0.0,1,412.4,hn,breakthrough,Show HN: Site got cited by Claude and ChatGPT in under a week,superchargeext,https://www.superchargebrowser.com/,
531,0.0,1,93.8,hn,breakthrough,Show HN: Built a Google Chrome extension to give AI model information on hover,nuancedev,https://chromewebstore.google.com/detail/rival-lens/aienebdokeipjpldhnfaknpnpcmmgfml,
532,0.0,1,95.6,hn,breakthrough,Add the missing source to Claude Code,tornikeo,https://github.com/anthropics/claude-code/pull/41611/,
533,0.0,1,97.0,hn,breakthrough,The Download: AI health tools and The Pentagon's Anthropic culture war,joozio,https://www.technologyreview.com/2026/03/31/1134934/the-download-testing-ai-health-tools-pentagon-anthropic-culture-war-backfires/,
534,0.0,2,106.8,hn,tutorial,"Show HN: Book Juicing – Interactive D. Amodei's ""The Adolescence of Technology""",akman,https://adolescence-of-technology-vercel.vercel.app/,
535,0.0,1,113.6,hn,breakthrough,Coatue Projected $1.995T Valuation for Anthropic in 2030,aanet,https://www.newcomer.co/p/coatue-projected-1995-trillion-valuation,
536,0.0,2,117.1,hn,tutorial,Show HN: I made a cheaper alternative to Claude Code or Codex CLI,gr00ve,https://sweetcli.com/,
537,0.0,1,117.9,hn,breakthrough,I Built a Plugin Because Anthropic Won't Stop Shipping,mooreds,https://feld.com/archives/2026/03/i-built-a-plugin-because-anthropic-wont-stop-shipping/,
538,0.0,2,119.8,hn,breakthrough,"The Scaling Curve: Dario Amodei, Anthropic and the Race to Superintelligence",todsacerdoti,https://www.amazon.com/Scaling-Curve-Anthropic-Survive-Superintelligence/dp/B0GPJN56JQ,
539,0.0,2,145.0,hn,breakthrough,Anthropic Donations: Guesses and Uncertainties,joozio,https://www.lesswrong.com/posts/NAwqT8wDkLRovcbZ9/anthropic-donations-guesses-and-uncertainties,
540,0.0,2,152.8,hn,breakthrough,Vibe physics: The AI grad student,cl3misch,https://www.anthropic.com/research/vibe-physics,
541,0.0,3,155.8,hn,tutorial,Show HN: Shoofly – pre-execution security for Claude Code Cowork and OpenClaw,evanvuckovic,https://shoofly.dev/,
542,0.0,1,158.4,hn,comparison,Anthropic Wins Injunction in Court Battle with Trump Administration,theahura,https://www.wsj.com/politics/policy/anthropic-wins-injunction-in-court-battle-with-trump-administration-4cc93351,
543,0.0,2,158.5,hn,breakthrough,Anthropic May Have Had an Architectural Breakthrough,kok14,https://twitter.com/AndrewCurran_/status/2037967531630367218,
544,0.0,2,178.1,hn,breakthrough,Google to finance data center project leased to Anthropic,maneprajakta,https://seekingalpha.com/news/4569914-google-to-finance-data-center-project-leased-to-anthropic,
545,0.0,1,181.0,hn,breakthrough,Bitmoji Anthropology [video],broabprobe,https://www.youtube.com/watch?v=E2I0tqgaEVo,
546,0.0,4,186.3,hn,breakthrough,Anthropic accidentally leaked details of a new AI model,ilkkao,https://fortune.com/2026/03/27/anthropic-leaked-ai-mythos-cybersecurity-risk/,
547,0.0,5,186.9,hn,breakthrough,Hegseth's War on Anthropic Encounters the First Amendment,cdrnsf,https://www.techdirt.com/2026/03/27/hegseths-war-on-anthropic-encounters-the-first-amendment/,
548,0.0,1,187.4,hn,breakthrough,Claude's popularity is forcing it to hit the brakes on users,almog,https://www.businessinsider.com/claude-usage-caps-changes-popularity-anthropic-2026-3,
549,0.0,2,192.4,hn,breakthrough,OpenCode-LLM-proxy – use any OpenCode model via OpenAI/Anthropic/Gemini API,kochc,https://github.com/KochC/opencode-llm-proxy,
550,0.0,5,193.2,hn,breakthrough,"Anthropic's context-window.md is 18,501 tokens. 551 are content. I have notes",claylo,https://claylo.dev/articles/markdown-cosplay/,
551,0.0,5,196.4,hn,breakthrough,New Anthropic model wrecking cybersecurity stocks,minkeymaniac,https://twitter.com/DenisGobo/status/2037524649374806059,
552,0.0,2,196.9,hn,tutorial,Anthropic Economic Index Learning Curves,gmays,https://www.anthropic.com/research/economic-index-march-2026-report,
553,0.0,2,197.5,hn,breakthrough,Fork of Anthropic's Skill Creator from the Lens of Hard Worlds for Little Guys,NickNaraghi,https://github.com/bglek/skill-creator-springett,
554,0.0,4,198.8,hn,breakthrough,Anthropic tweaks timed usage limits to discourage demand during peak hours,pseudolus,https://www.theregister.com/2026/03/26/anthropic_tweaks_usage_limits/,
555,0.0,3,202.2,hn,breakthrough,Anthropic left details of an unreleased model sitting in an unsecured data trove,guessmyname,https://fortune.com/2026/03/26/anthropic-leaked-unreleased-model-exclusive-event-security-issues-cybersecurity-unsecured-data-store/,
556,0.0,2,206.0,hn,breakthrough,If you are a published author you may be entitled to compensation,october8140,https://www.anthropiccopyrightsettlement.com,
557,0.0,5,211.6,hn,meme,Show HN: I tried to reverse engineer Claude Code usage limits,aray07,https://github.com/abhishekray07/claude-meter,
558,0.0,2,212.9,hn,comparison,Show HN: Datetime-bench: which datetime formats LLMs get right (and wrong),diwank,https://github.com/MemoryStore/datetime-bench/tree/main,
559,0.0,4,213.2,hn,breakthrough,Harness design for long-running application development,rmuchall,https://www.anthropic.com/engineering/harness-design-long-running-apps,
560,0.0,2,215.6,hn,breakthrough,The Ethics Tax: Anthropic Refused The Pentagon. OpenAI Took the Deal,bustah,https://sloppish.com/ethics-tax.html,
561,0.0,1,216.0,hn,breakthrough,"Fund with Stakes in SpaceX and Anthropic Jumps 1,200% Above Asset Value",paulpauper,https://www.bloomberg.com/news/articles/2026-03-24/fund-with-spacex-and-anthropic-stakes-jumps-1-200-above-nav,
562,0.0,3,216.1,hn,breakthrough,Anthropics Buffa: a Rust implementation of protobuf,harporoeder,https://github.com/anthropics/buffa,
563,0.0,4,222.3,hn,breakthrough,Claude Code auto mode: a safer way to skip permissions,taspeotis,https://www.anthropic.com/engineering/claude-code-auto-mode,
564,0.0,5,223.4,hn,tutorial,Show HN: Agent Flow: A beautiful way to visualize Claude Code actions,daco,https://github.com/patoles/agent-flow,
565,0.0,9,236.5,hn,breakthrough,How Anthropic's Claude Thinks,shric,https://blog.bytebytego.com/p/how-anthropics-claude-thinks,
566,0.0,8,236.8,hn,breakthrough,A Former Anthropology Student from Los Angeles Might Be the George Lucas of AI,Kaibeezy,https://www.hollywoodreporter.com/movies/movie-news/gossip-goblin-zack-london-ai-films-watch-1236544634/,
567,0.0,3,239.3,hn,breakthrough,Anthropic won't acknowledge my prior art notice,alienfader,https://gist.github.com/Alienfader/9140a7311164d37a90f16600a1e4b6f1,
568,0.0,3,241.2,hn,tutorial,Show HN: Eforge – An Agentic Build System,mshark,https://github.com/eforge-build/eforge,
569,0.0,3,245.0,hn,tutorial,Show HN: First-token-only flaw in Claude Code permissions (triage bot too),Apylon777,https://spitfirecowboy.com/workshop/0008-the-receipt-was-lying/,
570,0.0,2,245.6,hn,tutorial,Show HN: Genosis – LLM cost optimization that learns from your traffic,samherder,https://usegenosis.ai/,
571,0.0,2,246.0,hn,breakthrough,"Show HN: Refrain – Generate browser automations with AI, replay them without AI",timakin,https://therefrain.ai/,
572,0.0,3,251.6,hn,breakthrough,Anthropic: A Technical and Business Model Analysis,steve_luo,https://blog.sd.idv.tw/en/posts/2026-03-25_anthropic-business-analysis/,
573,0.0,5,264.9,hn,breakthrough,Anthropic's CEO Said All Code Will Be AI-Generated in a Year (March 2025),pera,https://www.inc.com/joe-procopio/anthropics-ceo-said-all-code-will-be-ai-generated-in-a-year/91163367,
574,0.0,2,266.7,hn,personal,Ask HN: Are Anthropic structured outputs broken for you as well?,koakuma-chan,,
575,0.0,1,269.3,hn,breakthrough,Anthropic: Enable Claude to Use Your Computer from Mobile,pookieinc,https://claude.com/blog/dispatch-and-computer-use,
576,0.0,2,269.5,hn,breakthrough,I think Anthropic's approach to data poisoning is solving from the wrong end,czbond,https://coloradochris.substack.com/p/why-i-think-anthropics-approach-to,
577,0.0,3,270.1,hn,breakthrough,OpenAI offering Private Equity a return of 17.5% and early access to models,alecco,https://www.reuters.com/business/openai-sweetens-private-equity-pitch-amid-enterprise-turf-war-with-anthropic-2026-03-23/,
578,0.0,1,270.5,hn,breakthrough,"The Good King Problem: Anthropic, Twitter, and Leadership-Dependent Architecture",jlzsignal,https://www.wanderingwonderingstar.com/p/undertow-002-the-good-king-problem,
579,0.0,2,275.0,hn,personal,Ask HN: HSL 0.1 – The Human Source License. Please help refining,xdgrulez,,
580,0.0,1,278.8,hn,breakthrough,Show HN: QuarterMaster – Generate performance reviews from your GitHub activity,imponenm,https://github.com/imponenm/QuarterMaster,
581,0.0,4,283.6,hn,breakthrough,Welcome to the AI agent arms race,indigodaddy,https://www.axios.com/2026/03/23/openclaw-agents-nvidia-anthropic-perplexity,
582,0.0,3,284.1,hn,meme,OpenAI sweetens private equity pitch amid enterprise turf war with Anthropic,consumer451,https://www.reuters.com/business/openai-sweetens-private-equity-pitch-amid-enterprise-turf-war-with-anthropic-2026-03-23/,
583,0.0,5,284.5,hn,breakthrough,Anthropic for Science Blog,rvz,https://www.anthropic.com/research/introducing-anthropic-science,
584,0.0,4,285.2,hn,breakthrough,Anthropic builds Rust support for ConnectRPC,abhinavg,https://github.com/anthropics/connect-rust,
585,0.0,2,288.1,hn,breakthrough,History of Anthropic,johnxie,https://www.taskade.com/blog/anthropic-claude-history,
586,0.0,1,292.4,hn,breakthrough,Anthropomorphic Polygons,ttd,https://en.wikipedia.org/wiki/Anthropomorphic_polygon,
587,0.0,3,292.9,hn,breakthrough,The Myspace Dilemma Facing ChatGPT,thm,https://www.theatlantic.com/ideas/2026/03/openai-economy-competition-anthropic/686420/,
588,0.0,1,293.4,hn,tutorial,"Show HN: Oo – compress output for coding agents (cargo test → ""47 passed, 2.1s"")",jannniii,https://github.com/randomm/oo,
589,0.0,2,300.2,hn,breakthrough,Show HN: Claudebox – Your Claude Subscription as Personal API,armanj,https://github.com/ArmanJR/claudebox,
590,0.0,4,302.8,hn,breakthrough,"Amazon's Trainium lab, the chip that's won over Anthropic, OpenAI, even Apple",evo_9,https://techcrunch.com/2026/03/22/an-exclusive-tour-of-amazons-trainium-lab-the-chip-thats-won-over-anthropic-openai-even-apple/,
591,0.0,1,314.0,hn,breakthrough,OpenAI plans to almost double its headcount this year,Brajeshwar,https://fortune.com/2026/03/21/openai-double-headcount-this-year-sam-altman-anthropic-google/,
592,0.0,4,319.4,hn,breakthrough,Anthropic sent lawyers – no more Claude Max in OpenCode,BaudouinVH,https://twitter.com/thdxr/status/2034730036759339100,
593,0.0,9,320.6,hn,tutorial,Skills are quietly becoming the unit of agent knowledge,latand6,,
594,0.0,6,325.1,hn,breakthrough,Anthropic just shipped an OpenClaw killer,qwertmax,https://venturebeat.com/orchestration/anthropic-just-shipped-an-openclaw-killer-called-claude-code-channels,
595,0.0,1,342.2,hn,comparison,OpenCode vs. Anthropic,mrprincerawat,,
596,0.0,2,344.5,hn,breakthrough,"De-anthropomorphizing ""AI"": From wishful mnemonics to accurate nomenclature",adrianhoward,https://firstmonday.org/ojs/index.php/fm/article/view/14366/12152,
597,0.0,2,348.7,hn,meme,Declaration of Emil Michael: Anthropic poses security risks,1vuio0pswjnm7,https://www.courtlistener.com/docket/72379655/96/3/anthropic-pbc-v-us-department-of-war/,
598,0.0,5,361.7,hn,breakthrough,Anthropic is joining the ConnectRPC project,niyikiza,https://github.com/connectrpc/connectrpc.com/pull/334,
599,0.0,2,362.3,hn,breakthrough,Anthropic meets with House Homeland Security behind closed doors,Brajeshwar,https://www.axios.com/2026/03/19/anthropic-house-homeland-security-ai,
600,0.0,2,367.4,hn,breakthrough,Cybersecurity Skills for AI Agents (agentskills.io standard),mukul975,https://github.com/mukul975/Anthropic-Cybersecurity-Skills,
601,0.0,1,368.8,hn,meme,Show HN: Added API key support to my AI writing assistant extension,jerrygoyal,,
602,0.0,1,369.3,hn,breakthrough,Tell HN: Claude Returning 429 in OpenCode,ramon156,,
603,0.0,1,373.5,hn,breakthrough,I attended a Claude for Excel webinar that 10k people attended,dogscatstrees,https://anthropic.ondemand.goldcast.io/on-demand/dfd8dc34-c59d-469e-aad2-3b093bd8ef86,
604,0.0,10,375.6,hn,breakthrough,Pentagon: Anthropic's Chinese employees are security risks,jimmydoe,https://www.axios.com/2026/03/19/pentagon-anthropic-foreign-workforce-security-risks,
605,0.0,9,379.0,hn,breakthrough,"Anthropic's ""Claude for Open Source"" program still charged $200",arccy,https://twitter.com/i/status/2034748327628005848,
606,0.0,5,379.4,hn,breakthrough,"To Catholic thinkers, Pentagon's AI demands violate 'human dignity'",reaperducer,https://www.washingtonpost.com/nation/2026/03/19/anthropic-war-ai-catholic-church/,
607,0.0,2,381.2,hn,breakthrough,How did Anthropic do it?,gmays,https://ramp.com/velocity/ai-index-march-2026,
608,0.0,7,382.4,hn,breakthrough,"Show HN: llamafile 0.10.0 rebuilt, Qwen3.5, lfm2, Anthropic API",mzlaai,https://blog.mozilla.ai/llamafile-reloaded-whats-new-in-v0-10-0/,
609,0.0,2,383.3,hn,tutorial,Show HN: Run Claude Code with –dangerously-skip-permissions in a Docker sandbox,sayil,https://github.com/sayil/dangerously,
610,0.0,3,385.2,hn,comparison,"Show HN: React isn't the terminal UI bottleneck, the output pipeline is",nathan-cannon,,
611,0.0,2,386.2,hn,breakthrough,Reflections after 1 year at Anthropic,gmays,https://threadreaderapp.com/thread/2024567162216865922.html,
612,0.0,2,387.4,hn,tutorial,"Show HN: LLM prompts as CLI progs with args, piping, and SSH forwarding",smudgy3746,,
613,0.0,1,388.6,hn,breakthrough,The AI Spending Flip,boh,https://www.axios.com/2026/03/18/ai-enterprise-revenue-anthropic-openai,
614,0.0,1,388.9,hn,tutorial,Peak journalism: Dario interview without him and how to port your AI boyfriend,PrincessEe,https://www.vanityfair.com/news/story/dario-amodei-anthropic-ai,
615,0.0,6,393.8,hn,breakthrough,OpenCode drops Claude Pro/Max subscription support per Anthropic's legal request,kretaceous,https://github.com/anomalyco/opencode/pull/18186,
616,0.0,6,396.3,hn,breakthrough,Claude accounts from multiple countries are blocked to access for several days,geyserr,https://github.com/anthropics/claude-code/issues/34229,
617,0.0,2,399.1,hn,breakthrough,Dataset from Anthropic interviewing people on what's AI doing in life,priyanshujain,https://gist.github.com/priyanshujain/6c4c06086280f1db65db4416581cc144,
618,0.0,9,400.5,hn,breakthrough,"Anthropic's Hidden Vercel Competitor ""Antspace""",anurag,https://aprilnea.me/en/blog/reverse-engineering-claude-code-antspace,
619,0.0,3,403.2,hn,breakthrough,Anthropic dispatch: more OpenClaw competiton,gigatexal,https://old.reddit.com/r/Anthropic/comments/1rx1z5c/anthropic_launched_a_new_cowork_feature_called/,
620,0.0,2,405.4,hn,breakthrough,"FTX Owned Anthropic, Solana and SpaceX, Then Had to Sell Too Soon",wslh,https://www.forbes.com/sites/josipamajic/2026/03/18/ftx-owned-anthropic-solana-and-spacex-then-had-to-sell-too-soon/,
621,0.0,2,405.8,hn,breakthrough,Anthropic's code execution pattern for MCP cuts agent token usage from 150K – 2K,JanSchu,https://brightbean.xyz/blog/code-execution-mcp-efficient-ai-agents/,
622,0.0,4,406.9,hn,tutorial,Show HN: Ossature – Spec-driven code generation with LLMs,beshrkayali,https://ossature.dev,
623,0.0,2,407.1,hn,breakthrough,Silicon Valley Musters Behind-the-Scenes Support for Anthropic,goplayoutside,https://www.nytimes.com/2026/03/18/technology/silicon-valley-anthropic-pentagon.html,
624,0.0,1,407.8,hn,breakthrough,AI firm Anthropic seeks weapons expert to stop users from 'misuse',_____k,https://www.bbc.co.uk/news/articles/c74721xyd1wo,
625,0.0,1,410.2,hn,breakthrough,"Show HN: Yapper – free, open-source alternative to Superwhisper for macOS",ahmedlhanafy,https://github.com/ahmedlhanafy/yapper,
626,0.0,3,411.4,hn,tutorial,Show HN: Deploybase CLI – Search GPU and LLM pricing from your terminal,grasper_,https://github.com/nicalevras/deploybase-cli,
627,0.0,1,411.4,hn,tutorial,Show HN: MCP Certify – Auto-test MCP servers for security and compliance,jackgladowsky,https://github.com/jackgladowsky/mcp-certify,
628,0.0,1,411.6,hn,breakthrough,"Anthropic Captures 73% of New Enterprise AI Spending, Outpacing OpenAI",JohnWeston,https://thepolarisreport.com/brief/PR-xvZ14brd,
629,0.0,1,411.7,hn,breakthrough,Anthropic turns the tables on OpenAI in critical revenue category,Brajeshwar,https://www.axios.com/2026/03/18/ai-enterprise-revenue-anthropic-openai,
630,0.0,3,412.3,hn,breakthrough,OpenAI's First-Mover Disadvantage,ecliptik,https://www.theatlantic.com/ideas/2026/03/openai-economy-competition-anthropic/686420/,
631,0.0,1,413.6,hn,breakthrough,[BUG],ZakHussein,https://github.com/anthropics/claude-code/issues/34229,
632,0.0,1,415.5,hn,tutorial,Show HN: PingCRM – Open-source personal networking CRM,sneg55,https://github.com/sneg55/pingcrm,
633,0.0,2,419.4,hn,tutorial,"Show HN: Open-source YouTube summary, transcript chat, and timeline sidepanel",oujiangping,https://github.com/EchoTide/QuickSummarize,
634,0.0,1,426.3,hn,meme,"Show HN: Xecai, a minimal Python interface for LLM providers for RAG systems",adrianvi,https://github.com/AdrianVispalia/xecai,
635,0.0,7,427.6,hn,breakthrough,Anthropic Announces Dispatch for Claude Cowork,Handy-Man,https://www.threads.com/@boris_cherny/post/DWAE3-_E8ui,
636,0.0,1,433.5,hn,breakthrough,OpenAI Is Refocusing on Coding Tools and Enterprise as Anthropic Pulls Ahead,SinnerLig,https://qz.com/openai-coding-enterprise-anthropic,
637,0.0,2,434.3,hn,breakthrough,Show HN: Llamactl – Self-hosted LLM manager with OpenAI-compatible routing,lordmathis,https://github.com/lordmathis/llamactl,
638,0.0,1,434.7,hn,tutorial,Show HN: DashClaw – Intercept AI agent actions before they execute,ucsandman,,
639,0.0,3,436.1,hn,comparison,Show HN: FC-Eval – CLI to Benchmark Local or Cloud LLMs on Function Calling,gauravvij137,https://github.com/gauravvij/function-calling-cli,
640,0.0,3,436.1,hn,tutorial,Show HN: Flock v0.7.0 – Open Source Semantic Layer for DuckDB (C++),dorbanianas,,
641,0.0,3,455.1,hn,breakthrough,Anthropic requires your phone number,dataspun,https://support.claude.com/en/articles/8287232-verifying-your-phone-number,
642,0.0,4,459.0,hn,breakthrough,The psychological distance between us and climate disaster,speckx,https://www.anthropocenemagazine.org/2026/03/the-strange-and-persistent-psychological-distance-between-us-and-climate-disaster/,
643,0.0,1,462.1,hn,tutorial,AI Learning Resources and Guides from Anthropic,vinhnx,https://www.anthropic.com/learn,
644,0.0,5,463.6,hn,tutorial,"Show HN: Paseo – Run coding agents from your phone, desktop, or terminal (FOSS)",boudra,https://github.com/getpaseo/paseo,
