platform,tweet_id,author_handle,author_name,text,created_at,url,is_official,source_query,has_media,outbound_links,likes,retweets,replies,views,bookmarks,author_followers
x,2022198143643943381,aakashgupta,Aakash Gupta,"Your brain literally processes text differently after age 25.

The prefrontal cortex doesn’t fully myelinate until your mid-twenties. That’s the region responsible for abstract reasoning, long-term consequence modeling, and emotional regulation. When your English teacher assigned you The Great Gatsby at 16, you were reading it with a brain that couldn’t yet simulate regret.

This is why rereading hits so differently. You’re running the same input through fundamentally different neural architecture.

At 16, your brain processes Gatsby’s obsession as plot. At 35, your amygdala fires because you’ve lived through your own version of chasing something that was already gone. The text stays identical. Your pattern-matching library has 20 more years of emotional data to draw from.

There’s a compounding effect here. Every major life experience you’ve had (grief, love, failure, parenthood) creates new associative networks that literature can activate. A teenager reading King Lear has zero reference frames for watching a parent lose their mind. A 45-year-old who’s watched a parent decline reads it and their entire autobiographical memory network lights up.

The smartest readers I know reread more than they read new books. The ROI on rereading increases every year you’re alive because you are the variable that changed, and the returns compound with experience.",Fri Feb 13 06:36:22 +0000 2026,https://x.com/aakashgupta/status/2022198143643943381,False,site:twitter.com/aakashgupta/status Claude,False,[],7460,967,46,279412,2579,219336
x,2021093609622339793,aakashgupta,Aakash Gupta,"IKEA’s adult furniture optimizes for “Scandinavian minimalism,” which in practice means beige rectangles at fourteen price points. The kids section optimizes for emotional response under strict physical constraints. One produces KALLAX. The other produces a lamp that strangers instinctively pet.

That giraffe is from IKEA’s GREJSIMOJS collection, which launched this month. Twenty designers collaborated on 33 pieces with one rule: every item has to make people smile. The designer, Marta Krupińska, said every person who walked past her desk in Älmhult patted the giraffe prototype on the head. Adults. In a corporate office. Petting a lamp.

This tells you everything about how constraint drives design quality. Children’s products face the strictest safety testing IKEA runs. Rounded edges, non-toxic materials, no cables, no small parts. The giraffe is battery-operated, auto-shuts off after 15 minutes, and costs $39. The designer said she had to redesign it multiple times to meet safety requirements, and each constraint forced a better solution.

The GREJSIMOJS collection came directly from IKEA’s Play Report research showing parents want to play more with their kids but lack the space and inspiration. So IKEA built a 33-piece product line around a behavioral insight rather than a style trend. Cat-shaped storage bins. A stool with antlers. A dog-shaped dimmable table lamp. The entire line starts at $5 and £1 from every UK sale goes to the Baby Bank Alliance.

The adult catalog can hide mediocre design behind premium materials and aspirational photography. At $39 with safety constraints that eliminate every shortcut, the only lever left is whether the object makes a three-year-old smile. That’s a harder design brief than anything in the living room section. And the 151K likes on this tweet tell you which approach people actually respond to.",Tue Feb 10 05:27:21 +0000 2026,https://x.com/aakashgupta/status/2021093609622339793,False,site:twitter.com/aakashgupta/status Claude,False,[],12588,716,25,1542318,2986,219336
